"A supplemental exhaust fan is not required in a kitchen where the principal ventilation fan draws from that kitchen and other rooms, provided the principal ventilation fan can be switched to a high exhaust rate equal to not less than 2.5 times the minimum normal operating exhaust capacity specified in Table 9.32.3.3., and the high exhaust rate of the principal ventilation fan, as described in Clause 9.32.3.7.(3)(a), is activated by a manual switch in the kitchen labeled ""KITCHEN EXHAUST.""","A supplemental exhaust fan is not required in a kitchen where the principal ventilation fan draws from that kitchen and other rooms, provided the principal ventilation fan can be switched to a high exhaust rate equal to not less than 2.5 times the minimum normal operating exhaust capacity specified in Table 9.32.3.3., and the high exhaust rate of the principal ventilation fan, as described in Sentence 9.32.3.7.(3), is activated by a manual switch in the kitchen labeled ""KITCHEN EXHAUST.""","Except for a supply air system described in Sentence 9.32.3.4.(2) or (3), all joints in exhaust ducts, and in supply ducts that conduct conditioned air, shall be sealed against air leakage with sealants or gaskets made from liquids, mastics or heat-applied materials, mastic with embedded fabric, foil-faced butyl tape, or aluminum foil tape.","Except for a supply air system described in Sentence 9.32.3.4.(2) or (3), all joints in exhaust ducts, and in supply ducts that conduct conditioned air, shall be sealed against air leakage with sealants or gaskets made from liquids, mastics or heat-applied materials, mastic with embedded fabric, foil-faced butyl tape, or aluminum foil tape.",1.0
The provision of makeup air as described in Sentence 9.32.3.8.(2) is not required for mechanical exhausting devices operating a subfloor depressurization system installed for the purpose of reducing the risk of radon ingress. (See Note A-9.32.3.9.),The provision of makeup air as described in Sentence 9.32.3.8.(2) is not required for mechanical exhausting devices operating a subfloor depressurization system installed for the purpose of reducing the risk of radon ingress.,,,0.0
Air duct distribution systems serving one of the dwelling units in a house with a secondary suite shall not be directly interconnected with other parts of the house.,Air duct distribution systems serving one of the dwelling units in a house with a secondary suite shall not be directly interconnected with other parts of the house.,Reserved.,,1.0
Service water heating systems that use solar thermal technology shall be installed in accordance with the NPC.,Service water heating systems that use solar thermal technology shall be installed in accordance with the NPC.,Service water heating systems that use solar thermal technology shall be installed in accordance with the Book II (Plumbing of this Code.,Service water heating systems that use solar thermal technology shall be installed in accordance with the Book II (Plumbing of this Code.,1.0
Service water heating systems that use solar thermal technology shall be installed in accordance with the NPC.,Service water heating systems that use solar thermal technology shall be installed in accordance with the NPC.,Service water heating systems that use solar thermal technology shall be installed in accordance with the Book II (Plumbing of this Code.,Service water heating systems that use solar thermal technology shall be installed in accordance with the Book II (Plumbing of this Code.,1.0
Clear heights under beams and ducting in secondary suites shall be not less than 1.85 m.,Clear heights under beams and ducting in secondary suites shall be not less than 1.85 m.,Reserved.,,1.0
Areas in rooms or spaces over which ceiling height and clear height are not less than the minimum specified in Table 9.5.3.1. or Sentence 9.5.3.1.(2)or 9.5.3.1.(3) shall be contiguous with the entry or entries to those rooms or spaces.,Areas in rooms or spaces over which ceiling height and clear height are not less than the minimum specified in Table 9.5.3.1. or Sentence 9.5.3.1.(2) or 9.5.3.1.(3) shall be contiguous with the entry or entries to those rooms or spaces.,Areas in rooms or spaces over which ceiling height and clear height are not less than the minimum specified in Table 9.5.3.1. shall be contiguous with the entry or entries to those rooms or spaces.,Areas in rooms or spaces over which ceiling height and clear height are not less than the minimum specified in Table 9.5.3.1. shall be contiguous with the entry or entries to those rooms or spaces.,1.0
Minimum sizes of doorways and doors within a barrier-free path of travel shall conform to Section 9.5.,Minimum sizes of doorways and doors within a barrier-free path of travel shall conform to part 9.,"Skylights and their components shall be designed, constructed and installed so that they resist snow loads.","Skylights and their components shall be designed, constructed and installed so that they resist snow loads.",1.0
Properties of windows and doors within exits shall conform to Section 9.9.,Properties of windows and doors within exits shall conform to part 9.,Reserved.,,1.0
Windows and skylights installed to provide required non-heating season ventilation shall conform to Article 9.32.2.2.,Windows and skylights installed to provide required non-heating season ventilation shall conform to Article 9.32.2.2.,"Windows and doors described in Sentence (1) do not require a thermal break where they reserved, are installed as storm windows and doors, or are required to have a fire-protection rating.","Windows and doors described in Sentence (1) do not require a thermal break where they reserved, are installed as storm windows and doors, or are required to have a fire-protection rating.",1.0
Minimum sizes of doorways and doors within a barrier-free path of travel shall conform to Section 9.5.,Minimum sizes of doorways and doors within a barrier-free path of travel shall conform to part 9.,"Skylights and their components shall be designed, constructed and installed so that they resist snow loads.","Skylights and their components shall be designed, constructed and installed so that they resist snow loads.",1.0
"Except as provided in Sentences 9.7.3.1.(2)to 9.7.3.1.(4), windows, doors and skylights and their components separating conditioned space from unconditioned space or the exterior shall be designed, constructed and installed so that, when in the closed position, they resist the ingress of precipitation into interior space (see Note A-9.7.4.2.(1)), resist wind loads, control air leakage, resist the ingress of insects and vermin, where required, resist forced entry, and are easily operable when not intended to be fixed.","Except as provided in Sentences 9.7.3.1.(2) to 9.7.3.1.(4), windows, doors and skylights and their components separating conditioned space from unconditioned space or the exterior shall be designed, constructed and installed so that, when in the closed position, they resist the ingress of precipitation into interior space (see Note A-9.7.4.2.(1)), resist wind loads, control air leakage, resist the ingress of insects and vermin, where required, resist forced entry, and are easily operable when not intended to be fixed.",,,0.0
"Skylights and their components shall be designed, constructed and installed so that they resist snow loads.","Skylights and their components shall be designed, constructed and installed so that they resist snow loads.","Windows, doors and skylights with or without storm doors or sash that are installed in portions of buildings where the intended use of the interior space will result in high moisture generation shall be designed in conformance with Section 5.3. (See Note A-9.25.5.2.)",,1.0
"Metal frames and sash of windows, doors and skylights shall incorporate a thermal break.","Metal frames and sash of windows, doors and skylights shall incorporate a thermal break.","Windows, doors, skylights and their components that are required to have a fire-protection rating need not conform to this Subsection.","Windows, doors, skylights and their components that are required to have a fire-protection rating need not conform to this Subsection.",1.0
"Except as provided in Sentence 9.8.4.5.(2) and Article 9.8.4.6., where a flight of stairs consists of both tapered treads and rectangular treads, all the treads shall have a uniform run when measured at a point 300 mm from the centre line of the inside handrail.","Except as provided in Sentence 9.8.4.5.(2) and Article 9.8.4.6., where a flight of stairs consists of both tapered treads and rectangular treads, all the treads shall have a uniform run when measured at a point 300 mm from the centre line of the inside handrail.",Tapered treads in a flight shall have a uniform run in accordance with the construction tolerances stipulated in Sentence (3) when measured at a point 300 mm from the centre line of the handrail as described in Sentence 9.8.7.1.(5).,,1.0
"Where tapered treads are located at the bottom of a mixed-tread flight, the run of the tapered treads when measured at a point 300 mm from the centre line of the inside handrail is permitted to exceed the run of the rectangular treads. (See Note A-9.8.4.6.)","Where tapered treads are located at the bottom of a mixed-tread flight, the run of the tapered treads when measured at a point 300 mm from the centre line of the inside handrail is permitted to exceed the run of the rectangular treads.",The slope of treads shall not exceed 1 in 50.,,1.0
"Self-service storage buildings shall be classified as Group F, Division 2 major occupancies.","Self-service storage buildings shall be classified as Group F, Division 2 major occupancies.","Where there is a vertical addition of one storey and of more than 600 m² in floor area, or of two or more storeys regardless of floor area, access shall be provided to all additional storeys, and the additional storeys shall conform to Subsections 3.8.2. and 3.8.3.","Where there is a vertical addition of one storey and of more than 600 m² in floor area, or of two or more storeys regardless of floor area, access shall be provided to all additional storeys, and the additional storeys shall conform to Subsections 3.8.2. and 3.8.3.",1.0
Fire separations required by Sentences 3.3.1.1.(1)and 3.3.5.9.(1) need not be provided between individual self-service storage units.,Fire separations required by Sentences 3.3.1.1.(1) and 3.3.5.9.(1) need not be provided between individual self-service storage units.,"Within an adaptable dwelling unit, doorways providing access to common living areas and at least one bathroom and one bedroom shall have a clear width of not less than 810 mm when measured in accordance with Clauses 3.8.3.6.(2)(a) and (b). (See Note A-3.8.5.4.(1).)","Within an adaptable dwelling unit, doorways providing access to common living areas and at least one bathroom and one bedroom shall have a clear width of not less than 810 mm when measured in accordance with Clauses 3.8.3.6.(2)(a) and (b). (See Note A-3.8.5.4.(1).)",1.0
"Materials, design, construction and installation of windows, doors and skylights that separate conditioned space from unconditioned space or the exterior but that are not covered in the scope of CSA AAMA/WDMA/CSA 101/I.S.2/A440-11 NAFS – North American Fenestration Standard/Specification for Windows, Doors, and Skylights shall conform to the remainder of this Subsection or Subsection 9.7.4., and the applicable requirements in Subsection 9.7.6., or to Part 5.","Materials, design, construction and installation of windows, doors and skylights that separate conditioned space from unconditioned space or the exterior but that are not covered in the scope of CSA AAMA/WDMA/CSA 101/I.S.2/A440-11 NAFS North American Fenestration Standard/Specification for Windows, Doors, and Skylights shall conform to the remainder of this Subsection or part 9., and the applicable requirements in part 9., or to Part 5.","Exterior doors shall have a pin type locking mechanism, with a minimum 9 mm throw into the frame, or an equivalent locking mechanism, operable from the interior without the use of keys, special devices or specialized knowledge of the locking mechanism, or conform to at least Grade 10 in ASTM F842, ""Standard Test Methods for Measuring the Forced Entry Resistance of Sliding Door Assemblies, Excluding Glazing Impact.""","Exterior doors shall have a pin type locking mechanism, with a minimum 9 mm throw into the frame, or an equivalent locking mechanism, operable from the interior without the use of keys, special devices or specialized knowledge of the locking mechanism, or conform to at least Grade 10 in ASTM F842, ""Standard Test Methods for Measuring the Forced Entry Resistance of Sliding Door Assemblies, Excluding Glazing Impact.""",1.0
"For the purpose of compliance with this Code as required in Clause 1.2.1.1.(1)(b), the objectives and functional statements attributed to the acceptable solutions in this Part shall be the objectives and functional statements listed in Table 9.37.1.1. (See Note A-1.1.2.1.(1).) (See Note D-2.6., Background Information.)",,"For the purpose of compliance with this Code as required in Clause 1.2.1.1.(1)(b) of Division A, the objectives and functional statements attributed to the acceptable solutions in this Part shall be the objectives andfunctionalstatements listed in Table 9.38.1.1. (See Note A-1.1.2.1.(1).)","For the purpose of compliance with this Code as required in Clause 1.2.1.1.(1)(b) of Division A, the objectives and functional statements attributed to the acceptable solutions in this Part shall be the objectives andfunctionalstatements listed in Table 9.38.1.1. (See Note A-1.1.2.1.(1).)",1.0
A dwelling unit referred to in Sentence 3.9.3.1.(2) shall be separated from individual self-service storage units by a fire separation having a fire-resistance rating not less than 2 h.,A dwelling unit referred to in Sentence 3.9.3.1.(2) shall be separated from individual self-service storage units by a fire separation having a fire-resistance rating not less than 2 h.,"Buildings containing adaptable dwelling units shall be provided with an accessible path of travel conforming to Subsection 3.8.3. to an entrance described in Article 3.8.2.2. and to each adaptable dwelling unit from a sidewalk, roadway or street, where provided, a parking area, where provided, passenger-loading zones, and where an elevator is provided, to an elevator conforming to Article 3.5.2.1., conform to Sentence 3.8.2.2.(6), and provide access to all common facilities.","Buildings containing adaptable dwelling units shall be provided with an accessible path of travel conforming to Subsection 3.8.3. to an entrance described in Article 3.8.2.2. and to each adaptable dwelling unit from a sidewalk, roadway or street, where provided, a parking area, where provided, passenger-loading zones, and where an elevator is provided, to an elevator conforming to Article 3.5.2.1., conform to Sentence 3.8.2.2.(6), and provide access to all common facilities.",1.0
"Except as provided in Sentence 3.7.2.1.(1), two public washrooms, each containing a water closet and a lavatory, shall be provided within one of the self-service storage buildings on the property. (See Note A-3.9.3.2.(1).)","Except as provided in Sentence 3.7.2.1.(1), two public washrooms, each containing a water closet and a lavatory, shall be provided within one of the self-service storage buildings on the property. (See Note A-3.9.3.2.(1).)","Walls adjacent to the water closet and bathtub or shower shall accommodate the future installation of grab bars conforming to Clauses 3.8.3.11.(1)(e) and (f) for water closets, and Clause 3.8.3.16.(1)(f) for showers or 3.8.3.17.(1)(f) for bathtubs. (See Note A-3.8.5.5.(2).)","Walls adjacent to the water closet and bathtub or shower shall accommodate the future installation of grab bars conforming to Clauses 3.8.3.11.(1)(e) and (f) for water closets, and Clause 3.8.3.16.(1)(f) for showers or 3.8.3.17.(1)(f) for bathtubs. (See Note A-3.8.5.5.(2).)",1.0
"Where buildings conforming to Sentence 3.2.2.58.(2) include non-contiguous roof assemblies at different elevations, the roof assemblies are permitted to be evaluated separately to determine which ones are required to be constructed in accordance with Clause 3.2.2.58.(2)(c).",,"Group A, Division 2 major occupancies, Group E major occupancies, Group F, Division 2 and 3 major occupancies and storage garages located in a building or part of a building within the scope of this Article are permitted to be constructed in accordance with this Article provided the Group A, Division 2 major occupancy, and Group E major occupancy, and Group F, Division 2 and 3 major occupancy is located below the third storey, and the storage garage is located below the fourth storey (See also Sentence 4.4.2.1.(1)). (See Note A-3.2.2.50.(5) and 3.2.2.58.(4).)","Group A, Division 2 major occupancies, Group E major occupancies, Group F, Division 2 and 3 major occupancies and storage garages located in a building or part of a building within the scope of this Article are permitted to be constructed in accordance with this Article provided the Group A, Division 2 major occupancy, and Group E major occupancy, and Group F, Division 2 and 3 major occupancy is located below the third storey, and the storage garage is located below the fourth storey (See also Sentence 4.4.2.1.(1)). (See Note A-3.2.2.50.(5) and 3.2.2.58.(4).)",1.0
"Where a fuel-burning appliance is installed in a suite of residential occupancy, a CO alarm shall be installed inside each bedroom, or outside each bedroom, within 5 m of each bedroom door, measured following corridors and doorways.","Where a fuel-burning appliance is installed in a suite of residential occupancy, a CO alarm shall be installed inside each bedroom, or outside each bedroom, within 5 m of each bedroom door, measured following corridors and doorways.","Where a fuel-burning appliance is installed in a suite of residential occupancy, a CO alarm shall be installed inside each bedroom, or outside each bedroom, within 5 m of each bedroom door, measured following corridors and doorways.","Where a fuel-burning appliance is installed in a suite of residential occupancy, a CO alarm shall be installed inside each bedroom, or outside each bedroom, within 5 m of each bedroom door, measured following corridors and doorways.",1.0
