National Sentence Text,Matched National Sentence (Variation),P/T Sentence Text,Matched P/T Sentence (Variation),Similarity
A building conforming to Article 3.2.2.50.or 3.2.2.58. is permitted to contain a storage garage below the fourth storey. (See Note A-3.1.3.2.(3) to (5).) (See also Sentence 4.4.2.1.(1).),A building conforming to Article 3.2.2.50. or 3.2.2.58. is permitted to contain a storage garage below the fourth storey. (See Note A-3.1.3.2.(3).) (See also Sentence 4.4.2.1.(1).),Reserved.,,1.0
"Except as permitted in Sentence 3.2.4.20.(13), a manually operated silencing device shall be incorporated within the circuitry of a smoke alarm installed in a dwelling unit so that it will silence the signal emitted by the smoke alarm for a period of not more than 10 min, after which the smoke alarm will reset and again sound the alarm if the level of smoke in the vicinity is sufficient to reactuate the smoke alarm.","Except as permitted in Sentence 3.2.4.20.(13), a manually operated silencing device shall be incorporated within the circuitry of a smoke alarm installed in a dwelling unit so that it will silence the signal emitted by the smoke alarm for a period of not more than 10 min, after which the smoke alarm will reset and again sound the alarm if the level of smoke in the vicinity is sufficient to reactuate the smoke alarm.","Except as permitted in Sentence (13), a manually operated silencing device shall be incorporated within the circuitry of a smoke alarm installed in a dwelling unit so that it will silence the signal emitted by the smoke alarm for a period of not more than 10 min, after which the smoke alarm will reset and again sound the alarm if the level of smoke in the vicinity is sufficient to reactuate the smoke alarm.","Except as permitted in Sentence (13), a manually operated silencing device shall be incorporated within the circuitry of a smoke alarm installed in a dwelling unit so that it will silence the signal emitted by the smoke alarm for a period of not more than 10 min, after which the smoke alarm will reset and again sound the alarm if the level of smoke in the vicinity is sufficient to reactuate the smoke alarm.",1.0
"Suites of residential occupancy equipped with smoke detectors installed to ULC CAN/ULC-S524-14 Installation of Fire Alarm Systems as part of the fire alarm system in lieu of smoke alarms as permitted by Sentence 3.2.4.20.(8), need not incorporate the manually operated device required in Sentence 3.2.4.20.(12). (See Note A-3.2.4.20.(8).)","Suites of residential occupancy equipped with smoke detectors installed to ULC CAN/ULC-S524-14 Installation of Fire Alarm Systems as part of the fire alarm system in lieu of smoke alarms as permitted by Sentence 3.2.4.20.(8), need not incorporate the manually operated device required in Sentence 3.2.4.20.(12). (See Note A-3.2.4.20.(8).)","Suites of residential occupancy equipped with smoke detectors installed to CAN/ULC-S524, ""Installation of Fire Alarm Systems,"" as part of the fire alarm system in lieu of smoke alarms as permitted by Sentence (8), need not incorporate the manually operated device required in Sentence (12). (See Note A-3.2.4.20.(8).)","Suites of residential occupancy equipped with smoke detectors installed to CAN/ULC-S524, ""Installation of Fire Alarm Systems,"" as part of the fire alarm system in lieu of smoke alarms as permitted by Sentence (8), need not incorporate the manually operated device required in Sentence (12). (See Note A-3.2.4.20.(8).)",1.0
"Where the facility is not equipped with staff trained to provide instructions over the loudspeakers, a pre-recorded message shall be provided.","Where the facility is not equipped with staff trained to provide instructions over the loudspeakers, a pre-recorded message shall be provided.",,,0.0
"Except for Group B, Division 1 and Group F, Division 1 major occupancies, where a fire alarm system is required under Subsection 3.2.4., a one-way voice communication system shall be installed in buildings where a 2-stage fire alarm system is installed and whose occupant load exceeds 1 000.","Except for Group B, Division 1 and Group F, Division 1 major occupancies, where a fire alarm system is required under part 3., a one-way voice communication system shall be installed in buildings where a 2-stage fire alarm system is installed and whose occupant load exceeds 1 000.","Except for Group B, Division 1 and Group F, Division 1 major occupancies, where a fire alarm system is required under Subsection 3.2.4., a voice communication system shall be installed in buildings where a 2-stage fire alarm system is installed and whose occupant load exceeds 1 000.","Except for Group B, Division 1 and Group F, Division 1 major occupancies, where a fire alarm system is required under Subsection 3.2.4., a voice communication system shall be installed in buildings where a 2-stage fire alarm system is installed and whose occupant load exceeds 1 000.",1.0
The requirements in Part 3 regarding occupant load shall not apply to self-service storage buildings.,The requirements in Part 3 regarding occupant load shall not apply to self-service storage buildings.,"An entrance to an addition shall be accessible except where the addition is accessible by an accessible path of travel from an accessible entrance serving the existing building, and not less than 50% of the pedestrian entrances to the building are accessible.","An entrance to an addition shall be accessible except where the addition is accessible by an accessible path of travel from an accessible entrance serving the existing building, and not less than 50% of the pedestrian entrances to the building are accessible.",1.0
"Subsection 3.2.3. need not apply between buildings within a group of self-service storage buildings, where the distance between these buildings is at least 6 m.","part 3. need not apply between buildings within a group of self-service storage buildings, where the distance between these buildings is at least 6 m.","Where an addition is required to be accessible, facilities located in the existing building that are necessary to the operation of the addition shall be accessible.","Where an addition is required to be accessible, facilities located in the existing building that are necessary to the operation of the addition shall be accessible.",1.0
"Except as provided in Sentences 3.9.3.1.(2)to 3.9.3.1.(6), the requirements of Section 3.3. shall apply. (See Note A-3.9.3.1.(1).)","Except as provided in Sentences 3.9.3.1.(2) to 3.9.3.1.(6), the requirements of part 3. shall apply. (See Note A-3.9.3.1.(1).)",The egress requirements of Article 3.3.1.7. shall apply to the vertical additions described in Sentence 3.8.4.3.(1).,The egress requirements of Article 3.3.1.7. shall apply to the vertical additions described in Sentence 3.8.4.3.(1).,1.0
Other fenestration assemblies and their components shall meet the heat transfer performance requirements stated in Section 5.3. (See Note A-5.9.3.3.(1).),Other fenestration assemblies and their components shall meet the heat transfer performance requirements stated in part 5. (See Note A-5.9.3.3.(1).),"Exterior insulation finish systems and their components shall comply with Subsection 5.1.4. and Sections 5.3. to 5.6., and CAN/ULC-S716.1, ""Exterior Insulation and Finish Systems (EIFS) – Materials and Systems,"" where covered in the scope of that standard. (See Note A-5.9.4.1.(1).)",,1.0
Words that appear in italics are defined in Article 1.4.1.2..,Words that appear in italics are defined in Article 1.4.1.2..,Words that appear in italics are defined in Article 1.4.1.2. of Division A.,,1.0
Fire safety at construction and demolition sites shall conform to Section 5.6. of Division B of the NFC.,Fire safety at construction and demolition sites shall conform to Section 5.6. of Division B of the NFC.,"Fire safety at construction and demolition sites shall conform to CAN/CSA S350-M, ""Code of Practice for Safety in Demolition of Structures,"" and Section 5.6. of Division B of the British Columbia Fire Code.","Fire safety at construction and demolition sites shall conform to CAN/CSA S350-M, ""Code of Practice for Safety in Demolition of Structures,"" and Section 5.6. of Division B of the British Columbia Fire Code.",1.0
Words that appear in italics are defined in Article 1.4.1.2..,Words that appear in italics are defined in Article 1.4.1.2..,Words that appear in italics are defined in Article 1.4.1.2. of Division A.,,1.0
,,"If a building is divided by fire separations into fire compartments, the area of exposing building face is permitted to be calculated for each fire compartment provided the fire separations have a fire-resistance ratings not less than 45 min.","If a building is divided by fire separations into fire compartments, the area of exposing building face is permitted to be calculated for each fire compartment provided the fire separations have a fire-resistance ratings not less than 45 min.",0.0
"Where the exposing building face of any section of an exterior wall enclosing a single room or space, or combination room and space, has a limiting distance of 2 m or less, that section of the exposing building face serving the room or space shall not be divided into portions for the purpose of calculating area of exposing building face. (See Sentence 9.10.15.4.(5) and Note A-9.10.15.4.(2).)","Where the exposing building face of any section of an exterior wall enclosing a single room or space, or combination room and space, has a limiting distance of 2 m or less, that section of the exposing building face serving the room or space shall not be divided into portions for the purpose of calculating area of exposing building face. (See Sentence 9.10.15.4.(5) and Note A-9.10.15.4.(2).)","Where the exposing building face of any section of an exterior wall enclosing a single room or space, or combination room and space, has a limiting distance of 2 m or less, that section of the exposing building face serving the room or space shall not be divided into portions for the purpose of calculating area of exposing building face. (See Sentence 9.10.15.4.(5) and Note A-9.10.15.4.(2).)","Where the exposing building face of any section of an exterior wall enclosing a single room or space, or combination room and space, has a limiting distance of 2 m or less, that section of the exposing building face serving the room or space shall not be divided into portions for the purpose of calculating area of exposing building face. (See Sentence 9.10.15.4.(5) and Note A-9.10.15.4.(2).)",1.0
"Except as permitted in Article 9.10.2.4., in any building containing more than one major occupancy in which one major occupancy is located entirely above another, the requirements of Article 9.10.8.1. for each portion of the building containing a major occupancy shall be applied to that portion as if the entire building was of that major occupancy.","Except as permitted in Article 9.10.2.4., in any building containing more than one major occupancy in which one major occupancy is located entirely above another, the requirements of Article 9.10.8.1. for each portion of the building containing a major occupancy shall be applied to that portion as if the entire building was of that major occupancy.","Except as permitted in Article 9.10.2.4., in any building containing more than one major occupancy in which one major occupancy is located entirely above another, the requirements of Article 9.10.8.1. for each portion of the building containing a major occupancy shall be applied to that portion as if the entire building was of that major occupancy.","Except as permitted in Article 9.10.2.4., in any building containing more than one major occupancy in which one major occupancy is located entirely above another, the requirements of Article 9.10.8.1. for each portion of the building containing a major occupancy shall be applied to that portion as if the entire building was of that major occupancy.",1.0
"In a building containing more than one major occupancy, where the aggregate area of all major occupancies in a particular group or division does not exceed 10% of the floor area on the storey on which they are located, they need not be considered as major occupancies for the purposes of Articles 9.10.8.1.and 9.10.2.3. provided they are not classified as Group F, Division 2 occupancies.","In a building containing more than one major occupancy, where the aggregate area of all major occupancies in a particular group or division does not exceed 10% of the floor area on the storey on which they are located, they need not be considered as major occupancies for the purposes of Articles 9.10.8.1. and 9.10.2.3. provided they are not classified as Group F, Division 2 occupancies .","In a building containing more than one major occupancy, where the aggregate area of all major occupancies in a particular group or division does not exceed 10% of the floor area on the storey on which they are located, they need not be considered as major occupancies for the purposes of Articles 9.10.8.1. and 9.10.2.3. provided they are not classified as Group F, Division 2 occupancies.",,1.0
"In houses that contain a secondary suite, heating-season ventilation need not be provided for exits, public corridors, and ancillary spaces that are not within a dwelling unit, except as provided in Sentence 9.32.1.2.(4). (See Note A-9.32.1.2.(2).)","In houses that contain a secondary suite, heating-season ventilation need not be provided for exits, public corridors, and ancillary spaces that are not within a dwelling unit, except as provided in Sentence 9.32.1.2.(4).",Reserved.,,1.0
"The requirement for a principal ventilation fan may be satisfied by a single fan, by the exhaust side of a heat recovery ventilator, or by a group of fans, provided all fans in the group are controlled simultaneously by a controller complying with Sentences 9.32.3.3.(5), 9.32.3.3.(6)and 9.32.3.3.(7). (See Note A-9.32.3.3.(3).)","The requirement for a principal ventilation fan may be satisfied by a single fan, by the exhaust side of a heat recovery ventilator, or by a group of fans, provided all fans in the group are controlled simultaneously by a controller complying with Sentences 9.32.3.3.(5) , 9.32.3.3.(6) and 9.32.3.3.(7). (See Note A-9.32.3.3.(3).)","Except as provided in Sentence (6), a principal ventilation system shall mechanically provide supply air in accordance with Sentence (2), (3), (4) or (5).","Except as provided in Sentence (6), a principal ventilation system shall mechanically provide supply air in accordance with Sentence (2), (3), (4) or (5).",1.0
"The principal ventilation fan shall be controlled by a manual switch located within the living area of the dwelling unit and clearly marked ""VENTILATION FAN."" (See Note A-9.32.3.3.(5).)","The principal ventilation fan shall be controlled by a manual switch located within the living area of the dwelling unit and clearly marked ""VENTILATION FAN."" (See Note A-9.32.3.3.(5).)","Where the principal ventilation system is a ducted forced-air heating system, the ducted forced-air heating system shall provide supply air through the ducting to each bedroom, and each floor level without a bedroom, draw supply air from an outdoor inlet that is connected to the cabinet containing the furnace air circulating fan required by Clause (d) by ducting that measures, from that cabinet to the point at which the ducting intersects the return air plenum, between 3 m and 4.5 m in length, or if a flow control device is used, not more than 4.5 m in length, draw supply air through ducting that is rigid ducting with an equivalent diameter of at least 100 mm, or flexible ducting with an equivalent diameter of at least 125 mm, and have a furnace air circulating fan set to run continuously.","Where the principal ventilation system is a ducted forced-air heating system, the ducted forced-air heating system shall provide supply air through the ducting to each bedroom, and each floor level without a bedroom, draw supply air from an outdoor inlet that is connected to the cabinet containing the furnace air circulating fan required by Clause (d) by ducting that measures, from that cabinet to the point at which the ducting intersects the return air plenum, between 3 m and 4.5 m in length, or if a flow control device is used, not more than 4.5 m in length, draw supply air through ducting that is rigid ducting with an equivalent diameter of at least 100 mm, or flexible ducting with an equivalent diameter of at least 125 mm, and have a furnace air circulating fan set to run continuously.",1.0
"The principal ventilation fan control required by Sentence 9.32.3.3.(5) shall be wired in such a way that activation of the principal ventilation fan automatically activates the outdoor air supply fan required by Sentence 9.32.3.5.(2), and the outdoor air supply fan does not operate when the principal ventilation fan is not operating.","The principal ventilation fan control required by Sentence 9.32.3.3.(5) shall be wired in such a way that activation of the principal ventilation fan automatically activates the outdoor air supply fan required by Sentence 9.32.3.5.(2), and the outdoor air supply fan does not operate when the principal ventilation fan is not operating.","For the purposes of Sentence (1), the capacity rating of the exhaust fan shall be determined, based on air-flow performance at 50 pa of external static pressure, in accordance with HVI Publication 916, ""Airflow Test Procedure,"" or CAN/CSA-C260-M, ""Rating the Performance of Residential Mechanical Ventilating Equipment.""","For the purposes of Sentence (1), the capacity rating of the exhaust fan shall be determined, based on air-flow performance at 50 pa of external static pressure, in accordance with HVI Publication 916, ""Airflow Test Procedure,"" or CAN/CSA-C260-M, ""Rating the Performance of Residential Mechanical Ventilating Equipment.""",1.0
"Except as provided in Sentence 9.32.3.6.(3), where an exhaust-only system is installed, the principal ventilation fan control required by Sentence 9.32.3.3.(5) shall be wired in such a way that, where applicable, activation of the principal ventilation fan automatically activates the circulation fan of the forced air distribution system required by Clause 9.32.3.6.(1)(b) at its rated capacity.","Except as provided in Sentence 9.32.3.6.(3), where an exhaust-only system is installed, the principal ventilation fan control required by Sentence 9.32.3.3.(5) shall be wired in such a way that, where applicable, activation of the principal ventilation fan automatically activates the circulation fan of the forced air distribution system required by Sentence 9.32.3.6.(1) at its rated capacity.","Where an exhaust duct passes through or is located adjacent to a space that is not conditioned space, the duct shall conform to Article 9.36.3.2., except that in no case shall such a duct be insulated to less than RSI 0.75.","Where an exhaust duct passes through or is located adjacent to a space that is not conditioned space, the duct shall conform to Article 9.36.3.2., except that in no case shall such a duct be insulated to less than RSI 0.75.",1.0
The outdoor air supply fan shall be connected to the outdoors through an outdoor air supply duct.,The outdoor air supply fan shall be connected to the outdoors through an outdoor air supply duct.,"Where a crawl space is heated by a ducted forced-air heating system that does not draw air from the crawl space to the furnace through the return air plenum, the crawl space shall be connected to the floor space above the crawl space by at least one air-transfer grille.","Where a crawl space is heated by a ducted forced-air heating system that does not draw air from the crawl space to the furnace through the return air plenum, the crawl space shall be connected to the floor space above the crawl space by at least one air-transfer grille.",1.0
"Except as provided in Sentences 9.32.3.7.(2)and 9.32.3.7.(3), a supplemental exhaust fan with a rated capacity not less than 50 L/s shall be installed in each kitchen.","Except as provided in Sentences 9.32.3.7.(2) and 9.32.3.7.(3), a supplemental exhaust fan with a rated capacity not less than 50 L/s shall be installed in each kitchen.",,,0.0
"With the principal ventilation fan operating at its normal operating exhaust capacity, the airflow in the outdoor air supply duct shall be measured and the flow-regulating damper required by Sentence 9.32.3.5.(5) shall be adjusted and permanently fixed so that the airflow in the outdoor air supply duct is within ±10% of the actual normal operating exhaust capacity of the principal ventilation fan.","With the principal ventilation fan operating at its normal operating exhaust capacity, the airflow in the outdoor air supply duct shall be measured and the flow-regulating damper required by Sentence 9.32.3.5.(5) shall be adjusted and permanently fixed so that the airflow in the outdoor air supply duct is within ±10% of the actual normal operating exhaust capacity of the principal ventilation fan.","Where a crawl space is heated other than by a ducted forced-air heating system, the crawl space shall be connected to the floor space above the crawl space by at least one air-transfer grille, and the principal ventilation system by a supply air outlet or an exhaust air inlet, be connected to the floor space above the crawl space by at least 2 air-transfer grilles for every 30 m2 of crawl space area, or be connected to the floor space above the crawl space by at least one air-transfer grille, and the outdoors by a dedicated exhaust fan that complies with Sentence (4).","Where a crawl space is heated other than by a ducted forced-air heating system, the crawl space shall be connected to the floor space above the crawl space by at least one air-transfer grille, and the principal ventilation system by a supply air outlet or an exhaust air inlet, be connected to the floor space above the crawl space by at least 2 air-transfer grilles for every 30 m2 of crawl space area, or be connected to the floor space above the crawl space by at least one air-transfer grille, and the outdoors by a dedicated exhaust fan that complies with Sentence (4).",1.0
A supplemental exhaust fan is not required in a kitchen where the only exhaust air intake for the principal ventilation fan is located in that kitchen.,A supplemental exhaust fan is not required in a kitchen where the only exhaust air intake for the principal ventilation fan is located in that kitchen.,"Where a kitchen exhaust fan grille is installed within 1.2 m horizontally of a cooktop, the exhaust fan duct shall be constructed of a material that is noncombustible, corrosion-resistant, and cleanable, and be equipped with a grease filter at the intake end.","Where a kitchen exhaust fan grille is installed within 1.2 m horizontally of a cooktop, the exhaust fan duct shall be constructed of a material that is noncombustible, corrosion-resistant, and cleanable, and be equipped with a grease filter at the intake end.",1.0
"In a dwelling unit in which there is no storey without a bedroom, if an exhaust air intake for the principal ventilation fan is located in the principal living area and the principal ventilation fan has no more than 2 exhaust air intakes located in other rooms, distribution of outdoor air to the principal living area is not required.","In a dwelling unit in which there is no storey without a bedroom, if an exhaust air intake for the principal ventilation fan is located in the principal living area and the principal ventilation fan has no more than 2 exhaust air intakes located in other rooms, distribution of outdoor air to the principal living area is not required.",Exhaust ducts shall discharge to the outdoors.,Exhaust ducts shall discharge to the outdoors.,1.0
"Except as provided in Sentences 9.32.3.8.(6)to 9.32.3.8.(8), any mechanical air exhausting device, other than the principal ventilation fan operating at a rate not greater than the maximum permitted by Table 9.32.3.3., shall be provided with outdoor makeup air supplied by a fan rated to deliver outdoor air to the dwelling unit at a rate not less than the exhaust capacity of the device, and not greater than that exhaust capacity plus 10%.","Except as provided in Sentences 9.32.3.8.(6) to 9.32.3.8.(8), any mechanical air exhausting device, other than the principal ventilation fan operating at a rate not greater than the maximum permitted by Table 9.32.3.3., shall be provided with outdoor makeup air supplied by a fan rated to deliver outdoor air to the dwelling unit at a rate not less than the exhaust capacity of the device, and not greater than that exhaust capacity plus 10%.","Where additional make-up air is required for appliances described in Sentence (1), it shall be provided by a supply fan rated to deliver outdoor air at the rate of the installed exhaust appliance.","Where additional make-up air is required for appliances described in Sentence (1), it shall be provided by a supply fan rated to deliver outdoor air at the rate of the installed exhaust appliance.",1.0
