,,"Each building in a camp for housing of workers shall be provided with portable fire extinguishers in conformance with the provisions of the Fire Code made under the Fire Protection and Prevention Act, 1997.","Each building in a camp for housing of workers shall be provided with portable fire extinguishers in conformance with the provisions of the Fire Code made under the Fire Protection and Prevention Act, 1997.",0.0
"The noncombustible register protection described in Sentence 9.18.7.1.(3) shall extend not less than 300 mm beyond the projection of the register opening, and have up-turned edges. (See Note A-9.18.7.1.(4).)","The noncombustible register protection described in Sentence 9.18.7.1.(3) shall extend not less than 300 mm beyond the projection of the register opening, and have up-turned edges.",,,0.0
,,"Noncombustible material described in Sentence (3) shall, (a) extend not less than 300 mm beyond the projection of a register opening, and (b) have turned-up edges.","Noncombustible material described in Sentence (3) shall, (a) extend not less than 300 mm beyond the projection of a register opening, and (b) have turned-up edges.",0.0
Spans for built-up wood and glued-laminated timber floor beams shall conform to the spans in Span Tables 9.23.4.2.-Hto 9.23.4.2.-K. (See Article 9.4.2.2.),Spans for built-up wood and glued-laminated timber floor beams shall conform to the spans in Span Tables 9.23.4.2.-H to 9.23.4.2.-K. (See Article 9.4.2.2.),,,0.0
,,Spans for built-up wood and glued-laminated timber floor beams shall conform to the spans in Tables A-8 to A-11.,Spans for built-up wood and glued-laminated timber floor beams shall conform to the spans in Tables A-8 to A-11.,0.0
"Sill plates shall be levelled by setting them on a full bed of mortar, or laid directly on the foundation if the top of the foundation is level. (See also Article 9.23.2.3.)","Sill plates shall be levelled by setting them on a full bed of mortar, or laid directly on the foundation if the top of the foundation is level. (See also Article 9.23.2.3.)",,,0.0
,,"Sill plates shall be,(a) levelled by setting them on a full bed of mortar, or (b) laid directly on the foundation where the top of the foundation is level.","Sill plates shall be,(a) levelled by setting them on a full bed of mortar, or (b) laid directly on the foundation where the top of the foundation is level.",0.0
"Except as permitted by Sentence 9.23.9.4.(5), where strapping is specified in Span Table 9.23.4.2.-A, it shall be not less than 19 mm by 64 mm, nailed to the underside of floor joists, located not more than 2 100 mm from each support or other rows of strapping, and fastened at each end to a sill or header.","Except as permitted by Sentence (5), where strapping is specified in Span Table 9.23.4.2.-A, it shall be not less than 19 mm by 64 mm, nailed to the underside of floor joists, located not more than 2 100 mm from each support or other rows of strapping, and fastened at each end to a sill or header","Except as permitted by Sentence (5), where strapping is specified in Table A-1, it shall be,(a) not less than 19 mm by 64 mm, nailed to the underside of floor joists, (b) located not more than 2.1 m from each support or other rows of strapping, and (c) fastened at each end to a sill or header.","Except as permitted by Sentence (5), where strapping is specified in Table A-1, it shall be,(a) not less than 19 mm by 64 mm, nailed to the underside of floor joists, (b) located not more than 2.1 m from each support or other rows of strapping, and (c) fastened at each end to a sill or header.",0.938282310962677
"When framed into the side of a wood beam, joists referred to in Sentence 9.23.9.2.(1) shall be supported on joist hangers or other acceptable mechanical connectors, or not less than 38 mm by 64 mm ledger strips nailed to the side of the beam, except that 38 mm by 38 mm ledger strips may be used provided each joist is nailed to the beam by not less than four 89 mm nails, in addition to the nailing for the ledger strip required in Table 9.23.3.4.","When framed into the side of a wood beam, joists referred to in Sentence (1) shall be supported on joist hangers or other acceptable mechanical connectors, or not less than 38 mm by 64 mm ledger strips nailed to the side of the beam, except that 38 mm by 38 mm ledger strips may be used provided each joist is nailed to the beam by not less than four 89 mm nails, in addition to the nailing for the ledger strip required in Table 9.23.3.4.","When framed into the side of a wood beam, joists referred to in Sentence (1) shall be supported on,(a) joist hangers or other acceptable mechanical connectors, or (b) not less than 38 mm by 64 mm ledger strips nailed to the side of the beam, except that 38 mm by 38 mm ledger strips may be used provided each joist is nailed to the beam by at least four 89 mm nails, in addition to the nailing for the ledger strip required in Table 9.23.3.4.","When framed into the side of a wood beam, joists referred to in Sentence (1) shall be supported on,(a) joist hangers or other acceptable mechanical connectors, or (b) not less than 38 mm by 64 mm ledger strips nailed to the side of the beam, except that 38 mm by 38 mm ledger strips may be used provided each joist is nailed to the beam by at least four 89 mm nails, in addition to the nailing for the ledger strip required in Table 9.23.3.4.",0.9732184410095216
"Except as provided in Sentence 9.23.9.8.(6), non-loadbearing interior walls at right angles to the floor joists are not restricted as to location.","Except as provided in Sentence (6), non-loadbearing interior walls at right angles to the floor joists are not restricted as to location.",,,0.0
,,Non-loadbearing interior walls at right angles to the floor joists are not restricted as to location.,Non-loadbearing interior walls at right angles to the floor joists are not restricted as to location.,0.0
"Except as permitted in Sentences 9.23.11.3.(2)to 9.23.11.3.(4), at least 2 top plates shall be provided in loadbearing walls.","Except as permitted in Sentences (2) to (4), at least 2 top plates shall be provided in loadbearing walls.",,,0.0
,,"Except as permitted in Sentences (2) to (4), no fewer than two top plates shall be provided in loadbearing walls.","Except as permitted in Sentences (2) to (4), no fewer than two top plates shall be provided in loadbearing walls.",0.0
,,"Where an interior floor projects through an exterior wall to become an exterior floor, (a) the air barrier of the wall under the floor shall be continuous with or sealed to the subfloor or the air barrier on the underside of the floor, (b) the air barrier of the wall above the floor shall be continuous with or sealed to the subfloor or the air barrier on the top of the floor, and (c) the spaces between floor joists shall be blocked and sealed.","Where an interior floor projects through an exterior wall to become an exterior floor, (a) the air barrier of the wall under the floor shall be continuous with or sealed to the subfloor or the air barrier on the underside of the floor, (b) the air barrier of the wall above the floor shall be continuous with or sealed to the subfloor or the air barrier on the top of the floor, and (c) the spaces between floor joists shall be blocked and sealed.",0.0
"Where an interior floor projects through an exterior wall or extends to become an exterior floor, continuity of the air barrier system shall be maintained from the abutting walls across the floor assembly.","Where an interior floor projects through an exterior wall or extends to become an exterior floor, continuity of the air barrier system shall be maintained from the abutting walls across the floor assembly.","Where an interior floor projects through an exterior wall or extends to become an exterior floor, continuity of the air barrier system shall be maintained from the abutting walls across the floor assembly.",,0.9999999403953552
Materials listed in Tables 9.26.2.1.-Aand 9.26.2.1.-B shall be installed in conformance with the manufacturer’s written instructions. (See Sentence 1.5.1.2.(1).),Materials listed in Tables 9.26.2.1.-A and 9.26.2.1.-B shall be installed in conformance with the manufacturerâs written instructions. (See Sentence 1.5.1.2.(1).),,,0.0
,,Materials listed in Tables 9.26.2.1.A. and 9.26.2.1.B. shall be installed in conformance with the manufacturer’s instructions.,Materials listed in Tables 9.26.2.1.A. and 9.26.2.1.B. shall be installed in conformance with the manufacturerÃ¢â¬â¢s instructions.,0.0
"Except as provided in Sentence 9.23.16.1.(1), decking for wood shingled roofs may be continuous or spaced.","Except as provided in Sentence 9.23.16.1.(1), decking for wood shingled roofs may be continuous or spaced.",,,0.0
,,Decking for wood shingled roofs may be continuous or spaced.,Decking for wood shingled roofs may be continuous or spaced.,0.0
"Sealant shall be provided at vertical joints between different cladding materials unless the joint is suitably lapped or flashed to prevent the entry of rain. (See Articles 9.7.6.2., 9.20.13.12.and 9.28.1.5.)","Sealant shall be provided at vertical joints between different cladding materials unless the joint is suitably lapped or flashed to prevent the entry of rain. (See Articles 9.7.6.2. , 9.20.13.12. and 9.28.1.5.)",,,0.0
,,Sealant shall be provided at vertical joints between different cladding materials unless the joint is suitably lapped or flashed to prevent the entry of rain.,Sealant shall be provided at vertical joints between different cladding materials unless the joint is suitably lapped or flashed to prevent the entry of rain.,0.0
"Flashing and caulking used with stucco shall conform to Subsections 9.27.3. and Subsection 9.27.4., except that if aluminum flashing is used, it shall be separated from the stucco by an impervious membrane or coating. (See Article 9.7.6.2. for caulking around window frames.)","Flashing and caulking used with stucco shall conform to Subsections 9.27.3. and 9.27.4., except that if aluminum flashing is used, it shall be separated from the stucco by an impervious membrane or coating. (See Article 9.7.6.2. for caulking around window frames.)",,,0.0
,,"Flashing and sealants used with stucco shall conform to Subsections 9.27.3. and 9.27.4., except that if aluminum flashing is used, it shall be separated from the stucco by an impervious membrane or coating.","Flashing and sealants used with stucco shall conform to Subsections 9.27.3. and 9.27.4., except that if aluminum flashing is used, it shall be separated from the stucco by an impervious membrane or coating.",0.0
"In occupancies other than dwelling units, plumbing facilities, grab bars, floor drains, and floor and wall finishes around urinals shall conform to Subsection 3.7.2. (See also Section 3.8. regarding barrier-free plumbing facilities.)","In occupancies other than dwelling units, plumbing facilities, grab bars, floor drains, and floor and wall finishes around urinals shall conform to part 3. (See also part 3. regarding barrier-free plumbing facilities.)",,,0.0
,,"Plumbing facilities, grab bars, floor drains and floor and wall finishes around urinals shall conform to Subsection 3.7.4. and Article 7.1.5.2. in,(a) a recreational camp, (b) a camp for housing of workers, or (c) all other buildings not described in Sentence (1).","Plumbing facilities, grab bars, floor drains and floor and wall finishes around urinals shall conform to SubsectionÃ 3.7.4. and Article 7.1.5.2. in,(a) a recreational camp, (b) a camp for housing of workers, or (c) all other buildings not described in Sentence (1).",0.0
Where a piped water supply is available a hot water supply shall be provided in every dwelling unit.,Where a piped water supply is available a hot water supply shall be provided in every dwelling unit.,,,0.0
,,"In a dwelling unit with a water distribution system, a hot water supply shall be provided.","In a dwelling unit with a water distribution system, a hot water supply shall be provided.",0.0
,,"Except as permitted in Sentence (2), rooms or spaces in a residential occupancy shall be ventilated by natural means in accordance with Subsection 9.32.2.","Except as permitted in Sentence (2), rooms or spaces in a residential occupancy shall be ventilated by natural means in accordance with Subsection 9.32.2.",0.0
"The non-heating-season ventilation required by Clause 9.32.1.2.(1)(a) shall be supplied by natural ventilation in accordance with Article 9.32.2.2., or a mechanical ventilation system in accordance with Article 9.32.2.3.","The non-heating-season ventilation required by Clause 9.32.1.2.(1)(a) shall be supplied by natural ventilation in accordance with Article 9.32.2.2., or a mechanical ventilation system in accordance with Article 9.32.2.3.",,,0.0
"The non-heating-season ventilation required by Clause 9.32.1.2.(1)(a) shall be supplied by natural ventilation in accordance with Article 9.32.2.2., or a mechanical ventilation system in accordance with Article 9.32.2.3.","The non-heating-season ventilation required by Clause 9.32.1.2.(1)(a) shall be supplied by natural ventilation in accordance with Article 9.32.2.2., or a mechanical ventilation system in accordance with Article 9.32.2.3.",,,0.0
,,The natural ventilation of rooms or spaces required in Sentence (1) may be provided by mechanical means.,The natural ventilation of rooms or spaces required in Sentence (1) may be provided by mechanical means.,0.0
,,The switches required in Sentences (2) and (3) shall be centrally located in the dwelling unit and shall be identified with the words VENTILATION FAN.,The switches required in Sentences (2) and (3) shall be centrally located in the dwelling unit and shall be identified with the words VENTILATION FAN.,0.0
"The principal ventilation fan shall be controlled by a manual switch located within the living area of the dwelling unit and clearly marked ""VENTILATION FAN."" (See Note A-9.32.3.3.(5).)","The principal ventilation fan shall be controlled by a manual switch located within the living area of the dwelling unit and clearly marked ""VENTILATION FAN."" (See Note A-9.32.3.3.(5).)",,,0.0
,,The principal exhaust required in this Article may be provided by means of a heat recovery ventilator installed in accordance with Article 9.32.3.11.,The principal exhaust required in this Article may be provided by means of a heat recovery ventilator installed in accordance with Article 9.32.3.11.,0.0
"The requirement for a principal ventilation fan may be satisfied by a single fan, by the exhaust side of a heat recovery ventilator, or by a group of fans, provided all fans in the group are controlled simultaneously by a controller complying with Sentences 9.32.3.3.(5), 9.32.3.3.(6)and 9.32.3.3.(7). (See Note A-9.32.3.3.(3).)","The requirement for a principal ventilation fan may be satisfied by a single fan, by the exhaust side of a heat recovery ventilator, or by a group of fans, provided all fans in the group are controlled simultaneously by a controller complying with Sentences (5), (6) and (7). (See Note A-9.32.3.3.(3).)",,,0.0
A supplemental exhaust fan is not required in a kitchen where the only exhaust air intake for the principal ventilation fan is located in that kitchen.,A supplemental exhaust fan is not required in a kitchen where the only exhaust air intake for the principal ventilation fan is located in that kitchen.,,,0.0
,,"An exhaust air intake shall be installed in each kitchen, bathroom and water closet room.","An exhaust air intake shall be installed in each kitchen, bathroom and water closet room.",0.0
,,"Except for heat recovery ventilators, exhaust fans required to make up any part of the total ventilation capacity required by Article 9.32.3.3. shall have a sound rating not greater than that specified in Table 9.32.3.9.","Except for heat recovery ventilators, exhaust fans required to make up any part of the total ventilation capacity required by Article 9.32.3.3. shall have a sound rating not greater than that specified in Table 9.32.3.9.",0.0
"Fans, including makeup air supply fans, installed to satisfy Articles 9.32.3.3.to 9.32.3.8. with less than 1 m of duct between themselves and the visible interior surfaces of rooms other than unfinished basements, furnace rooms, utility rooms and attics, shall have a sound rating complying with Table 9.32.3.10.-B when operating at the required flow rate.","Fans, including makeup air supply fans, installed to satisfy Articles 9.32.3.3. to 9.32.3.8. with less than 1 m of duct between themselves and the visible interior surfaces of rooms other than unfinished basements, furnace rooms, utility rooms and attics, shall have a sound rating complying with Table 9.32.3.10.-B when operating at the required flow rate.",,,0.0
"Where an attached or built-in garage is provided and where adjacent spaces in the building are less than 50 mm above the garage floor, the garage floor shall be sloped to the outdoors, or where the garage can accommodate not more than 3 vehicles, an airtight curb or partition not less than 50 mm high shall be installed at the edges of the garage floor adjacent to interior space. (See Note A-9.35.2.2.(1).)","Where an attached or built-in garage is provided and where adjacent spaces in the building are less than 50mm above the garage floor, the garage floor shall be sloped to the outdoors, or where the garage can accommodate not more than 3 vehicles, an airtight curb or partition not less than 50 mm high shall be installed at the edges of the garage floor adjacent to interior space. (See Note A-9.35.2.2.(1).)",,,0.0
,,"Where an attached or built-in garage is provided, the garage floor shall be sloped to drain liquids to the outdoors.","Where an attached or built-in garage is provided, the garage floor shall be sloped to drain liquids to the outdoors.",0.0
"Portions of the perimeter of a single open or enclosed space need not comply with Sentence 9.23.13.5.(1), where the roof of the space projects not more than 3.5 m from the face of the framing of the nearest parallel braced wall band, and half the perpendicular plan dimension, that portion of the perimeter structure does not support a floor, and the roof of the space is integral with the roof of the rest of the building with framing members not more than 400 mm o.c., or constructed with roof framing not more than 400 mm o.c. fastened to the wall framing (see Table 9.23.3.4. and Article 9.23.9.1. for balloon framing). (See Note A-9.23.13.5.(3).)","Portions of the perimeter of a single open or enclosed space need not comply with Sentence (1), where the roof of the space projects not more than 3.5 m from the face of the framing of the nearest parallel braced wall band, and half the perpendicular plan dimension, that portion of the perimeter structure does not support a floor, and the roof of the space is integral with the roof of the rest of the building with framing members not more than 400 mm o.c., or constructed with roof framing not more than 400 mm o.c. fastened to the wall framing (see Table 9.23.3.4. and Article 9.23.9.1. for balloon framing). (See Note A-9.23.13.5.(3).)","The depth of water in the area directly below a horizontal semi-circle in front of a diving board or diving platform having a radius of 3 m measured from any point on the front end of the board or platform shall not be less than, 2 750 mm, where a board is 600 mm or less in height above the water surface, 3 m, where a board or platform is greater than 600 mm but not more than 1 000 mm in height above the water surface, and 3.65 m, where a board or platform is greater than 1 000 mm but not more than 3 m in height above the water surface.","The depth of water in the area directly below a horizontal semi-circle in front of a diving board or diving platform having a radius of 3 m measured from any point on the front end of the board or platform shall not be less than, 2 750 mm, where a board is 600 mm or less in height above the water surface, 3 m, where a board or platform is greater than 600 mm but not more than 1 000 mm in height above the water surface, and 3.65 m, where a board or platform is greater than 1 000 mm but not more than 3 m in height above the water surface.",0.8551074862480164
"Except as provided in Sentences 9.10.14.5.(4)to 9.10.14.5.(8) and permitted by Sentence 9.10.14.5.(9), cladding on exposing building faces and on exterior walls located above exposing building faces of buildings or fire compartments where the maximum permitted area of unprotected openings is more than 25% but not more than 50% of the exposing building face need not be noncombustible, where the limiting distance is greater than 5.0 m, the limiting distance is greater than 2.5 m where the area and width-to-height ratio of the exposing building face conform to Table 9.10.14.5.-B, the building or fire compartment is sprinklered, the cladding conforms to Subsections 9.27.6., 9.27.7., 9.27.8.or 9.27.9., is installed without furring members, or on furring not more than 25 mm thick, over gypsum sheathing at least 12.7 mm thick or over masonry, and after conditioning in conformance with ASTM D 2898-10 Accelerated Weathering of Fire-Retardant-Treated Wood for Fire Testing has a flame-spread rating not greater than 25 when tested in accordance with Sentence 3.1.12.1.(2), or the cladding conforms to Subsection 9.27.12., is installed with or without furring members over a gypsum sheathing at least 12.7 mm thick or over masonry, has a flame-spread rating not greater than 25 when tested in accordance with Sentence 3.1.12.1.(2), and does not exceed 2 mm in thickness exclusive of fasteners, joints and local reinforcements.","Except as provided in Sentences (4) to (8) and permitted by Sentence (9), cladding on exposing building faces and on exterior walls located above exposing building faces of buildings or fire compartments where the maximum permitted area of unprotected openings is more than 25% but not more than 50% of the exposing building face need not be noncombustible, where the limiting distance is greater than 5.0 m, the limiting distance is greater than 2.5 m where the area and width-to-height ratio of the exposing building face conform to Table 9.10.14.5.-B, the building or fire compartment is sprinklered, the cladding conforms to Subsections 9.27.6., 9.27.7., 9.27.8. or 9.27.9., is installed without furring members, or on furring not more than 25 mm thick, over gypsum sheathing at least 12.7 mm thick or over masonry, and after conditioning in conformance with ASTM D 2898, Accelerated Weathering of Fire-Retardant-Treated Wood for Fire Testing, has a flame-spread rating not greater than 25 when tested in accordance with Sentence 3.1.12.1.(2), or the cladding conforms to Subsection 9.27.12., is installed with or without furring members over a gypsum sheathing at least 12.7 mm thick or over masonry, has a flame-spread rating not greater than 25 when tested in accordance with Sentence 3.1.12.1.(2), and does not exceed 2 mm in thickness exclusive of fasteners, joints and local reinforcements.","Cladding on exposing building faces and exterior walls located above exposing building faces need not conform to the type of cladding required by Table 9.10.14.5. where,(a) the exposing building face is constructed with no unprotected openings, (b) the limiting distance is not less than 0.6 m, and (c) the cladding, (i) conforms to Subsection 9.27.12., (ii) is installed without furring members over not less than 12.7 mm thick gypsum sheathing or over masonry, (iii) has a flame-spread rating not more than 25 when tested in accordance with Sentence 3.1.12.1.(2), and (iv) is not more than 2 mm in thickness exclusive of fasteners, joints and local reinforcements.","Cladding on exposing building faces and exterior walls located above exposing building faces need not conform to the type of cladding required by Table 9.10.14.5. where,(a) the exposing building face is constructed with no unprotected openings, (b) the limiting distance is not less than 0.6 m, and (c) the cladding, (i) conforms to Subsection 9.27.12., (ii) is installed without furring members over not less than 12.7 mm thick gypsum sheathing or over masonry, (iii) has a flame-spread rating not more than 25 when tested in accordance with Sentence 3.1.12.1.(2), and (iv) is not more than 2 mm in thickness exclusive of fasteners, joints and local reinforcements.",0.9155117273330688
,,The use of copper tube shall conform to Table 7.2.7.4.,The use of copper tube shall conform to Table 7.2.7.4.,0.0
"Except as provided in Sentence 2.2.7.4.(3), the use of copper tube shall conform to Table 2.2.7.4.","Except as provided in Sentence 2.2.7.4.(3), the use of copper tube shall conform to Table 2.2.7.4.",,,0.0
Each lavatory in a public washroom shall be equipped with a device capable of automatically shutting off the flow of water when the lavatory is not in use. (See Note A-2.2.10.6.(4) and (5).),Each lavatory in a public washroom shall be equipped with a device capable of automatically shutting off the flow of water when the lavatory is not in use. (See Note A-2.2.10.6.(4).),Each lavatory in a washroom with fixtures for public use shall be equipped with a device capable of automatically shutting off the flow of water when the lavatory is not in use. (See Appendix A.),Each lavatory in a washroom with fixtures for public use shall be equipped with a device capable of automatically shutting off the flow of water when the lavatory is not in use. (See Appendix A.),0.8903077840805054
"Where PEX, PP-R, PE/AL/PE or PEX/AL/PEX plastic pipe is installed, hangers shall not compress, cut or abrade the pipe.","Where PEX, PP-R, PE/AL/PE or PEX/AL/PEX plastic pipe is installed, hangers shall not compress, cut or abrade the pipe.",,,0.0
,,Reserved,Reserved,0.0
