,,"Except as provided in Sentences (2) to (12), the requirements in Section 3.3. shall apply.","Except as provided in Sentences (2) to (12), the requirements in Section 3.3. shall apply.",0.0
The distance between each group of self-service storage buildings shall be not less than 9 m.,The distance between each group of self-service storage buildings shall be not less than 9 m.,The distance between individual buildings within a group shall be not less than 6 m.,The distance between individual buildings within a group shall be not less than 6 m.,0.8657166361808777
"Subsection 3.2.3. need not apply between buildings within a group of self-service storage buildings, where the distance between these buildings is at least 6 m.","Subsection 3.2.3.need not apply between buildings within a group of self-service storage buildings, where the distance between these buildings is at least 6 m.",,,0.0
,,"Except as provided in Sentences (3), (4) and (5), tents shall not be erected closer than 3 m to other tents or structures on the same property.","Except as provided in Sentences (3), (4) and (5), tents shall not be erected closer than 3 m to other tents or structures on the same property.",0.0
"Tents and air-supported structures shall not be erected closer than 3 m to other structures on the same property except as permitted by Sentences 3.1.6.3.(3)and 3.1.6.3.(4), and shall be sufficiently distant from one another to provide an area to be used as a means of emergency egress.","Tents and air-supported structures (a) shall not be erected closer than 3 m to other structures on the same property except as permitted by Sentences (3) and (4), and (b) shall be sufficiently distant from one another to provide an area to be used as a means of emergency egress.",,,0.0
,,"The electrical system and equipment in a tent, including electrical fuses and switches, shall be inaccessible to the public.","The electrical system and equipment in a tent, including electrical fuses and switches, shall be inaccessible to the public.",0.0
"The electrical system and equipment in a tent or air-supported structure, including electrical fuses and switches, shall be inaccessible to the public.","The electrical system and equipment in a tent or air-supported structure, including electrical fuses and switches, shall be inaccessible to the public.","The electrical system and equipment in an air-supported structure, including electrical fuses and switches, shall be inaccessible to the public.","The electrical system and equipment in an air-supported structure, including electrical fuses and switches, shall be inaccessible to the public.",0.9801132082939148
"Tents and air-supported structures shall not be erected closer than 3 m to other structures on the same property except as permitted by Sentences 3.1.6.3.(3)and 3.1.6.3.(4), and shall be sufficiently distant from one another to provide an area to be used as a means of emergency egress.","Tents and air-supported structures (a) shall not be erected closer than 3 m to other structures on the same property except as permitted by Sentences (3) and (4), and (b) shall be sufficiently distant from one another to provide an area to be used as a means of emergency egress.",,,0.0
,,"Except as provided in Sentences (2), (3) and (4), air-supported structures shall not be erected closer than 3 m to other structures on the same property or to the property line.","Except as provided in Sentences (2), (3) and (4), air-supported structures shall not be erected closer than 3 m to other structures on the same property or to the property line.",0.0
,,"Air-supported structures not occupied by the public need not be separated from one another, and are permitted to be erected closer than 3 m from other structures on the same property where such closer spacing does not create a hazard to the building occupants or the public.","Air-supported structures not occupied by the public need not be separated from one another, and are permitted to be erected closer than 3 m from other structures on the same property where such closer spacing does not create a hazard to the building occupants or the public.",0.0
"Tents and air-supported structures not occupied by the public need not be separated from one another, and are permitted to be erected less than 3 m from other structures on the same property provided this spacing does not create a hazard to the public.","Tents and air-supported structures not occupied by the public (a) need not be separated from one another, and (b) are permitted to be erected less than 3 m from other structures on the same property provided this spacing does not create a hazard to the public.","Tents not occupied by the public need not be separated from one another, and are permitted to be erected less than 3 m from other structures on the same property, where such closer spacing does not create a hazard to the public.","Tents not occupied by the public need not be separated from one another, and are permitted to be erected less than 3 m from other structures on the same property, where such closer spacing does not create a hazard to the public.",0.9345009326934814
,,"Air-supported structures shall be constructed of material conforming to CAN/ULC-S109, ""Flame Tests of Flame-Resistant Fabrics and Films"", or NFPA 701, ""Fire Tests for Flame Propagation of Textiles and Films"".","Air-supported structures shall be constructed of material conforming to CAN/ULC-S109, ""Flame Tests of Flame-Resistant Fabrics and Films"", or NFPA 701, ""Fire Tests for Flame Propagation of Textiles and Films"".",0.0
Every tent and air-supported structure and all tarpaulins and decorative materials used in connection with these structures shall conform to ULC CAN/ULC-S109-14 Flame Tests of Flame-Resistant Fabrics and Films,"Every tent and air-supported structure and all tarpaulins and decorative materials used in connection with these structures shall conform to CAN/ULC-S109, Flame Tests of Flame-Resistant Fabrics and Films.","Every tent, and tarpaulins, decorative materials, fabrics and films used in connection with tents, shall be certified to CAN/ULC-S109, ""Flame Tests of Flame-Resistant Fabrics and Films"", or NFPA 701, ""Fire Tests for Flame Propagation of Textiles and Films"".","Every tent, and tarpaulins, decorative materials, fabrics and films used in connection with tents, shall be certified to CAN/ULC-S109, Flame Tests of Flame-Resistant Fabrics and Films , or NFPA 701, Fire Tests for Flame Propagation of Textiles and Films .",0.8751111030578613
,,The design and construction required by Clause (1)(a) shall comply with Subsection 5.2.1.,The design and construction required by Clause (1)(a) shall comply with Subsection 5.2.1.,0.0
Compliance with Clause 5.1.4.1.(1)(a) shall be demonstrated by design complying with Subsection 5.2.1. and construction conforming to that design.,Compliance with Clause (1)(a) shall be demonstrated by design complying with Subsection 5.2.1.and construction conforming to that design.,,,0.0
"A vapour barrier is not required where it can be shown that uncontrolled vapour diffusion will not adversely affect any of the health or safety of building users, the intended use of the building, or the operation of building services. (See Note A-5.3.1.2.)","A vapour barrier is not required where it can be shown that uncontrolled vapour diffusion will not adversely affect any of the health or safety of building users, the intended use of the building, or the operation of building services.","A vapour barrier is not required where it can be shown that uncontrolled vapour diffusion will not adversely affect any of, (a) the health or safety of building users, (b) the intended use of the building, or (c) the operation of building services.",,0.8949223756790161
"Except as provided in Sentence 5.5.1.1.(3), a vapour barrier shall be installed to provide the principal resistance to water vapour diffusion.","Except as provided in Sentence 5.5.1.1.(3), a vapour barrier shall be installed to provide the principal resistance to water vapour diffusion.","Except as provided in Sentence (3), a vapour barrier shall be installed to provide the principal resistance to water vapour diffusion.","Except as provided in Sentence (3), a vapour barrier shall be installed to provide the principal resistance to water vapour diffusion.",0.956655740737915
"Where precipitation can accumulate on sloped or horizontal assemblies, provision shall be made for drainage conforming with the relevant provincial or territorial regulations or municipal bylaws or, in the absence of such regulations or bylaws, with Article 2.4.10.4. of Division B of the NPC.","Where precipitation can accumulate on sloped or horizontal assemblies, provision shall be made for drainage conforming with the relevant provincial or territorialregulations or municipalbylaws or, in the absence of such regulationsor bylaws, with Article 2.4.10.4. of Division B of the NPC.",,,0.0
,,"Where precipitation can accumulate on sloped or horizontal assemblies, provision shall be made for drainage conforming with Section 7.4.","Where precipitation can accumulate on sloped or horizontal assemblies, provision shall be made for drainage conforming with Section 7.4.",0.0
Mechanical systems and equipment shall be designed and installed to accommodate the maximum relative structural movement provided for in the construction of the building.,Mechanical systems and equipment shall be designed and installed to accommodate the maximum relative structural movement provided for in the construction of the building.,Plumbing shall be designed and installed to accommodate the maximum relative structural movement provided for in the construction of the building.,Plumbing shall be designed and installed to accommodate the maximum relative structural movement provided for in the construction of the building.,0.9484067559242249
Mechanical systems and equipment shall be designed and installed to accommodate the maximum amount of structural movement provided for in the construction of the building.,,Mechanical systems and equipment shall be designed and installed to accommodate the maximum relative structural movement provided for in the construction of the building.,Mechanical systems and equipment shall be designed and installed to accommodate the maximum relative structural movement provided for in the construction of the building,0.9797587394714355
Asbestos shall not be used in air distribution systems or equipment.,,"Asbestos shall not be used in heating, ventilating or air-conditioning systems or equipment.","Asbestos shall not be used in heating, ventilating or air-conditioning systems or equipment.",0.8584744334220886
Asbestos shall not be used in HVAC systems and equipment.,Asbestos shall not be used in HVAC systems and equipment.,,,0.0
Facilities for flushing and drainage shall be provided where filters are designed to be washed in place.,Facilities for flushing and drainage shall be provided where filters are designed to be washed in place.,Facilities for flushing and drainage shall be provided where filters are designed to be washed in place.,Facilities for flushing and drainage shall be provided where filters are designed to be washed in place.,0.9999999403953552
"Duct linings shall be installed so that they will not interfere with the operation of volume or balancing dampers or of fire dampers, fire stop flaps and other closures.","Duct linings shall be installed so that they will not interfere with the operation of volume or balancing dampers or of fire dampers, firestop flaps and other closures.","Linings of ducts shall be installed so that they will not interfere with the operation of volume or balancing dampers, fire dampers, fire stop flaps and other closures.",,0.9905886650085448
"Outdoor air intakes shall be located so that the quality of the air entering the building complies with Sentences 6.2.1.2.(2)and 6.2.1.2.(3), and they are separated a minimum distance from sources of contaminants in accordance with Table 6.3.2.9.","Outdoor air intakes shall be located so that the quality of the air entering the building complies with Sentences 6.2.1.2.(2) and 6.2.1.2.(3), and they are separated a minimum distance from sources of contaminants in accordance with Table 6.3.2.9.",Outdoor air intakes shall be located so that they are separated a minimum distance from sources of contaminants in accordance with Table 6.2.3.12.,Outdoor air intakes shall be located so that they are separated a minimum distance from sources of contaminants in accordance with Table 6.2.3.12.,0.87286376953125
,,Outdoor air intakes and exhaust outlets on the exterior of buildings shall be designed or located so that the air entering the building system will not contain more contaminants than the normal exterior air of the locality in which the building is situated.,Outdoor air intakes and exhaust outlets on the exterior of buildings shall be designed or located so that the air entering the building system will not contain more contaminants than the normal exterior air of the locality in which the building is situated.,0.0
"Outdoor air intakes shall be located so that the quality of the air entering the building complies with Sentences 6.2.1.2.(2)and 6.2.1.2.(3), and they are separated a minimum distance from sources of contaminants in accordance with Table 6.3.2.9.","Outdoor air intakes shall be located so that the quality of the air entering the building complies with Sentences 6.2.1.2.(2) and 6.2.1.2.(3), and they are separated a minimum distance from sources of contaminants in accordance with Table 6.3.2.9.",Outdoor air intakes shall be located so that they are separated a minimum distance from sources of contaminants in accordance with Table 6.2.3.12.,Outdoor air intakes shall be located so that they are separated a minimum distance from sources of contaminants in accordance with Table 6.2.3.12.,0.87286376953125
,,Outdoor air intakes and exhaust outlets at the building exterior shall be designed or located so that the air entering the building system will not contain more contaminants than the normal exterior air.,Outdoor air intakes and exhaust outlets at the building exterior shall be designed or located so that the air entering the building system will not contain more contaminants than the normal exterior air.,0.0
Air filters for air duct systems shall conform to the requirements for Class 2 air filter units as described in ULC CAN/ULC-S111-13 Fire Tests for Air Filter Units,Air filters for air duct systems shall conform to the requirements for Class 2 air filter units as described in ULC CAN/ULC-S111 Fire Tests for Air Filter Units,"Air filters for air duct systems shall conform to the requirements for Class 2 air filter units as described in CAN/ULC-S111, ""Fire Tests for Air Filter Units"".","Air filters for air duct systems shall conform to the requirements for Class 2 air filter units as described in CAN/ULC-S111, ""Fire Tests for Air Filter Units"".",0.9522064924240112
,,"Air filters for air duct systems shall conform to the requirements for Class 2 air filter units as described in CAN/ULC-S111, ""Fire Tests For Air Filter Units"".","Air filters for air duct systems shall conform to the requirements for Class 2 air filter units as described in CAN/ULC-S111, ""Fire Tests For Air Filter Units"".",0.0
"Except as permitted by Sentence 3.6.5.4.(3), combustible coverings and linings, including associated adhesives and insulation, shall have a flame-spread rating not more than 25 on any exposed surface or any surface that would be exposed by cutting through the material in any direction, and a smoke developed classification not more than 50.",,"Except as provided in Sentence (7), where combustible insulation and covering is used on piping in buildings described in Subsection 3.2.6., they shall have a smoke developed classification of not more than 100.","Except as provided in Sentence (7), where combustible insulation and covering is used on piping in buildings described in Subsection 3.2.6., they shall have a smoke developed classification of not more than 100.",0.8576502799987793
"Except as permitted by Sentence 3.6.5.5.(5), combustible insulation and covering used on piping in a building within the scope of Subsection 3.2.6. shall have a smoke developed classification not more than 100.","Except as permitted by Sentence (5), combustible insulation and covering used on piping in a building within the scope of Subsection 3.2.6. shall have a smoke developed classification not more than 100.","Except as permitted in Sentences (5) to (7), plumbing fixtures in a building regulated by the provisions of Subsection 3.2.6. shall have a smoke developed classification not more than 300.","Except as permitted in Sentences (5) to (7), plumbing fixtures in a building regulated by the provisions of Subsection 3.2.6. shall have a smoke developed classification not more than 300.",0.9265618324279784
"This Part applies to the design, construction, extension, alteration, renewal or repair of plumbing systems.","This Part applies to the design, construction, extension, alteration, renewal or repair of plumbing systems.",,,0.0
,,"Except as provided in Sentence (2), this Part applies to the design and construction of plumbing.","Except as provided in Sentence (2), this Part applies to the design and construction of plumbing.",0.0
Doorways to public water-closet rooms shall be not less than 810 mm wide and 2 030 mm high. (See Note A-9.5.5.3.),Doorways to public water-closet rooms shall be not less than 810 mm wide and 2 030 mm high.,Doors to public water closet rooms shall be not less than 810 mm wide and 2 030 mm high.,Doors to public water closet rooms shall be not less than 810 mm wide and 2 030 mm high.,0.8846589922904968
The vertical height of any flight of stairs shall not exceed 3.7 m. (See Note A-9.8.4.) (See Note A-9.8.4.),The vertical height of any flight of stairs shall not exceed 3.7 m.,,,0.0
,,The vertical height of a flight shall not exceed 3.7 m.,The vertical height of a flight shall not exceed 3.7 m.,0.0
"Except for stairs serving areas only used as service rooms or service spaces, the run shall comply with Table 9.8.4.2.","Except for stairs serving areas only used as service rooms or service spaces, the run shall comply with Table 9.8.4.2.",,,0.0
,,The run for rectangular treads shall conform to Table 9.8.4.1.,The run for rectangular treads shall conform to Table 9.8.4.1.,0.0
"Where the landing in a stairway or ramp does not turn or turns less than 90°, the length of the landing need not be more than the lesser of the required width of the stair or ramp, or 1 100 mm.","Where the landing in a stairway or ramp does not turn or turns less than 90Â°, the length of the landing need not be more than the lesser of the required width of the stair or ramp, or 1 100 mm.","Where a landing in a stair or ramp does not turn or turns less than 90o, the length of the landing need not be more than the lesser of, the required width of the stair or ramp, or 1 100 mm.",,0.989446461200714
"In a straight stairway and in a stairway that turns less than 90°, the length of the landing need not be more than the lesser of the required width of stair, or 1 100 mm.",,"Where the landing in a stair or ramp does not turn or turns less than 90º, the length of the landing shall not be less than the lesser of,(a) the required width of the stair or ramp, or (b) 1 100 mm.","Where the landing in a stair or ramp does not turn or turns less than 90ÃÂº, the length of the landing shall not be less than the lesser of,(a) the required width of the stair or ramp, or (b) 1 100 mm.",0.8719987273216248
This Subsection applies to obstructions and hazards in every means of egress except those within a dwelling unit or serving not more than one dwelling unit.,This Subsection applies to obstructions and hazards in every means of egress except those within a dwelling unit or serving not more than one dwelling unit.,This Subsection applies to obstructions and hazards in every means of egress except those within or serving an individual dwelling unit.,This Subsection applies to obstructions and hazards in every means of egress except those within or serving an individual dwelling unit.,0.9551796913146972
"This Subsection applies to every means of egress except exits that serve not more than one dwelling unit or a house with a secondary suite including their common spaces, and access to exits within dwelling units and within houses with a secondary suite including their common spaces.",,"This Subsection applies to every means of egress except,(a) exits that serve a house or an individual dwelling unit, and (b) access to exits within a house or an individual dwelling unit.","This Subsection applies to every means of egress except,(a) exits that serve a house or an individual dwelling unit, and (b) access to exits within a house or an individual dwelling unit.",0.85582435131073
Doors serving a single dwelling unit or a house with a secondary suite need not comply with Sentences 9.9.6.1.(2)and 9.9.6.1.(3).,Doors serving a single dwelling unit or a house with a secondary suite need not comply with Sentences 9.9.6.1.(2) and 9.9.6.1.(3).,,,0.0
,,Doors serving a house or an individual dwelling unit need not comply with Sentences (2) and (3).,Doors serving a house or an individual dwelling unit need not comply with Sentences (2) and (3).,0.0
"Where the lobby referred to in Sentence 9.9.8.5.(1) and adjacent occupancies that are permitted to open into the lobby are sprinklered, the fire separation between such occupancies and the lobby need not have a fire-resistance rating. (See Note A-3.4.4.2.(2)(e).) (See Note A-3.4.4.2.(2)(e).)","Where the lobby referred to in Sentence (1) and adjacent occupancies that are permitted to open into the lobby are sprinklered, the fire separation between such occupancies and the lobby need not have a fire-resistance rating. (See Note A-3.4.4.2.(2)(e).)",,,0.0
,,"Where the lobby referred to in Sentence (1) and adjacent occupancies that are permitted to open into the lobby are sprinklered, the fire separation between such occupancies and the lobby need not have a fire-resistance rating.","Where the lobby referred to in Sentence (1) and adjacent occupancies that are permitted to open into the lobby are sprinklered, the fire separation between such occupancies and the lobby need not have a fire-resistance rating.",0.0
"Except as permitted in Article 9.10.9.3., a wall or floor assembly required to be a smoke-tight barrier shall be constructed as a continuous barrier against the spread of smoke.","Except as permitted in Article 9.10.9.3., a wall or floor assembly required to be a smoke-tight barrier shall be constructed as a continuous barrier against the spread of smoke.","Except as permitted in Article 9.10.9.3., a wall or floor assembly required to be a fire separation shall be constructed as a continuous barrier against the spread of fire.","Except as permitted in Article 9.10.9.3., a wall or floor assembly required to be a fire separation shall be constructed as a continuous barrier against the spread of fire.",0.9636247158050536
"Except as permitted in Article 9.10.9.3., a wall or floor assembly required to be a fire separation shall be constructed as a continuous barrier against the spread of fire and retard the passage of smoke.","Except as permitted in Article 9.10.9.3., a wall or floor assembly required to be a fire separation shall be constructed as a continuous barrier against the spread of fire and retard the passage of smoke.",,,0.0
"Except as provided in Article 9.10.11.2., a party wall on a property line shall be constructed as a firewall. (See Note A-3.2.3.4.(1).)","Except as provided in Article 9.10.11.2., a party wall on a property line shall be constructed as a firewall. (See Note A-3.2.3.4.(1).)",,,0.0
,,"Except as provided in Articles 9.10.11.2. and 9.10.11.4., a party wall on a property line shall be constructed as a firewall.","Except as provided in Articles 9.10.11.2. and 9.10.11.4., a party wall on a property line shall be constructed as a firewall.",0.0
"Doors within dwelling units, other than garage doors, need not conform to Sentences 9.10.17.1.(1)and 9.10.17.1.(2).","Doors within dwelling units, other than garage doors, need not conform to Sentences (1) and (2).",,,0.0
,,"Doors within dwelling units, other than vehicle garage doors, need not conform to Sentences (1) and (2).","Doors within dwelling units, other than vehicle garage doors, need not conform to Sentences (1) and (2).",0.0
"Access panels required in Sentence 9.10.20.1.(1) need not be provided in buildings containing only dwelling units where there is no dwelling unit above another dwelling unit, or houses with a secondary suite.","Access panels required in Sentence (1) need not be provided in buildings containing only dwelling units where there is no dwelling unit above another dwelling unit, or houses with a secondary suite.",,,0.0
,,Access panels required in Sentence (1) need not be provided in houses.,Access panels required in Sentence (1) need not be provided in houses.,0.0
"Each construction camp building shall be provided with portable fire extinguishers in conformance with the appropriate provincial or territorial regulations or municipal bylaws or, in the absence of such regulations or bylaws, in conformance with the NFC.","Each construction camp building shall be provided with portable fire extinguishers in conformance with the appropriate provincial or territorial regulations or municipal bylaws or, in the absence of such regulations or bylaws, in conformance with the NFC.",,,0.0
