DOCTYPE,PT,Code Year,Code Book,Division,Language,DOCID,DIVISION,PT Sentence Number,ARTICLE_TITLE,PT Sentence Text,PARTNUM,SECTIONNUM,SUBSECTIONNUM,ARTICLENUM,SENTENCENUM
F,ON,2015,NBC,Div B,EN,ofc2019_divb,B,9.5.2.8.(4),Protection of openings in fire separations,"Where a 20 min fire-protection rating is required, existing closures consisting of 45 mm solid core wood doors installed in solid wood or hollow metal frames and equipped with self-closing devices are deemed to be in compliance with Sentences (1) and (2).",9.0,5,2,8,4
F,ON,2015,NBC,Div B,EN,ofc2019_divb,B,4.3.5.2.(1),Location of vent pipe outlets,"Normal vent pipe outlets for storage tanks of Class I liquids shall be located outside buildings, not less than 3.5 m above the adjacent ground level, and 1.5 m from any building opening, and shall discharge so that flammable vapours will not enter the building or be trapped near any part of the building.",4.0,3,5,2,1
F,ON,2015,NBC,Div B,EN,ofc2019_divb,B,4.3.11.3.(1),Fill piping and discharge piping,Fill piping and discharge piping shall enter underground storage tanks only through the top of the tank and discharge piping used in suction systems shall be sloped toward the storage tanks.,4.0,3,11,3,1
F,ON,2015,NBC,Div B,EN,ofc2019_divb,B,9.6.4.10.(1),Smoke alarms,Smoke alarms shall be installed in each dwelling unit and in each sleeping room not within a dwelling unit in accordance with Article 3.2.4.21. of the 1990 Building Code.,9.0,6,4,10,1
F,ON,2015,NBC,Div B,EN,ofc2019_divb,B,4.3.2.6.(1),Leakage testing,"At the time of installation, aboveground storage tanks and associated piping shall be tested for leakage in conformance with Subsections 4.3.15. and 4.4.6.",4.0,3,2,6,1
F,ON,2015,NBC,Div B,EN,ofc2019_divb,B,9.9.1.1.(5),Application,Article 9.9.4.13. applies to a building or part of a building described in Sentence (2) or (3).,9.0,9,1,1,5
F,ON,2015,NBC,Div B,EN,ofc2019_divb,B,4.3.12.9.(1),"Supports, foundations and anchorage","Except as provided in Sentence (2), where storage tanks for flammable liquids or combustible liquids are installed inside buildings, the supports, foundations and anchorage for such storage tanks shall be in conformance with Subsection 4.3.3.",4.0,3,12,9,1
F,ON,2015,NBC,Div B,EN,ofc2019_divb,B,9.6.2.15.(3),Storage garages,Sentence (2) does not apply to an underground storage garage that is equipped with heat detectors connected to the fire alarm system and that has vestibules located at points of access to the residential occupancy.,9.0,6,2,15,3
F,ON,2015,NBC,Div B,EN,ofc2019_divb,B,4.3.10.3.(2),Installation,Vent pipes from underground storage tanks for Class II or IIIA liquids shall be located outside buildings at a height that is above the fill pipe opening but not less than 2 m above finished ground level.,4.0,3,10,3,2
F,ON,2015,NBC,Div B,EN,ofc2019_divb,B,6.3.2.6.(1),Interconnected smoke alarms,"This Article applies to interconnected smoke alarm systems in all residential occupancies and care occupancies, except in individual dwelling units and in buildings regulated by Section 9.8.",6.0,3,2,6,1
F,ON,2015,NBC,Div B,EN,ofc2019_divb,B,9.6.1.1.(3),Application,"If a building that is governed by this Section contains, in addition to its residential occupancies, one or more other occupancies that are governed by other Sections of this Part, the fire safety systems, devices and structural elements of all of the occupancies governed by this Part shall comply with the requirements of this Part that provide the greatest protection for life safety.",9.0,6,1,1,3
F,ON,2015,NBC,Div B,EN,ofc2019_divb,B,6.8.1.1.(3),Fuel supply,"The design and installation of a special fire suppression system that is not water-based shall conform to one of the following standards: NFPA 11, Standard for Low , Medium , and High Expansion Foam, NFPA 12, Standard on Carbon Dioxide Extinguishing Systems, NFPA 12A, Standard on Halon 1301 Fire Extinguishing Systems, NFPA 12B, Standard on Halon 1211 Fire Extinguishing Systems, NFPA 17, Standard for Dry Chemical Extinguishing Systems, NFPA 17A, Standard for Wet Chemical Extinguishing Systems, or NFPA 2001, Standard on Clean Agent Fire Extinguishing Systems.",6.0,8,1,1,3
F,ON,2015,NBC,Div B,EN,ofc2019_divb,B,2.8.3.1.(2),Procedures,The fire drill procedures required in Sentence (1) shall be prepared in consultation with the Chief Fire Official.,2.0,8,3,1,2
F,ON,2015,NBC,Div B,EN,ofc2019_divb,B,2.8.3.2.(3),Frequency,"In a school, as defined in the Education Act, and a private school, as defined in the Education Act, a total evacuation fire drill shall be held if the school or private school is in session during the fall term, at least three times during that term, if the school or private school is in session during the spring term, at least three times during that term, and if the school or private school is in session during the summer, at least three times or at least once a month during the period it is in session, whichever is less.",2.0,8,3,2,3
F,ON,2015,NBC,Div B,EN,ofc2019_divb,B,2.4.1.1.(4),Accumulation of combustible materials,Combustible materials shall not be stored on a roof or adjacent to any building so as to create a fire hazard to the building or its occupants.,2.0,4,1,1,4
F,ON,2015,NBC,Div B,EN,ofc2019_divb,B,4.1.7.2.(5),Ventilation measures,"Where continuous mechanical ventilation is installed in order to meet the conditions of Sentence (1), it shall be provided with automatic interlocks so that the activity generating flammable vapours cannot be performed when the ventilation system is not in operation, sound an audible alarm in an attended area upon shutdown of the ventilation system, and conform to NFPA 91, Standard for Exhaust Systems for Air Conveying of Vapors, Gases, Mists, and Noncombustible Particulate Solids.",4.0,1,7,2,5
F,ON,2015,NBC,Div B,EN,ofc2019_divb,B,9.5.2.2.(1),Buildings up to 3 storeys,"Buildings shall comply with the requirements of Sentence (2) where the building is not more than 1 storey in building height and not greater than 1200 m2 in building area, not more than 2 storeys in building height and not greater than 900 m2 in building area, or not more than 3 storeys in building height and not greater than 600 m2 in building area.",9.0,5,2,2,1
F,ON,2015,NBC,Div B,EN,ofc2019_divb,B,9.1.4.5.(1),Extension of time,An owner or the owner s agent may apply to the Chief Fire Official for an extension of the compliance date to permit time for a Life Safety Study to be submitted.,9.0,1,4,5,1
F,ON,2015,NBC,Div B,EN,ofc2019_divb,B,6.2.6.7.(1),Extinguishers for Class B fires,"Except as required by Article 6.2.6.9., portable extinguishers for Class B fires shall be provided as required in Table 6.2.6.B.",6.0,2,6,7,1
F,ON,2015,NBC,Div B,EN,ofc2019_divb,B,9.4.3.4.(1),Door swing,Each exit door shall open in the direction of exit travel and swing on its vertical axis.,9.0,4,3,4,1
F,ON,2015,NBC,Div B,EN,ofc2019_divb,B,6.3.2.6.(7),Interconnected smoke alarms,"Revoked: O. Reg. 33/19, s. 23.",6.0,3,2,6,7
F,ON,2015,NBC,Div B,EN,ofc2019_divb,B,9.8.2.5.(2),Protection of openings in fire separations,"Despite Sentence (1), existing 45 mm solid core wood, hollow metal or kalamein doors equipped with self-closing devices, installed in hollow metal or solid wood frames, are acceptable.",9.0,8,2,5,2
F,ON,2015,NBC,Div B,EN,ofc2019_divb,B,5.13.5.6.(1),Electrical installations,"Where flammable liquids and combustible liquids contained in dip tanks are heated or have a flash point below 43°C, the electrical installation shall conform to the Electrical Safety Code made under the Electricity Act, 1998.",5.0,13,5,6,1
F,ON,2015,NBC,Div B,EN,ofc2019_divb,B,9.9.2.19.(5),Cooking operations,"The cooking operation shall be located in a kitchen that is separated from the remainder of the building by a fire separation having a fire-resistance rating not less than 45 min, or protected by a fixed fire protection system.",9.0,9,2,19,5
F,ON,2015,NBC,Div B,EN,ofc2019_divb,B,7.2.2.1.(3),Testing,"Key-operated switches in each elevator car shall be tested to ensure that actuation of the switch will enable the elevator to operate independently of other elevators, allow operation of the elevator without interference from floor call buttons, render door protective devices inoperative, and control the opening of power-operated doors only by continuous pressure on the door-opening buttons or switches, to ensure that if the OPEN button or switch is released while the door is opening, the doors will automatically close.",7.0,2,2,1,3
F,ON,2015,NBC,Div B,EN,ofc2019_divb,B,6.5.1.6.(7),Obstructions,Dry-pipe valves shall be tested to ensure that they are in operating condition.,6.0,5,1,6,7
F,ON,2015,NBC,Div B,EN,ofc2019_divb,B,6.5.5.3.(1),Water flow alarm tests,Water flow alarm tests using the most hydraulically remote test connection shall be performed annually on wet sprinkler systems.,6.0,5,5,3,1
F,ON,2015,NBC,Div B,EN,ofc2019_divb,B,4.7.6.1.(3),Portable extinguishers,"Where marine vessels are loading or unloading flammable liquids or combustible liquids or are being refuelled, portable extinguishers with a rating of not less than 40B:C shall be placed on the pier or wharf in the vicinity of loading or unloading operations, so that they are accessible in the event of a fire emergency.",4.0,7,6,1,3
F,ON,2015,NBC,Div B,EN,ofc2019_divb,B,4.8.2.1.(3),Location,"Except as provided in Sentence (4), outdoor processing equipment having emergency relief venting and a working pressure more than 17 kPa (gauge) shall be separated from property lines and buildings on the same property by distances 1.5 times those in Table 4.3.2.A. for stable liquids, and four times those in Table 4.3.2.A. for unstable liquids.",4.0,8,2,1,3
F,ON,2015,NBC,Div B,EN,ofc2019_divb,B,4.2.7.5.(3),Maximum quantities,"Where containers for two or more liquids having different flash points are stored together in a single individual storage area, the maximum quantity permitted in the individual storage area shall equal that permitted for the liquid with the lowest flash point.",4.0,2,7,5,3
F,ON,2015,NBC,Div B,EN,ofc2019_divb,B,9.2.3.13.(2),Exit signs,"Despite Sentence (1), existing markings and signs may be approved.",9.0,2,3,13,2
F,ON,2015,NBC,Div B,EN,ofc2019_divb,B,4.3.13.5.(6),Placards,Rooms for storage tanks and the information described in Sentence (2) shall be identified in the fire safety plan required in Article 4.1.5.6.,4.0,3,13,5,6
F,ON,2015,NBC,Div B,EN,ofc2019_divb,B,6.3.4.3.(2),Duty to maintain in operating condition,Primary and secondary power supplies that serve carbon monoxide alarms shall be maintained in operating condition.,6.0,3,4,3,2
F,ON,2015,NBC,Div B,EN,ofc2019_divb,B,9.9.2.1.(1),Construction,"Fire separations required by this Section to have a fire-resistance rating shall be in conformance with Subsection 3.1.7. and Articles 3.1.8.1., 3.1.8.2., 3.1.8.3. and 3.5.4.2. of the 1994 Building Code.",9.0,9,2,1,1
F,ON,2015,NBC,Div B,EN,ofc2019_divb,B,5.10.1.1.(1),Application,"This Section applies to buildings, parts of buildings or equipment where combustible dusts are produced in quantities or concentrations that create an explosion or fire hazard.",5.0,10,1,1,1
F,ON,2015,NBC,Div B,EN,ofc2019_divb,B,9.3.3.2.(2),Acceptable exits,"Despite Sentence 9.3.3.5.(1), not more than one required exit from the basement may lead through the first floor floor area.",9.0,3,3,2,2
F,ON,2015,NBC,Div B,EN,ofc2019_divb,B,5.12.1.1.(1),Application,"This Section applies to spray operations involving the use of flammable liquids, combustible liquids or combustible dry powders.",5.0,12,1,1,1
F,ON,2015,NBC,Div B,EN,ofc2019_divb,B,6.3.1.7.(2),Relocating manual pull stations,"Where the manual pull stations are relocated, alternate approved measures shall be used to maintain the level of life safety.",6.0,3,1,7,2
F,ON,2015,NBC,Div B,EN,ofc2019_divb,B,4.6.2.6.(1),Fencing,"An outdoor area used for aboveground storage tanks, container storage, ancillary equipment and unloading facilities for flammable liquids or combustible liquids shall be surrounded by a firmly anchored fence that is substantially constructed to discourage climbing and unauthorized entry, not less than 1.8 m high, and provided with gates that shall be locked when the storage area is not staffed.",4.0,6,2,6,1
F,ON,2015,NBC,Div B,EN,ofc2019_divb,B,4.4.7.4.(2),Underground piping,"Underground piping shall be located not less than 300 mm away from the foundations of any building or structure, except where such piping enters the building as permitted in Article 4.4.7.7.",4.0,4,7,4,2
F,ON,2015,NBC,Div B,EN,ofc2019_divb,B,4.1.6.2.(1),Drainage systems,"A drainage system referred to in Clause 4.1.6.1.(1)(b) shall terminate at a location where such a spill will not create a fire hazard or any risk to health or safety or the natural environment, and direct the spill away from the areas identified in Sentence 4.1.6.1.(4).",4.0,1,6,2,1
F,ON,2015,NBC,Div B,EN,ofc2019_divb,B,4.1.5.9.(4),Basement storage,"Up to 5 L of Class I liquids may be stored in basements if the liquids are stored in safety containers that comply with ULC/ORD-C30, Safety Containers.",4.0,1,5,9,4
F,ON,2015,NBC,Div B,EN,ofc2019_divb,B,3.2.1.5.(1),Clearance for bulk volume over 4800 m³,This Article applies if the bulk volume of stored tires and shredded tires in a storage yard is more than 4800 m3.,3.0,2,1,5,1
F,ON,2015,NBC,Div B,EN,ofc2019_divb,B,9.9.2.2.(2),Buildings up to 3 storeys,"Floor assemblies and walls, columns and arches supporting floor assemblies shall have a fire-resistance rating not less than 30 min.",9.0,9,2,2,2
F,ON,2015,NBC,Div B,EN,ofc2019_divb,B,5.14.4.8.(1),Automatic grounding,An automatic means shall be provided for grounding the electrode system when it is de-energized.,5.0,14,4,8,1
F,ON,2015,NBC,Div B,EN,ofc2019_divb,B,6.3.4.7.(1),Replacement in certain buildings,"Subject to Sentence (2), this Article applies to every building that contains a residential occupancy and a fuel-burning appliance, a fireplace, or a storage garage.",6.0,3,4,7,1
F,ON,2015,NBC,Div B,EN,ofc2019_divb,B,4.7.9.3.(1),Location,"Except as permitted in Sentence (2), cargo pumps shall be located on shore or on piers and wharves either of noncombustible construction or of the solid-fill type, and not less than 3 m from other buildings or structures.",4.0,7,9,3,1
F,ON,2015,NBC,Div B,EN,ofc2019_divb,B,9.1.1.2.(1),Compliance,"The requirements of this Part shall be satisfied by implementing the requirements of the applicable Section, or by implementing an approved Life Safety Study in accordance with Subsection 9.1.4.",9.0,1,1,2,1
F,ON,2015,NBC,Div B,EN,ofc2019_divb,B,5.10.1.14.(1),Ignition sources prohibited,Smoking shall not take place and open flame and spark-producing equipment shall not be used in areas containing combustible dust producing operations.,5.0,10,1,14,1
F,ON,2015,NBC,Div B,EN,ofc2019_divb,B,9.6.5.4.(1),Hydrants,Hydrants shall be located within 90 m of the building face on which the principal entrance is located.,9.0,6,5,4,1
F,ON,2015,NBC,Div B,EN,ofc2019_divb,B,9.4.4.1.(1),Fire alarm requirements,A fire alarm and detection system shall be installed in each building.,9.0,4,4,1,1
F,ON,2015,NBC,Div B,EN,ofc2019_divb,B,4.6.3.4.(1),Dispensing into metal containers or tanks,Class I liquids shall not be dispensed into a metal container or storage tank unless it is electrically connected in conformance with Article 4.1.8.2.,4.0,6,3,4,1
F,ON,2015,NBC,Div B,EN,ofc2019_divb,B,3.2.2.2.(1),Surface of ground,"Except as permitted in Sentence (2) and Article 3.2.2.3., storage sites for lumber and other forest products shall consist of level and solid ground that is paved or surfaced with noncombustible material.",3.0,2,2,2,1
F,ON,2015,NBC,Div B,EN,ofc2019_divb,B,4.3.7.7.(1),Leak detection,"The secondary containment shall be equipped with a monitoring device that activates a visual or audible alarm in an attended area in the event of a loss of integrity of the secondary containment unless the contained space created by the secondary containment is accessible for an internal visual examination, and the secondary containment is sloped so that liquid would flow to a specific location that can be monitored.",4.0,3,7,7,1
F,ON,2015,NBC,Div B,EN,ofc2019_divb,B,4.3.11.3.(5),Fill piping and discharge piping,"A filling connection described in Sentence (3) may be located inside a building if made necessary by a process or activity located indoors and to which the tank is directly associated, or for the collection of used liquids, and the fill piping is provided with means to prevent flammable vapours from returning to the building.",4.0,3,11,3,5
F,ON,2015,NBC,Div B,EN,ofc2019_divb,B,2.7.1.6.(3),Nonfixed seating,"The minimum clear width of aisles shall be at least 1100 mm, except as permitted by Sentence (4).",2.0,7,1,6,3
F,ON,2015,NBC,Div B,EN,ofc2019_divb,B,9.1.2.2.(1),Exemptions,"This Part does not apply to a building that contains a residential occupancy, consisting of no more than one dwelling unit, and no other major occupancy.",9.0,1,2,2,1
F,ON,2015,NBC,Div B,EN,ofc2019_divb,B,4.3.1.10.(1),Reuse,"A storage tank that has been taken out of service shall not be reused for the storage of flammable liquids or combustible liquids unless it has been refurbished so as to conform to one of the standards set out in Sentence 4.3.1.2.(1), or refurbished in conformance with Sentence (2) or (3).",4.0,3,1,10,1
F,ON,2015,NBC,Div B,EN,ofc2019_divb,B,9.2.5.2.(1),Sprinkler systems,"Except as permitted in Sentence (3), sprinkler systems shall comply with Article 3.2.5.5. of the 1986 Building Code.",9.0,2,5,2,1
F,ON,2015,NBC,Div B,EN,ofc2019_divb,B,9.6.3.6.(2),Exit signs,Each door opening into an exit stairway from a public corridor shall be identified on the stairway side with the number assigned to that floor in accordance with Article 3.4.6.17. of the 1990 Building Code.,9.0,6,3,6,2
F,ON,2015,NBC,Div B,EN,ofc2019_divb,B,5.14.5.2.(2),Undercoating materials,"Where the flash point of an automobile undercoating is less than 60°C, it shall be applied in a work area where there are no work pits, there is a fan, that provides mechanical ventilation during the application, cleaning and drying cycles, with nonferrous blades, or so constructed that a movement of the wheel or shaft will not permit two ferrous parts of the fan to rub or strike, and that ensures that the concentration of vapour does not exceed 25% of the lower explosive limit, air movement from the air intake and exhaust system is along the length of the vehicle being undercoated, and air is exhausted at a level approximately 1 m above the floor.",5.0,14,5,2,2
F,ON,2015,NBC,Div B,EN,ofc2019_divb,B,9.4.3.6.(1),Fire escapes,"A fire escape shall not be erected on an existing building unless it is not practical in the circumstances to provide one or more exit facilities, described under Article 3.4.1.2. of the 1986 Building Code, and provided that the fire escape does not serve floor areas above the second floor.",9.0,4,3,6,1
F,ON,2015,NBC,Div B,EN,ofc2019_divb,B,9.4.2.8.(2),Protection of openings in fire separations,Openings in a fire separation that is required to have a 30 min fire-resistance rating shall be protected with closures that have a fire-protection rating not less than 20 min.,9.0,4,2,8,2
F,ON,2015,NBC,Div B,EN,ofc2019_divb,B,4.4.7.4.(3),Underground piping,"Piping passing under railway tracks shall be installed in conformance with TC, Standards Respecting Pipeline Crossings Under Railways.",4.0,4,7,4,3
F,ON,2015,NBC,Div B,EN,ofc2019_divb,B,6.5.1.7.(2),Testing of underground mains,"At seasons of the year that will not permit hydrostatic pressure testing, the procedure outlined in Sentence 6.5.1.6.(4) may be followed.",6.0,5,1,7,2
F,ON,2015,NBC,Div B,EN,ofc2019_divb,B,8.1.2.2.(2),Firewatch,"If a firewatch is required, the demolition site shall be toured by firewatch personnel at least once each hour.",8.0,1,2,2,2
F,ON,2015,NBC,Div B,EN,ofc2019_divb,B,6.5.6.4.(1),Precautions against freezing,"Except as permitted in Sentence (2), sections of sprinkler systems subject to freezing shall be converted to a dry-pipe or antifreeze system with a separate control valve for that part of the system.",6.0,5,6,4,1
F,ON,2015,NBC,Div B,EN,ofc2019_divb,B,9.9.3.2.(3),Access to exit,"Unless otherwise approved, no area may be served by a dead end corridor where the area contains an assembly occupancy and its occupant load is greater than 20 persons, the area is intended for storage and exceeds 200 m2, or the area is intended for a use other than that described in Clauses (a) and (b) and exceeds 100 m2 in area or has an occupant load greater than 24 persons.",9.0,9,3,2,3
F,ON,2015,NBC,Div B,EN,ofc2019_divb,B,3.3.1.1.(1),Application,This Subsection applies to buildings used for the storage of tires in which the bulk volume of tires stored in one fire compartment exceeds 425 m3.,3.0,3,1,1,1
F,ON,2015,NBC,Div B,EN,ofc2019_divb,B,4.2.6.5.(1),Separation of dangerous goods,Flammable liquids or combustible liquids stored in cabinets or rooms shall be separated from other dangerous goods in conformance with Article 4.2.2.3.,4.0,2,6,5,1
F,ON,2015,NBC,Div B,EN,ofc2019_divb,B,4.3.1.2.(1),Atmospheric storage tanks,"Subject to Sentences (2), (3), (4), (5), (6), (7) and (8) and Section 4.9, atmospheric storage tanks shall be built in accordance with API 12B, Bolted Tanks for Storage of Production Liquids, API 12D, Field Welded Tanks for Storage of Production Liquids, API 12F, Shop Welded Tanks for Storage of Production Liquids, API 650, Welded Tanks for Oil Storage, CAN/ULC-S601, Standard for Shop Fabricated Steel Aboveground Tanks for Flammable and Combustible Liquids, CAN/ULC-S602, Aboveground Steel Tanks for Fuel Oil and Lubricating Oil, ULC-S603, Standard for Steel Underground Tanks for Flammable and Combustible Liquids, CAN/ULC-S603.1, External Corrosion Protection Systems for Steel Underground Tanks for Flammable and Combustible Liquids, ULC-S615, Standard for Reinforced Plastic Underground Tanks for Flammable and Combustible Liquids, CAN/ULC-S652, Standard for Tank Assemblies for the Collection, Storage and Removal of Used Oil, CAN/ULC-S653, Standard for Aboveground Steel Contained Tank Assemblies for Flammable and Combustible Liquids, ULC-S655, Aboveground Protected Tank Assemblies for Flammable and Combustible Liquids, or ULC/ORD-C142.5, Concrete Encased Steel Aboveground Tank Assemblies for Flammable and Combustible Liquids.",4.0,3,1,2,1
F,ON,2015,NBC,Div B,EN,ofc2019_divb,B,5.14.9.5.(1),Smoking prohibited,Smoking shall not take place in a room where pin refinishing occurs.,5.0,14,9,5,1
F,ON,2015,NBC,Div B,EN,ofc2019_divb,B,5.4.2.7.(1),Storage limitations in workrooms,"The total amount of cellulose nitrate plastic materials, including the material in containers and on tables, in any one workroom shall not exceed 70 kg.",5.0,4,2,7,1
F,ON,2015,NBC,Div B,EN,ofc2019_divb,B,5.18.2.1.(1),Prohibited location,Ovens shall not be located in any storey below grade.,5.0,18,2,1,1
F,ON,2015,NBC,Div B,EN,ofc2019_divb,B,5.13.4.1.(1),Use,Salvage tanks shall be used only for temporary storage purposes.,5.0,13,4,1,1
F,ON,2015,NBC,Div B,EN,ofc2019_divb,B,9.8.4.2.(1),Smoke alarms,Smoke alarms shall be installed in each residential unit in accordance with Sentences 3.2.4.21.(1) to (4) of the 1994 Building Code.,9.0,8,4,2,1
F,ON,2015,NBC,Div B,EN,ofc2019_divb,B,2.7.2.2.(2),"Requirements for locking, latching and fastening devices","A door in an access to exit or an exit door may be equipped with an electromagnetic locking device that is approved or complies with the Building Code, unless the door is located in an elementary or secondary school or is an egress or exit door that serves a high hazard industrial occupancy.",2.0,7,2,2,2
F,ON,2015,NBC,Div B,EN,ofc2019_divb,B,9.7.5.1.(2),Sprinkler systems,"Despite Sentence (1), in a building not greater than 3 storeys in building height that provides sleeping accommodation for not more than 10 persons, a sprinkler system may be installed in accordance with NFPA 13D, Standard for the Installation of Sprinkler Systems in One- and Two-Family Dwellings and Manufactured Homes, except that the minimum quantity of available water shall be adequate for a demand duration of at least 20 minutes if stored water is used as the sole water supply source.",9.0,7,5,1,2
F,ON,2015,NBC,Div B,EN,ofc2019_divb,B,9.6.3.1.(2),Access to exits,"Access to exits through a dead end public corridor is deemed to be in compliance with Clause (1)(c) where the distance of travel, measured from any door along the corridor to a point where a choice of two directions of exit travel is available, does not exceed 6 m plus the width of the corridor.",9.0,6,3,1,2
