DOCTYPE,PT,Code Year,Code Book,Division,Language,DOCID,DIVISION,PT Sentence Number,ARTICLE_TITLE,PT Sentence Text,PARTNUM,SECTIONNUM,SUBSECTIONNUM,ARTICLENUM,SENTENCENUM
F,ON,2015,NBC,Div B,EN,ofc2019_divb,B,9.2.3.3.(2),Access to exits,"Existing access to exits through dead end corridors are deemed to be in compliance with Sentence (1) where the occupant load does not exceed 20 persons, and the travel distance does not exceed 6 m plus the width of the dead end corridor to a point where a choice of two directions of exit travel are available.",9.0,2,3,3,2
F,ON,2015,NBC,Div B,EN,ofc2019_divb,B,9.7.3.1.(1),Emergency lighting,"Emergency lighting shall be provided in exit stairways, public corridors and other principal access to exits.",9.0,7,3,1,1
F,ON,2015,NBC,Div B,EN,ofc2019_divb,B,7.1.1.2.(1),Requirements,"The fire emergency systems required by this Code and the Building Code shall be checked, inspected, tested and maintained in accordance with Sections 7.2 and 7.3.",7.0,1,1,2,1
F,ON,2015,NBC,Div B,EN,ofc2019_divb,B,4.4.7.12.(1),Protection of pipe risers,"Exposed pipe risers shall be protected against mechanical damage by installing such risers adjacent to walls or pilasters, between flanges of steel columns, or within securely anchored larger perforated pipe, and providing mechanical guards where the risers are exposed to mobile equipment.",4.0,4,7,12,1
F,ON,2015,NBC,Div B,EN,ofc2019_divb,B,4.4.10.7.(1),Non-inert gas transfer,"Subject to Sentence (2), compressed air or other non-inert gas pressure shall not be used in the transfer of flammable liquids or combustible liquids in a closed piping system.",4.0,4,10,7,1
F,ON,2015,NBC,Div B,EN,ofc2019_divb,B,6.6.5.8.(1),Hydrant water flow,A record of the hydrant operation as described in Article 6.6.5.7. shall be kept in conformance with Subsection 1.1.2.,6.0,6,5,8,1
F,ON,2015,NBC,Div B,EN,ofc2019_divb,B,3.3.4.7.(2),Heating equipment,Shields shall be provided that will prevent stored material from coming within 300 mm of any part of a heating system heat distribution network.,3.0,3,4,7,2
F,ON,2015,NBC,Div B,EN,ofc2019_divb,B,5.18.3.2.(1),Limiting temperature on combustible construction,The roof and floor of ovens and heaters and associated ductwork shall have sufficient clearance or be insulated where necessary to prevent the temperature from exceeding 90°C at any combustible part of the building assembly.,5.0,18,3,2,1
F,ON,2015,NBC,Div B,EN,ofc2019_divb,B,4.3.12.4.(1),Maximum quantities and location,"Except as provided in Subsection 4.2.8. and in Sentence (2), storage tanks for flammable liquids or combustible liquids shall be located in dedicated rooms conforming to Subsection 4.3.13., and located in conformance with Table 4.3.12.A.",4.0,3,12,4,1
F,ON,2015,NBC,Div B,EN,ofc2019_divb,B,5.14.4.2.(1),Equipment location,"Electrical components, including transformers, power packs and control equipment for the electrostatic removal of excess coating material (detearing), shall be located in an area where the vapour concentration of flammable liquids or combustible liquids cannot exceed 25% of the lower explosive limit.",5.0,14,4,2,1
F,ON,2015,NBC,Div B,EN,ofc2019_divb,B,9.5.5.2.(1),Standpipe systems,A standpipe and hose system in accordance with Articles 3.2.9.1. to 3.2.9.7. of the 1990 Building Code shall be installed in buildings more than 4 storeys in building height where the fifth or sixth storey is used for a residential occupancy.,9.0,5,5,2,1
F,ON,2015,NBC,Div B,EN,ofc2019_divb,B,9.4.4.4.(1),Shutdown of air handling systems,Recirculating air handling systems that serve more than 1 storey or more than one zone as described in Sentence 9.4.2.7.(1) shall be arranged to shut down upon actuation of the fire alarm system.,9.0,4,4,4,1
F,ON,2015,NBC,Div B,EN,ofc2019_divb,B,2.1.1.3.(2),Exceptions,"Section 2.2 (Fire Separations), Article 2.4.4.4. (Open-air burning), Subsection 2.4.7. (Vacant Buildings), Section 2.6 (Service Equipment), Section 2.11 (Insulation and Re-Insulation), Section 2.13 (Installation of Smoke Alarms), Section 2.15 (Portable Oxygen and Section 2.16 (Installation of Carbon Monoxide apply to individual dwelling units.",2.0,1,1,3,2
F,ON,2015,NBC,Div B,EN,ofc2019_divb,B,4.7.9.2.(1),Pressure relief,Cargo pumps capable of producing pressures in excess of the safe working pressure of the cargo hose shall be provided with pressure relief devices such as return lines or relief valves.,4.0,7,9,2,1
F,ON,2015,NBC,Div B,EN,ofc2019_divb,B,9.9.5.1.(3),Access for fire fighting,"In buildings not greater than 6 storeys in building height, existing access routes are deemed to comply with Sentence (1) if they have a clear width of at least 6 m, are capable of supporting the expected loads imposed by fire fighting equipment and surfaced with concrete, asphalt or other material that provides accessibility under all climatic conditions, are located not less than 3 m and not more than 15 m from the principal entrance, and are connected with a public thoroughfare.",9.0,9,5,1,3
F,ON,2015,NBC,Div B,EN,ofc2019_divb,B,4.4.5.3.(2),Flanged joints,Bronze flanges for 50 mm diameter or smaller size piping referred to in Article 4.4.5.2. are permitted to be used where copper and brass piping is permitted.,4.0,4,5,3,2
F,ON,2015,NBC,Div B,EN,ofc2019_divb,B,2.1.3.1.(1),Prohibited combinations of occupancies,"A building containing a major occupancy that is classified as an assembly occupancy, a care occupancy, a care and treatment occupancy, a detention occupancy or a residential occupancy shall not contain a major occupancy that is classified as a high hazard industrial occupancy.",2.0,1,3,1,1
F,ON,2015,NBC,Div B,EN,ofc2019_divb,B,6.4.2.6.(1),Standpipe identification,"Except as required in Sentence (2), each hose connection in a standpipe system shall be provided with a legible sign reading: FIRE HOSE FOR USE BY TRAINED PERSONS ONLY.",6.0,4,2,6,1
F,ON,2015,NBC,Div B,EN,ofc2019_divb,B,4.9.1.1.(3),Application,"If there is a conflict between the requirements of this Section and any other requirement in this Part, other than a requirement of Section 4.12, this Section shall prevail.",4.0,9,1,1,3
F,ON,2015,NBC,Div B,EN,ofc2019_divb,B,6.3.3.8.(5),Testing,"For the purposes of Sentences (2), (3) and (4), smoke alarms shall be tested by activating the smoke alarm test feature.",6.0,3,3,8,5
F,ON,2015,NBC,Div B,EN,ofc2019_divb,B,9.3.3.2.(1),Acceptable exits,Exits required by Article 9.3.3.1. shall comply with the requirements of Articles 9.9.2.2. and 9.9.2.3. of the 1986 Building Code.,9.0,3,3,2,1
F,ON,2015,NBC,Div B,EN,ofc2019_divb,B,9.9.2.12.(7),Fuel-fired appliances,"Despite Sentence (1), a fire separation is not required for a fuel-fired appliance located within a guest suite and serving only that guest suite.",9.0,9,2,12,7
F,ON,2015,NBC,Div B,EN,ofc2019_divb,B,4.3.6.1.(1),Provision of valves,Each connection to an aboveground storage tank through which liquid can normally flow shall be provided with an internal or external shut-off valve located as close as practical to the shell of the tank.,4.0,3,6,1,1
F,ON,2015,NBC,Div B,EN,ofc2019_divb,B,2.8.1.2.(2),Instructions in emergency procedures,Supervisory staff shall be available on notification of a fire emergency to fulfil their obligation as described in the fire safety plan.,2.0,8,1,2,2
F,ON,2015,NBC,Div B,EN,ofc2019_divb,B,5.11.2.6.(2),Portable extinguishers,Portable extinguishers with a minimum rating of 4A:40B:C shall be located no further than 7.6 m and no closer than 1.5 m from a bitumen kettle.,5.0,11,2,6,2
F,ON,2015,NBC,Div B,EN,ofc2019_divb,B,6.2.1.3.(3),Location,"In a detention occupancy, portable extinguishers are permitted to be located in secure areas, or in lockable cabinets provided identical keys for all cabinets are located at all supervisory or security stations, or electrical remote release devices that are designed to open upon power failure are provided for the cabinets.",6.0,2,1,3,3
F,ON,2015,NBC,Div B,EN,ofc2019_divb,B,9.1.4.7.(5),Review,"Where notification is by mail, it is deemed to have been served on the fifth day after the date of mailing.",9.0,1,4,7,5
F,ON,2015,NBC,Div B,EN,ofc2019_divb,B,3.4.2.1.(5),Fuel-fired industrial trucks,Propane cylinders shall be stored in conformance with Section 5.6.,3.0,4,2,1,5
F,ON,2015,NBC,Div B,EN,ofc2019_divb,B,4.8.2.1.(2),Location,"Except as provided in Sentence (4), outdoor processing equipment having emergency relief venting and a working pressure of not more than 17 kPa (gauge) shall be separated from property lines and buildings on the same property by distances equal to those in Table 4.3.2.A. for stable liquids, and 2.5 times those in Table 4.3.2.A. for unstable liquids.",4.0,8,2,1,2
F,ON,2015,NBC,Div B,EN,ofc2019_divb,B,6.6.5.4.(1),Hydrants,"Where the hydrant barrel is found to contain water under Article 6.6.5.3., the drain valve shall be inspected for operation.",6.0,6,5,4,1
F,ON,2015,NBC,Div B,EN,ofc2019_divb,B,2.10.2.3.(1),Flammable and combustible liquids,Flammable liquids and combustible liquids shall be stored in conformance with Part 4 and in areas inaccessible to children.,2.0,10,2,3,1
F,ON,2015,NBC,Div B,EN,ofc2019_divb,B,9.2.4.1.(1),Fire alarm systems,"Fire alarm and detection systems shall be installed in compliance with Subsection 3.2.4., excluding Article 3.2.4.7., of the 1986 Building Code.",9.0,2,4,1,1
F,ON,2015,NBC,Div B,EN,ofc2019_divb,B,3.3.1.6.(1),Pile clearance,A clearance of at least 600 mm shall be maintained between piles of tires and columns and enclosing walls.,3.0,3,1,6,1
F,ON,2015,NBC,Div B,EN,ofc2019_divb,B,4.9.3.2.(3),"Supports, foundations and anchorage",The area underneath any storage tank greater than 1.2 m in diameter shall be protected by an automatic special fire suppression system conforming to an applicable standard set out in Article 6.8.1.1.,4.0,9,3,2,3
F,ON,2015,NBC,Div B,EN,ofc2019_divb,B,9.4.2.3.(2),Combustible construction up to 4 storeys,"Floor assemblies and walls, columns and arches supporting floor assemblies shall have a fire-resistance rating not less than 45 min.",9.0,4,2,3,2
F,ON,2015,NBC,Div B,EN,ofc2019_divb,B,9.9.2.3.(3),Buildings up to 4 storeys,Smoke detectors shall be provided in corridors serving guest suites in buildings of combustible construction.,9.0,9,2,3,3
F,ON,2015,NBC,Div B,EN,ofc2019_divb,B,5.14.3.3.(1),Location,Operations involving materials that have been freshly coated with a liquid containing solvents having a flash point of less than 43°C shall be located in sprinklered rooms that are separated from other occupancies by fire separations having a fire-resistance rating not less than 2 h.,5.0,14,3,3,1
F,ON,2015,NBC,Div B,EN,ofc2019_divb,B,1.2.1.3.(1),Previous editions,"Despite Articles 1.2.1.1. and 1.2.1.2., the Chief Fire Official may permit compliance with an edition of a document previous to that referred to in this Code if the Chief Fire Official is satisfied that compliance with the edition referred to in this Code is impractical.",1.0,2,1,3,1
F,ON,2015,NBC,Div B,EN,ofc2019_divb,B,6.4.3.6.(1),Dry standpipes,Standpipe system piping which normally remains dry shall be hydrostatically tested in accordance with Article 6.4.3.2. at intervals of not more than five years.,6.0,4,3,6,1
F,ON,2015,NBC,Div B,EN,ofc2019_divb,B,6.3.1.3.(1),Monitoring,"If a fire alarm or voice communication system or any part thereof is shut down the fire department and building occupants shall be notified in accordance with Article 1.1.1.1., and the supervisory staff shall be notified.",6.0,3,1,3,1
F,ON,2015,NBC,Div B,EN,ofc2019_divb,B,2.7.1.6.(1),Nonfixed seating,Nonfixed row seating in an assembly occupancy shall be arranged as described in Sentences (2) to (8).,2.0,7,1,6,1
F,ON,2015,NBC,Div B,EN,ofc2019_divb,B,2.2.1.1.(1),Damaged fire separations,"Where fire separations between major occupancies are damaged in a manner so as to affect the integrity of their fire-resistance rating, such damaged fire separations shall be repaired so that the integrity of the fire separations is maintained.",2.0,2,1,1,1
F,ON,2015,NBC,Div B,EN,ofc2019_divb,B,5.11.2.5.(3),Firewatch,"Facilities shall be provided to enable the firewatch personnel to ensure that a fire warning is sounded to notify occupants, and communicate with the fire department.",5.0,11,2,5,3
F,ON,2015,NBC,Div B,EN,ofc2019_divb,B,9.5.2.13.(2),Vertical service spaces,"Where openings in the vertical service space, including the top and bottom, are sealed with noncombustible materials having the same fire-resistance rating as the existing construction, the vertical service space is deemed to be in compliance with Sentence (1).",9.0,5,2,13,2
F,ON,2015,NBC,Div B,EN,ofc2019_divb,B,9.4.3.6.(2),Fire escapes,"A fire escape permitted under Sentence (1) shall be constructed to comply with the requirements of Article 3.4.7.13. of the 1986 Building Code, except that the fire escape shall not be less than 1100 mm in width when serving floor areas with non-ambulatory residents.",9.0,4,3,6,2
F,ON,2015,NBC,Div B,EN,ofc2019_divb,B,9.9.2.7.(4),Interconnected floor spaces,Interconnected floor spaces in conformance with Subsection 3.2.8. of the 1994 Building Code are deemed to be in compliance with Sentence (1).,9.0,9,2,7,4
F,ON,2015,NBC,Div B,EN,ofc2019_divb,B,4.7.7.3.(2),Hose connections,The use of cam-locking connections up to 100 mm in size shall be permitted.,4.0,7,7,3,2
F,ON,2015,NBC,Div B,EN,ofc2019_divb,B,9.1.3.1.(1),"Compliance time for health care facilities, care occupancies and retirement homes","It is the responsibility of the owner of a building containing a home described in Section 9.4 to comply with Article 9.4.5.5. as of January 1, 2025.",9.0,1,3,1,1
F,ON,2015,NBC,Div B,EN,ofc2019_divb,B,2.14.1.2.(2),Fire hazards,"Hay, straw, shavings, textiles, films or similar combustible materials shall not be used in the design and construction or as decorative features in outdoor public amusement areas unless approved provisions are made to control the hazard.",2.0,14,1,2,2
F,ON,2015,NBC,Div B,EN,ofc2019_divb,B,4.1.5.4.(1),Smoking prohibited,"Smoking shall not take place in areas described in Article 4.1.1.1., except as provided in Subsection 2.4.3.",4.0,1,5,4,1
F,ON,2015,NBC,Div B,EN,ofc2019_divb,B,4.2.11.2.(1),Mixed storage,"If two or more liquids with different flash points are stored outdoors in containers that form a single pile, the maximum total quantity in the pile shall be equal to the maximum quantity permitted for the liquid with the lowest flash point.",4.0,2,11,2,1
F,ON,2015,NBC,Div B,EN,ofc2019_divb,B,9.2.3.18.(2),Ancillary rooms,Existing openings are deemed to comply with Sentence (1) if each opening is sprinklered and the sprinkler system complies with Article 9.2.5.2.,9.0,2,3,18,2
F,ON,2015,NBC,Div B,EN,ofc2019_divb,B,9.7.4.3.(4),Smoke alarms,"Smoke alarms required in Sentence (1) shall conform to CAN/ULC-S531, Standard for Smoke Alarms.",9.0,7,4,3,4
F,ON,2015,NBC,Div B,EN,ofc2019_divb,B,4.12.4.1.(1),Fire safety plan,"Except as provided in Sentences (2) to (4), a laboratory shall conform with the requirements of Section 2.8.",4.0,12,4,1,1
F,ON,2015,NBC,Div B,EN,ofc2019_divb,B,3.2.1.8.(4),Fencing and gateways,The gateways shall be high enough to permit the entry of fire department vehicles.,3.0,2,1,8,4
F,ON,2015,NBC,Div B,EN,ofc2019_divb,B,3.3.3.7.(3),Disposal,Unsalvageable material shall be removed by sweeping and burial.,3.0,3,3,7,3
F,ON,2015,NBC,Div B,EN,ofc2019_divb,B,9.9.2.12.(5),Fuel-fired appliances,"Where an appliance is separated in conformance with this Article, sufficient combustion air shall be brought directly from the outside for the safe operation of the appliance.",9.0,9,2,12,5
F,ON,2015,NBC,Div B,EN,ofc2019_divb,B,9.9.2.19.(3),Cooking operations,"Pipes, ducts, plenums and other components of the exhaust system shall be constructed of steel, approved noncombustible material or other approved material.",9.0,9,2,19,3
F,ON,2015,NBC,Div B,EN,ofc2019_divb,B,6.5.4.4.(1),Fire department connections,"Except when in use or being inspected in accordance with Sentence (2), fire department connections shall be equipped with plugs or caps that are secured wrench-tight.",6.0,5,4,4,1
F,ON,2015,NBC,Div B,EN,ofc2019_divb,B,2.6.1.12.(4),Exhaust and fire protection systems in cooking operations,"In a hotel establishment regulated by Section 9.9, a cooking operation that meets the requirements of Article 9.9.2.19. is deemed to be in compliance with Sentence (1).",2.0,6,1,12,4
F,ON,2015,NBC,Div B,EN,ofc2019_divb,B,4.6.3.2.(2),Dispensing into vehicles,"Where a dispenser referred to in Sentence (1) is supplied from an aboveground storage tank, an automatically operated valve, that is designed to open only when the dispenser is being operated, shall be provided at the tank outlet, and an emergency valve that complies with CAN/ULC-S651, Standard for Emergency Valves for Flammable and Combustible Liquids shall be installed in the supply line so that the shear point of the valve is not higher than the base of the dispenser and not lower than 25 mm below the base of the dispenser.",4.0,6,3,2,2
F,ON,2015,NBC,Div B,EN,ofc2019_divb,B,3.3.4.5.(1),Baled storage piles,The sides of baled storage piles shall be inclined back from the base of the pile with a slope of not less than 1 m for each 10 m of height.,3.0,3,4,5,1
F,ON,2015,NBC,Div B,EN,ofc2019_divb,B,5.10.1.13.(1),Grounding,Machinery and metal parts of the equipment in Article 5.10.1.12. and related conveying systems shall be electrically grounded.,5.0,10,1,13,1
F,ON,2015,NBC,Div B,EN,ofc2019_divb,B,9.6.4.3.(1),Manual pull stations,Manual pull stations shall be provided in accordance with Article 3.2.4.17. of the 1990 Building Code.,9.0,6,4,3,1
F,ON,2015,NBC,Div B,EN,ofc2019_divb,B,4.3.13.5.(5),Placards,"Despite Clause 2(a), where storage consists of more than one class of liquid, placards that indicate the danger symbol or individual placards for each class of liquid shall be acceptable.",4.0,3,13,5,5
F,ON,2015,NBC,Div B,EN,ofc2019_divb,B,6.3.2.1.(2),Obligation to ensure compliance,"The owner shall ensure that any person performing the annual tests or annual inspections required by this Subsection for interconnected smoke alarm systems or performing the tests or maintenance for interconnected smoke alarm systems referred to in Article 6.3.2.6. is in compliance with the requirements of Clause 1.2.2.2.(1)(a) of Division C, or Sentence 1.2.2.2.(2) of Division C.",6.0,3,2,1,2
F,ON,2015,NBC,Div B,EN,ofc2019_divb,B,9.9.2.2.(3),Buildings up to 3 storeys,"Where sleeping accommodation or meeting rooms are not provided in the basement, an existing fire separation between the first storey and basement is deemed to be in compliance with Sentence (2) where the basement is sprinklered, the building contains not more than four guest suites and provides sleeping accommodation for not more than 10 persons, and interconnected smoke alarms are installed in conformance with Clause 9.9.4.1.(3)(c), doors connecting the basement and first storey have a fire-protection rating not less than 20 min and are equipped with self-closing and latching devices, and fire stopping of the wall space at the basement level is in conformance with Article 9.10.15.3. of the 1994 Building Code, or the building is 1 storey in building height, not more than 600 m2 in building area, and each guest suite has direct access to the outdoors by a door near ground level, doors connecting the basement and first storey have a fire-protection rating not less than 20 min and are equipped with self-closing and latching devices, fire stopping of the wall space at the basement level is in accordance with Article 9.10.15.3. of the 1994 Building Code, and an approved early warning system is installed consisting of fire detectors in the basement interconnected with alarm signalling devices that are audible in all guest suites.",9.0,9,2,2,3
F,ON,2015,NBC,Div B,EN,ofc2019_divb,B,4.12.8.1.(2),Scope and application,"Despite Sentence (1), existing ventilation systems need not conform with Articles 4.1.7.3., 4.1.7.4. and 4.12.8.2. to 4.12.8.5.",4.0,12,8,1,2
F,ON,2015,NBC,Div B,EN,ofc2019_divb,B,3.5.2.4.(3),Combustible metals,Lettering on warning signs shall be red or white letters 114 mm high with a 19 mm stroke on a contrasting background.,3.0,5,2,4,3
F,ON,2015,NBC,Div B,EN,ofc2019_divb,B,4.6.1.1.(1),Application,This Section applies to that portion of a property where flammable liquids or combustible liquids are received in bulk quantities and are stored or handled for the purpose of being distributed.,4.0,6,1,1,1
F,ON,2015,NBC,Div B,EN,ofc2019_divb,B,2.4.7.1.(1),Electrical wiring,Vacant buildings shall be secured against unauthorized entry.,2.0,4,7,1,1
F,ON,2015,NBC,Div B,EN,ofc2019_divb,B,3.2.2.5.(1),Clearance for stickered lumber piles,Stickered lumber piles in storage yards shall be located at least 15 m from property lines and buildings.,3.0,2,2,5,1
F,ON,2015,NBC,Div B,EN,ofc2019_divb,B,2.7.1.7.(1),Maintenance and lighting for exits,Means of egress shall be maintained in good repair and free of obstructions.,2.0,7,1,7,1
F,ON,2015,NBC,Div B,EN,ofc2019_divb,B,9.5.4.3.(3),Automatic detection,Rooms or areas that are sprinklered in accordance with Article 3.2.4.16. of the 1990 Building Code are deemed to be in compliance with Sentence (2).,9.0,5,4,3,3
F,ON,2015,NBC,Div B,EN,ofc2019_divb,B,9.6.2.7.(1),Storage rooms,"Storage rooms for the use of occupants, not contained within a dwelling unit or suite, shall be separated from the remainder of the building by a fire separation having a fire-resistance rating not less than 1 h, and sprinklered in accordance with Article 9.6.5.5.",9.0,6,2,7,1
F,ON,2015,NBC,Div B,EN,ofc2019_divb,B,9.8.2.4.(1),Combustion air,"Where a room containing a fuel-fired appliance is enclosed to satisfy other provisions of this Section in a manner that restricts the supply of combustion air, sufficient combustion air shall be brought directly from the outside for the proper combustion and safe operation of the appliance.",9.0,8,2,4,1
F,ON,2015,NBC,Div B,EN,ofc2019_divb,B,9.3.3.5.(1),Protection of exits,Each exit other than a doorway opening directly onto a fire escape or to the outdoors at ground level shall be separated from the remainder of the building or from another exit by a fire separation having a fire-resistance rating not less than 30 min.,9.0,3,3,5,1
F,ON,2015,NBC,Div B,EN,ofc2019_divb,B,9.2.3.9.(1),Total width,"Where the total number of exits and the total width of exits comply with Articles 9.2.3.6. and 9.2.3.7., existing corridor and stair widths are deemed to be in compliance with Article 9.2.3.8.",9.0,2,3,9,1
F,ON,2015,NBC,Div B,EN,ofc2019_divb,B,3.5.1.4.(1),Fire access gates,"Where storage areas are fenced or otherwise enclosed, gates having a clear width of 3.5 m shall be provided to permit the entry of fire department vehicles.",3.0,5,1,4,1
F,ON,2015,NBC,Div B,EN,ofc2019_divb,B,4.8.4.3.(1),Fire prevention and protection,"An evaluation of the fire and explosion risks shall be undertaken to consider the material properties, quantities, operating conditions, storage arrangement, transportation, process design, operating and maintenance procedures.",4.0,8,4,3,1
F,ON,2015,NBC,Div B,EN,ofc2019_divb,B,2.8.2.5.(2),Posting fire emergency procedures,"In addition to Sentence (1), in a hotel establishment one copy of the approved fire safety plan shall be posted in the main reception area, and a copy of the emergency procedures, location of exits and the fire safety rules shall be posted on the inside of the egress doors of each guest suite.",2.0,8,2,5,2
F,ON,2015,NBC,Div B,EN,ofc2019_divb,B,2.8.2.5.(3),Posting fire emergency procedures,"Where a fire alarm system has been installed with no provisions to transmit a signal to the fire department, a legible notice, that is not easily removed, shall be affixed to the wall near each manual pull station with wording that the fire department is to be notified in the event of a fire emergency and including the emergency telephone number for the municipality or the telephone number of the fire department.",2.0,8,2,5,3
F,ON,2015,NBC,Div B,EN,ofc2019_divb,B,4.3.12.3.(1),Maximum static head,The static head imposed on a storage tank inside a building shall not exceed 70 kPa (gauge) at the bottom of the tank when the vent or fill pipe is filled with liquid unless the tank is designed for greater pressures.,4.0,3,12,3,1
F,ON,2015,NBC,Div B,EN,ofc2019_divb,B,4.7.6.1.(2),Portable extinguishers,"Portable extinguishers shall be kept in the pump house or other suitable location where they will be accessible in the event of an emergency, but not accessible to the public.",4.0,7,6,1,2
F,ON,2015,NBC,Div B,EN,ofc2019_divb,B,8.1.2.8.(2),Portable extinguishers,"In addition to the other requirements of this Code, if a building is under demolition, portable extinguishers shall be provided adjacent to hot work operations, in areas where combustibles are stored, near or on any internal combustion engines, adjacent to areas where flammable liquids, combustible liquids or gases are stored or handled, adjacent to temporary oil-fired or gas-fired equipment, and adjacent to bitumen heating equipment.",8.0,1,2,8,2
F,ON,2015,NBC,Div B,EN,ofc2019_divb,B,9.9.5.4.(1),Sprinkler systems,"Unless otherwise approved, where a building or portion thereof is required to be sprinklered, the sprinkler system shall be designed and constructed in conformance with Articles 3.2.5.13. to 3.2.5.16. of the 1994 Building Code.",9.0,9,5,4,1
F,ON,2015,NBC,Div B,EN,ofc2019_divb,B,4.4.10.5.(5),Hydraulic transfer systems,Hydraulic transfer systems referred to in Sentence (1) shall be arranged so that there is no water pressure on the system except when liquid is being discharged.,4.0,4,10,5,5
