DOCTYPE,PT,Code Year,Code Book,Division,Language,DOCID,DIVISION,PT Sentence Number,ARTICLE_TITLE,PT Sentence Text,PARTNUM,SECTIONNUM,SUBSECTIONNUM,ARTICLENUM,SENTENCENUM
F,ON,2015,NBC,Div B,EN,ofc2019_divb,B,9.9.2.17.(2),"Pipes, ducts and plenums","Despite Sentence (1), an exit through a lobby or other entrance area that is within a stairway separation may be breached if the stairway is separated from the entrance area by a fire separation having a fire-resistance rating not less than 45 min.",9.0,9,2,17,2
F,ON,2015,NBC,Div B,EN,ofc2019_divb,B,6.6.3.1.(1),Fire pump reservoirs,The water level in the fire pump reservoir shall be checked weekly.,6.0,6,3,1,1
F,ON,2015,NBC,Div B,EN,ofc2019_divb,B,7.2.5.1.(1),Maintenance of certain fire emergency systems,"In addition to the requirements of Part 6, components of fire emergency systems shall be maintained in accordance with Sentences (2) to (7).",7.0,2,5,1,1
F,ON,2015,NBC,Div B,EN,ofc2019_divb,B,2.2.3.4.(5),Door in a fire separation,A door opening in a fire separation and the areas surrounding the door opening shall be kept clear of anything that would be likely to obstruct or interfere with the free operation of the door.,2.0,2,3,4,5
F,ON,2015,NBC,Div B,EN,ofc2019_divb,B,2.4.4.2.(2),Open flames prohibited,"In assembly occupancies, flaming meals or drinks shall be ignited only at the location of serving.",2.0,4,4,2,2
F,ON,2015,NBC,Div B,EN,ofc2019_divb,B,2.14.1.3.(1),Ignition sources,"Smoking shall not take place and open flames, temporary wiring, heat-producing equipment and similar ignition sources shall not be used if they would create a fire hazard, except in approved areas.",2.0,14,1,3,1
F,ON,2015,NBC,Div B,EN,ofc2019_divb,B,5.17.3.3.(3),Work on containers,At least one portable extinguisher conforming to Section 6.2 shall be provided in the hot work area.,5.0,17,3,3,3
F,ON,2015,NBC,Div B,EN,ofc2019_divb,B,5.12.2.3.(5),Overspray collection,Maintenance procedures shall be established to ensure that overspray collection filters are replaced before excessive restriction to airflow occurs.,5.0,12,2,3,5
F,ON,2015,NBC,Div B,EN,ofc2019_divb,B,6.3.2.4.(1),Voice communication systems,"Voice communication systems that are integrated with a fire alarm system shall be tested in conformance with CAN/ULC-S536, Inspection and Testing of Fire Alarm Systems.",6.0,3,2,4,1
F,ON,2015,NBC,Div B,EN,ofc2019_divb,B,4.12.8.1.(4),Scope and application,Existing ventilation systems that maintain a negative pressure within the ventilation system with respect to the surroundings are deemed to be in compliance with Article 4.1.7.7.,4.0,12,8,1,4
F,ON,2015,NBC,Div B,EN,ofc2019_divb,B,6.5.5.2.(1),Alarm testing,"Except as provided in Article 6.5.5.7., the alarm on all sprinkler systems shall be tested monthly by flowing water through the test connection located at the sprinkler valve.",6.0,5,5,2,1
F,ON,2015,NBC,Div B,EN,ofc2019_divb,B,9.9.5.1.(1),Access for fire fighting,Access routes for fire fighting shall be provided in conformance with the requirements of Articles 3.2.5.5. to 3.2.5.7. of the 1994 Building Code.,9.0,9,5,1,1
F,ON,2015,NBC,Div B,EN,ofc2019_divb,B,5.12.3.6.(1),Monitoring air velocity,Gauges or alarms that indicate when the air velocity is less than the air velocity required by Article 5.12.3.2. or 5.12.3.3. shall be installed for spray booths.,5.0,12,3,6,1
F,ON,2015,NBC,Div B,EN,ofc2019_divb,B,6.3.4.7.(6),Replacement in certain buildings,"The Chief Fire Official may approve an alternative to a requirement of Sentence (4) or (5) if, in the opinion of the Chief Fire Official, the alternative provides life safety protection equivalent to or greater than the life safety protection that would be provided by the requirement.",6.0,3,4,7,6
F,ON,2015,NBC,Div B,EN,ofc2019_divb,B,4.8.3.4.(2),Ventilation,"Equipment used in a building and the ventilation of the building shall be designed so as to limit flammable vapour-air mixtures under normal operating conditions to the interior of equipment, and to not more than 1.5 m from such equipment.",4.0,8,3,4,2
F,ON,2015,NBC,Div B,EN,ofc2019_divb,B,3.3.3.4.(1),Portable extinguishers,"In addition to the requirements of Section 6.2, pressurized-water portable extinguishers having a rating of 2A or larger shall be installed.",3.0,3,3,4,1
F,ON,2015,NBC,Div B,EN,ofc2019_divb,B,6.4.3.8.(1),Hotels,"In buildings containing a hotel, flow and pressure tests shall be conducted annually at the highest and most remote hose valve or hose connection to verify that the water supply for the standpipe system is provided as originally designed.",6.0,4,3,8,1
F,ON,2015,NBC,Div B,EN,ofc2019_divb,B,2.8.3.2.(4),Frequency,"For an extended day program or third party program operated under section 259 of the Education Act, or for a day nursery or part of a day nursery described in Subclause (2)(e)(iii), a total evacuation fire drill shall be held if the program, day nursery or part of a day nursery is in operation during the fall term, at least three times during that term, if the program, day nursery or part of a day nursery is in operation during the spring term, at least three times during that term, and if the program, day nursery or part of a day nursery is in operation during the summer, at least three times or at least once a month during the period it is in operation, whichever is less.",2.0,8,3,2,4
F,ON,2015,NBC,Div B,EN,ofc2019_divb,B,4.4.7.1.(2),Location,"Where piping for flammable liquids or combustible liquids is installed within a building, the length of piping shall be as direct and as short as practicable.",4.0,4,7,1,2
F,ON,2015,NBC,Div B,EN,ofc2019_divb,B,4.1.3.1.(4),Determination of flash point,"The flash point for paints, enamels, lacquers, varnishes and related products and their components having flash points between 0°C and 110°C, and having a viscosity less than 15000 mm2/s at 25°C may be determined in conformance with ASTM D3278, Flash Point of Liquids by Small Scale Closed-Cup Apparatus.",4.0,1,3,1,4
F,ON,2015,NBC,Div B,EN,ofc2019_divb,B,2.16.1.1.(1),Application,"Subject to Sentence (2), this Section applies to every building that contains a residential occupancy and a fuel-burning appliance, a fireplace, or a storage garage.",2.0,16,1,1,1
F,ON,2015,NBC,Div B,EN,ofc2019_divb,B,9.2.5.2.(6),Sprinkler systems,"The water supply requirements for an existing sprinkler system in an arena or an exhibition hall shall be based on the lesser area of 100% of the display area, or 280 m2.",9.0,2,5,2,6
F,ON,2015,NBC,Div B,EN,ofc2019_divb,B,5.14.6.4.(2),Grounding,Electrically conductive objects within the charging influence of the electrodes of electrostatic fluidized beds shall be grounded.,5.0,14,6,4,2
F,ON,2015,NBC,Div B,EN,ofc2019_divb,B,9.2.1.2.(1),Exemption for educational facilities and hotels,"This Section does not apply to assembly occupancies in buildings that are regulated under the Education Act or the Ministry of Training, Colleges and Universities Act.",9.0,2,1,2,1
F,ON,2015,NBC,Div B,EN,ofc2019_divb,B,9.6.5.6.(1),Firefighters   elevators,At least one elevator shall be provided for use by firefighters in accordance with Articles 3.2.6.8. and 3.2.6.9. of the 1990 Building Code in buildings where the vertical distance between the floor of the top storey and grade exceeds 18 m.,9.0,6,5,6,1
F,ON,2015,NBC,Div B,EN,ofc2019_divb,B,9.7.1.3.(1),Additional requirements,"In addition to the requirements of this Section, a building not greater than 6 storeys in building height shall comply with Subsections 9.5.2. to 9.5.5., and a building greater than 6 storeys in building height shall comply with Subsections 9.6.2. to 9.6.5.",9.0,7,1,3,1
F,ON,2015,NBC,Div B,EN,ofc2019_divb,B,9.4.2.2.(1),Combustible construction up to 2 storeys,"Buildings of combustible construction shall comply with the provisions of Sentence (2) where the building is 1 storey in building height and not greater than 1000 m2 in building area, or 2 storeys in building height and not greater than 500 m2 in building area.",9.0,4,2,2,1
F,ON,2015,NBC,Div B,EN,ofc2019_divb,B,3.3.2.6.(2),Fire access aisles,"Access aisles not less than 1.0 m wide shall be provided to exits, to fire department access panels and to fire protection equipment.",3.0,3,2,6,2
F,ON,2015,NBC,Div B,EN,ofc2019_divb,B,4.3.1.10.(3),Reuse,"A storage tank is permitted to be refurbished for underground use in conformance with one of the following standards: ULC-S603(A), Refurbishing of Steel Underground Tanks for Flammable and Combustible Liquids, ULC-S615(A), Refurbishing of Reinforced Plastic Underground Tanks for Flammable and Combustible Liquids.",4.0,3,1,10,3
F,ON,2015,NBC,Div B,EN,ofc2019_divb,B,4.3.17.1.(1),Underground storage tanks,"When underground storage tanks will be out of service for a period not exceeding 180 days, the liquid level in the storage tank shall be measured at intervals not greater than one month and a record of such measurements shall be retained for inspection, fill pipe covers and covers over openings to measure liquid levels, dispensers and power controls shall be kept locked when not in use, and vent piping shall be kept open.",4.0,3,17,1,1
F,ON,2015,NBC,Div B,EN,ofc2019_divb,B,4.3.15.5.(1),Liquid media leakage tests,"Where a leakage test incorporating a liquid test medium, including a flammable liquid or combustible liquid, is performed on an underground storage tank, the tank shall be considered to be leaking when, with compensation for volume differentials caused by effects of temperature and tank shell distortion, the test indicates a liquid loss.",4.0,3,15,5,1
F,ON,2015,NBC,Div B,EN,ofc2019_divb,B,6.4.2.2.(1),Hose stations,Standpipe and hose system equipment shall be used for fire protection only.,6.0,4,2,2,1
F,ON,2015,NBC,Div B,EN,ofc2019_divb,B,9.5.4.1.(3),Fire alarm requirements,"A building is deemed to be in compliance with Sentence (1) where each exit and public corridor is shared by not more than four dwelling units or not more than 10 persons in boarding, lodging, rooming or dormitory accommodation, or each dwelling unit and suite has direct access to outdoors by a door near ground level.",9.0,5,4,1,3
F,ON,2015,NBC,Div B,EN,ofc2019_divb,B,5.18.5.1.(1),Cleaning of ovens and ductwork,"Ovens and associated ductwork shall be inspected, cleaned and maintained internally and externally at intervals sufficient to prevent the accumulation of combustible deposits.",5.0,18,5,1,1
F,ON,2015,NBC,Div B,EN,ofc2019_divb,B,5.12.10.14.(1),Spray gun operation,Spray gun handles shall be grounded and have a metallic connection that is in direct contact with the operator s hand during spraying.,5.0,12,10,14,1
F,ON,2015,NBC,Div B,EN,ofc2019_divb,B,9.8.4.2.(2),Smoke alarms,Battery-operated smoke alarms are deemed to be in compliance with Sentence 3.2.4.21.(4) of the 1994 Building Code.,9.0,8,4,2,2
F,ON,2015,NBC,Div B,EN,ofc2019_divb,B,4.6.3.1.(1),Interconnection,Dispensing systems for Class I liquids shall not be interconnected with dispensing systems for Class II and IIIA liquids.,4.0,6,3,1,1
F,ON,2015,NBC,Div B,EN,ofc2019_divb,B,4.6.4.3.(1),Backflow preventers,Systems through which tank cars or tank vehicles discharge into storage tanks by means of a pump shall be provided with backflow preventers located to prevent spills and inadvertent mixing of liquids.,4.0,6,4,3,1
F,ON,2015,NBC,Div B,EN,ofc2019_divb,B,6.6.3.2.(1),Pump room temperature,The temperature of pump rooms shall be checked daily during freezing weather.,6.0,6,3,2,1
F,ON,2015,NBC,Div B,EN,ofc2019_divb,B,4.7.2.1.(2),Clearances,The termination of fixed piping for loading and unloading flammable liquids or combustible liquids shall be not less than 60 m from a bridge or from an entrance to a tunnel.,4.0,7,2,1,2
F,ON,2015,NBC,Div B,EN,ofc2019_divb,B,9.1.4.6.(4),Extension following Order,Notification shall be served either personally or by mail.,9.0,1,4,6,4
F,ON,2015,NBC,Div B,EN,ofc2019_divb,B,3.3.2.2.(3),Storage dimensions,Heights of storage in buildings that are not sprinklered shall not exceed 4.5 m.,3.0,3,2,2,3
F,ON,2015,NBC,Div B,EN,ofc2019_divb,B,5.10.1.3.(1),Dust containment,"Machinery that produces, agitates or conveys combustible dusts shall have dust-tight casings or enclosures, and be connected to a dust-collecting system that exhausts to the outside, subject to Sentence 5.10.1.5.(3).",5.0,10,1,3,1
F,ON,2015,NBC,Div B,EN,ofc2019_divb,B,5.18.3.3.(3),Explosion vents,Existing explosion vents that provide a vent ratio of 0.2 m2 of vent area for each cubic metre of oven volume are deemed to satisfy the vent ratio for the purposes of NFPA 68 in Sentence (1).,5.0,18,3,3,3
F,ON,2015,NBC,Div B,EN,ofc2019_divb,B,9.6.1.2.(2),"Exemption for convents, monasteries and hotels",This Section does not apply to a building or part of a building regulated under Section 9.9.,9.0,6,1,2,2
F,ON,2015,NBC,Div B,EN,ofc2019_divb,B,5.14.5.2.(1),Undercoating materials,Automobile undercoating materials shall have a flash point of not less than 37.8°C.,5.0,14,5,2,1
F,ON,2015,NBC,Div B,EN,ofc2019_divb,B,9.2.3.11.(2),Fire escape construction,"Despite Sentence (1), an existing fire escape may be approved.",9.0,2,3,11,2
F,ON,2015,NBC,Div B,EN,ofc2019_divb,B,2.9.2.1.(1),Flameproofing treatments,"Flameproofing treatments shall be renewed as often as necessary to ensure that the material will pass the match flame test in NFPA 705, Recommended Practice for a Field Flame Test for Textiles and Films.",2.0,9,2,1,1
F,ON,2015,NBC,Div B,EN,ofc2019_divb,B,4.2.6.4.(1),Containers,"Where individual containers with a capacity of more than 5 L are required for storage of flammable liquids or combustible liquids in a building, safety containers conforming to ULC/ORD-C30, Safety Containers, and of not more than 25 L capacity, shall be used.",4.0,2,6,4,1
F,ON,2015,NBC,Div B,EN,ofc2019_divb,B,6.4.2.4.(1),Hose valves,Hose valves shall be inspected annually to ensure that they are tight so that there is no water leakage into the hose.,6.0,4,2,4,1
F,ON,2015,NBC,Div B,EN,ofc2019_divb,B,5.18.6.3.(1),Fire access doors,Doors or other means of access shall be provided in ovens and associated ductwork so that portable extinguishers or hose streams may be used in all parts of the equipment.,5.0,18,6,3,1
F,ON,2015,NBC,Div B,EN,ofc2019_divb,B,9.2.3.4.(2),Minimum number of exits,"Despite Sentence (1), floor areas in buildings not exceeding 2 storeys in building height may be served by one exit where the occupant load for the floor area does not exceed 60 persons, the floor area does not exceed 200 m2, and the travel distance from any point on the floor area does not exceed 15 m.",9.0,2,3,4,2
F,ON,2015,NBC,Div B,EN,ofc2019_divb,B,4.3.12.8.(1),Vents,"Except as provided in Sentence (2), normal and emergency vents for storage tanks in buildings shall be provided in conformance with Subsections 4.3.4. and 4.3.5.",4.0,3,12,8,1
F,ON,2015,NBC,Div B,EN,ofc2019_divb,B,9.9.2.8.(3),Fire separation of guest suites,Existing fire separations are deemed to comply with Sentences (1) and (2) if the floor area is sprinklered.,9.0,9,2,8,3
F,ON,2015,NBC,Div B,EN,ofc2019_divb,B,9.5.5.2.(3),Standpipe systems,"Despite Sentences (1) and (2), existing standpipe systems and water supplies may be used if the systems or measures will provide sufficient fire suppression capability in the circumstances and if the systems or measures are approved.",9.0,5,5,2,3
F,ON,2015,NBC,Div B,EN,ofc2019_divb,B,9.4.2.13.(2),Vertical service spaces,"Where openings in the vertical service space, including the top and bottom, are sealed with noncombustible materials having the same fire-resistance rating as the existing construction, the vertical service space is deemed to be in compliance with Sentence (1).",9.0,4,2,13,2
F,ON,2015,NBC,Div B,EN,ofc2019_divb,B,4.8.4.2.(1),Explosion protection,"Processing equipment where an explosion hazard is present shall be designed to withstand the explosion pressure without damage to the equipment, provided with explosion venting in conformance with NFPA 68, Standard on Explosion Protection by Deflagration Venting, or provided with an explosion prevention system in conformance with NFPA 69, Standard on Explosion Prevention Systems.",4.0,8,4,2,1
F,ON,2015,NBC,Div B,EN,ofc2019_divb,B,4.3.3.1.(2),Foundations and supports,Tank supports shall be installed on firm foundations designed to minimize uneven settling of the tank and to minimize corrosion of the part of the tank resting on the foundation.,4.0,3,3,1,2
F,ON,2015,NBC,Div B,EN,ofc2019_divb,B,4.7.6.1.(4),Portable extinguishers,Portable extinguishers provided in conformance with Sentence (3) shall be in addition to those provided on board the marine vessels.,4.0,7,6,1,4
F,ON,2015,NBC,Div B,EN,ofc2019_divb,B,4.3.2.1.(3),Location,"Every aboveground storage tank containing unstable liquids and having a working pressure of not more than 17 kPa (gauge) shall be separated from a property line and any building on the same property by distances equal to those in Table 4.3.2.A., but not less than 7.5 m, where protection is provided against fire or explosion in the tank in conformance with Sentence 4.3.2.5.(2), or three times those in Table 4.3.2.A., but not less than 15 m, where protection referred to in Clause (a) is not provided.",4.0,3,2,1,3
F,ON,2015,NBC,Div B,EN,ofc2019_divb,B,3.2.1.4.(2),"Pile dimensions, locations and clearance","Despite Article 3.5.2.1., storage piles of tires or shredded tires in a storage yard shall be located at least 15 m from property lines, at least 15 m from buildings, at least 4.5 m from combustible ground vegetation comprised of grass and weeds, and at least 30 m away from combustible ground vegetation comprised of brush and forested areas.",3.0,2,1,4,2
F,ON,2015,NBC,Div B,EN,ofc2019_divb,B,9.2.1.2.(2),Exemption for educational facilities and hotels,This Section does not apply to a building or part of a building regulated under Section 9.9.,9.0,2,1,2,2
F,ON,2015,NBC,Div B,EN,ofc2019_divb,B,4.3.13.5.(3),Placards,"Despite Clause (2)(a), where storage consists of a single product, placards that identify the liquid using the UN Product Identification Number (PIN) shall be acceptable.",4.0,3,13,5,3
F,ON,2015,NBC,Div B,EN,ofc2019_divb,B,9.6.2.16.(2),Smoke control measures,"Buildings are deemed to be in compliance with Sentence (1) where all dwelling units have access to an exterior balcony, the length of public corridors does not exceed 30 m between exits, public corridors on each floor area are equipped with smoke detectors connected to the fire alarm system, public corridors on each floor area are subdivided in accordance with Sentence (3), or the building is fully sprinklered.",9.0,6,2,16,2
F,ON,2015,NBC,Div B,EN,ofc2019_divb,B,4.12.8.5.(2),Enclosure construction,"Combustible materials are permitted in systems described in Clause (1)(a) where such materials are required by the corrosive or reactive properties of chemicals or liquids being used, and their flame-spread rating is not more than 25.",4.0,12,8,5,2
F,ON,2015,NBC,Div B,EN,ofc2019_divb,B,4.3.17.6.(1),Corrosion protection,Corrosion protection systems shall be maintained in operating condition when a storage tank is temporarily out of service and during seasonal shutdowns.,4.0,3,17,6,1
F,ON,2015,NBC,Div B,EN,ofc2019_divb,B,9.9.2.10.(5),Protection of openings in fire separations,"Despite Sentence (1), existing closures in fire separations to which Articles 9.9.2.8. and 9.9.3.6. apply need not be equipped with latching devices in buildings that are not more than 6 storeys in building height.",9.0,9,2,10,5
F,ON,2015,NBC,Div B,EN,ofc2019_divb,B,9.4.2.10.(3),Fuel-fired appliance service rooms,"Despite Sentence (1), if the required vertical fire separation to a service room is provided and it is not practical in the circumstances to install a fire separation having a fire-resistance rating not less than 45 min above the service room, the service room area shall be sprinklered with a spacing not exceeding 9.5 m2 per sprinkler head.",9.0,4,2,10,3
F,ON,2015,NBC,Div B,EN,ofc2019_divb,B,2.7.2.1.(1),Door release hardware,"Every exit door shall be designed and installed so that, when the latch is released, the door will open in the direction of exit travel under a force of not more than 90 N, applied at the knob or other latch releasing device.",2.0,7,2,1,1
F,ON,2015,NBC,Div B,EN,ofc2019_divb,B,2.9.3.1.(2),Combustible materials,"Hay, straw or similar combustible materials may be used if necessary for the daily feeding and care of animals.",2.0,9,3,1,2
F,ON,2015,NBC,Div B,EN,ofc2019_divb,B,6.5.5.2.(2),Alarm testing,An alarm line subject to freezing shall be cleared of all obstructions susceptible to freezing after the test specified in Sentence (1).,6.0,5,5,2,2
F,ON,2015,NBC,Div B,EN,ofc2019_divb,B,4.4.7.10.(2),Overhead piping,"Where practical, overhead piping referred to in Sentence (1) shall be supported from building framing members.",4.0,4,7,10,2
F,ON,2015,NBC,Div B,EN,ofc2019_divb,B,4.7.11.2.(2),Bonding and grounding,Electrical connections to tanks of marine vessels shall be maintained until the cargo hose has been disconnected and any spillage has been removed.,4.0,7,11,2,2
F,ON,2015,NBC,Div B,EN,ofc2019_divb,B,7.2.5.1.(4),Maintenance of certain fire emergency systems,The firefighters  elevator symbol shall be maintained in identifiable condition.,7.0,2,5,1,4
F,ON,2015,NBC,Div B,EN,ofc2019_divb,B,3.3.2.10.(1),Pallet storage,"Except as permitted in Sentences (2) and (3), combustible pallets shall be stored outdoors in conformance with Section 2.4.",3.0,3,2,10,1
F,ON,2015,NBC,Div B,EN,ofc2019_divb,B,5.10.2.4.(1),Portable extinguishers,"A portable extinguisher that complies with Subsection 6.2.6. or a garden-type hose shall be provided within 7.5 m of any machine that produces sawdust, particles or shavings.",5.0,10,2,4,1
F,ON,2015,NBC,Div B,EN,ofc2019_divb,B,5.12.11.9.(1),Hangers,Hangers for objects being coated shall be kept clean and have sharp points or edges at areas of contact.,5.0,12,11,9,1
F,ON,2015,NBC,Div B,EN,ofc2019_divb,B,9.4.5.5.(6),Sprinkler systems,"Buildings described in Sentence (1) that are sprinklered in conformance with Article 9.4.5.2. on January 1, 2014 are deemed to be in compliance with Sentence (1).",9.0,4,5,5,6
F,ON,2015,NBC,Div B,EN,ofc2019_divb,B,6.4.3.3.(1),Fire department connections,Piping between the fire department connection and the check valve in the inlet pipe to the standpipe shall be hydrostatically tested in the same manner as the remainder of the system.,6.0,4,3,3,1
F,ON,2015,NBC,Div B,EN,ofc2019_divb,B,2.1.1.3.(1),Exceptions,"Subject to Sentences (2) and (3), this Part does not apply to individual dwelling units.",2.0,1,1,3,1
F,ON,2015,NBC,Div B,EN,ofc2019_divb,B,9.9.2.14.(3),Refuse and linen chutes,"In buildings more than 2 storeys in building height, automatic sprinklers shall be installed in each linen or refuse chute at the top, at alternate floor levels, and in the room or bin into which the chute discharges.",9.0,9,2,14,3
F,ON,2015,NBC,Div B,EN,ofc2019_divb,B,4.11.3.7.(3),Unloading,"A tank vehicle shall not be parked on a street, shoulder or sidewalk while unloading at a fuel dispensing station.",4.0,11,3,7,3
F,ON,2015,NBC,Div B,EN,ofc2019_divb,B,6.5.5.5.(1),Water supply,Sprinkler system water supply pressure shall be tested annually with the main drain valve fully open to ensure that there are no obstructions or deterioration of the main water supply.,6.0,5,5,5,1
F,ON,2015,NBC,Div B,EN,ofc2019_divb,B,6.5.6.5.(4),Spare sprinkler heads,Spare sprinkler heads shall correspond to the types and temperature ratings of the sprinklers installed on the system.,6.0,5,6,5,4
F,ON,2015,NBC,Div B,EN,ofc2019_divb,B,4.4.8.2.(4),Shut-off valves,"Stainless steel, monel metal or lined steel bodied valves are permitted to be used when special conditions warrant their use.",4.0,4,8,2,4
F,ON,2015,NBC,Div B,EN,ofc2019_divb,B,4.4.9.4.(3),Thermal electrical conduction heating,"Upon completion of the installation, systems permitted in Sentence (1) shall be tested to ensure that all components are functioning as intended.",4.0,4,9,4,3
F,ON,2015,NBC,Div B,EN,ofc2019_divb,B,4.6.2.4.(2),Container storage,"Containers for flammable liquids or combustible liquids stored outdoors shall be stored in conformance with Subsection 4.2.11., except that the distance between the piles and property lines and the distance between piles need not apply when the containers are stored in an area that does not present a hazard to neighbouring property.",4.0,6,2,4,2
F,ON,2015,NBC,Div B,EN,ofc2019_divb,B,3.3.3.2.(1),Storage buildings,A building used for the storage of ammonium nitrate shall not be more than 1 storey in building height.,3.0,3,3,2,1
F,ON,2015,NBC,Div B,EN,ofc2019_divb,B,4.8.4.1.(2),Spill and vapour control,Measures to control spilled flammable liquids and combustible liquids shall be provided in conformance with Subsection 4.1.6.,4.0,8,4,1,2
F,ON,2015,NBC,Div B,EN,ofc2019_divb,B,9.9.2.6.(1),Adjacent buildings,A building containing a hotel shall be separated from a directly connected adjacent building that does not contain a hotel by a noncombustible fire separation having a fire-resistance rating not less than 2 h.,9.0,9,2,6,1
F,ON,2015,NBC,Div B,EN,ofc2019_divb,B,9.5.5.1.(1),Access for fire fighting,Access routes for fire fighting shall be provided in accordance with the requirements of Articles 3.2.5.5. to 3.2.5.7. of the 1990 Building Code.,9.0,5,5,1,1
F,ON,2015,NBC,Div B,EN,ofc2019_divb,B,9.4.4.3.(2),Signals to fire department,"Where the provisions required in Sentence (1) are not available, a procedure for notifying the fire department shall be approved.",9.0,4,4,3,2
