,,"Except for a supply air system described in Sentence 9.32.3.4.(2) or (3), all joints in exhaust ducts, and in supply ducts that conduct conditioned air, shall be sealed against air leakage with sealants or gaskets made from liquids, mastics or heat-applied materials, mastic with embedded fabric, foil-faced butyl tape, or aluminum foil tape.","Except for a supply air system described in Sentence 9.32.3.4.(2) or (3), all joints in exhaust ducts, and in supply ducts that conduct conditioned air, shall be sealed against air leakage with sealants or gaskets made from liquids, mastics or heat-applied materials, mastic with embedded fabric, foil-faced butyl tape, or aluminum foil tape.",0.0
The provision of makeup air as described in Sentence 9.32.3.8.(2) is not required for mechanical exhausting devices operating a subfloor depressurization system installed for the purpose of reducing the risk of radon ingress. (See Note A-9.32.3.9.),The provision of makeup air as described in Sentence 9.32.3.8.(2) is not required for mechanical exhausting devices operating a subfloor depressurization system installed for the purpose of reducing the risk of radon ingress.,,,0.0
Service water heating systems that use solar thermal technology shall be installed in accordance with the NPC.,,Service water heating systems that use solar thermal technology shall be installed in accordance with the Book II (Plumbing of this Code.,Service water heating systems that use solar thermal technology shall be installed in accordance with the Book II (Plumbing of this Code.,0.6900744640051973
Service water heating systems that use solar thermal technology shall be installed in accordance with the NPC.,,Service water heating systems that use solar thermal technology shall be installed in accordance with the Book II (Plumbing of this Code.,Service water heating systems that use solar thermal technology shall be installed in accordance with the Book II (Plumbing of this Code.,0.6900744640051973
Areas in rooms or spaces over which ceiling height and clear height are not less than the minimum specified in Table 9.5.3.1. or Sentence 9.5.3.1.(2)or 9.5.3.1.(3) shall be contiguous with the entry or entries to those rooms or spaces.,Areas in rooms or spaces over which ceiling height and clear height are not less than the minimum specified in Table 9.5.3.1. or Sentence 9.5.3.1.(2) or 9.5.3.1.(3) shall be contiguous with the entry or entries to those rooms or spaces.,Areas in rooms or spaces over which ceiling height and clear height are not less than the minimum specified in Table 9.5.3.1. shall be contiguous with the entry or entries to those rooms or spaces.,Areas in rooms or spaces over which ceiling height and clear height are not less than the minimum specified in Table 9.5.3.1. shall be contiguous with the entry or entries to those rooms or spaces.,0.9881266712337626
"Skylights and their components shall be designed, constructed and installed so that they resist snow loads.","Skylights and their components shall be designed, constructed and installed so that they resist snow loads.","Skylights and their components shall be designed, constructed and installed so that they resist snow loads.","Skylights and their components shall be designed, constructed and installed so that they resist snow loads.",1.0
"Except as provided in Sentences 9.7.3.1.(2)to 9.7.3.1.(4), windows, doors and skylights and their components separating conditioned space from unconditioned space or the exterior shall be designed, constructed and installed so that, when in the closed position, they resist the ingress of precipitation into interior space (see Note A-9.7.4.2.(1)), resist wind loads, control air leakage, resist the ingress of insects and vermin, where required, resist forced entry, and are easily operable when not intended to be fixed.","Except as provided in Sentences 9.7.3.1.(2) to 9.7.3.1.(4), windows, doors and skylights and their components separating conditioned space from unconditioned space or the exterior shall be designed, constructed and installed so that, when in the closed position, they resist the ingress of precipitation into interior space (see Note A-9.7.4.2.(1)), resist wind loads, control air leakage, resist the ingress of insects and vermin, where required, resist forced entry, and are easily operable when not intended to be fixed.",,,0.0
"Skylights and their components shall be designed, constructed and installed so that they resist snow loads.","Skylights and their components shall be designed, constructed and installed so that they resist snow loads.","Skylights and their components shall be designed, constructed and installed so that they resist snow loads.","Skylights and their components shall be designed, constructed and installed so that they resist snow loads.",1.0
"Metal frames and sash of windows, doors and skylights shall incorporate a thermal break.","Metal frames and sash of windows, doors and skylights shall incorporate a thermal break.","Except as permitted in Sentence (2), metal frames and sash of windows, doors and skylights shall incorporate a thermal break.","Except as permitted in Sentence (2), metal frames and sash of windows, doors and skylights shall incorporate a thermal break.",0.9614138350881336
"The installation of manufactured and pre-assembled windows, doors and skylights and the field assembly of manufactured window and door combination units shall conform to the manufacturer’s instructions.","The installation of manufactured and pre-assembled windows, doors and skylights and the field assembly of manufactured window and door combination units shall conform to the manufacturer s instructions.","Except as provided by Sentence (2), the installation of manufactured and pre-assembled windows, doors and skylights and the field assembly of manufactured window and door combination units shall conform to the instructions, if any, provided by the manufacturer.","Except as provided by Sentence (2), the installation of manufactured and pre-assembled windows, doors and skylights and the field assembly of manufactured window and door combination units shall conform to the instructions, if any, provided by the manufacturer.",0.9412482228950138
"The installation of windows, doors and skylights shall conform to CSA CAN/CSA-A440.4-07 Window, Door, and Skylight Installation except that shims used to support windows, doors and skylights are permitted to be made of treated plywood, and protection from precipitation for walls incorporating windows or doors and for roofs incorporating skylights, and the interfaces of these walls with windows or doors and of roofs with skylights, shall conform to Section 9.27.","The installation of windows, doors and skylights shall conform to CSA CAN/CSA-A440.4-07 Window, Door, and Skylight Installation except that shims used to support windows, doors and skylights are permitted to be made of treated plywood, and protection from precipitation for walls incorporating windows or doors and for roofs incorporating skylights, and the interfaces of these walls with windows or doors and of roofs with skylights, shall conform to part 9.",,,0.0
"Except as provided in this Part, the storage and handling of liquefied petroleum gases shall conform to CSA B149.1-10 Natural Gas and Propane Installation Code and CSA B149.2-10 Propane Storage and Handling Code","Except as provided in this Part, the storage and handling of liquefied petroleum gases shall conform to CSA B149.1-10 Natural Gas and Propane Installation Code and CSA B149.2-10 Propane Storage and Handling Code",,,0.0
,,"Except as provided in this Part, the storage and handling of liquefied petroleum gases shall conform to the British Columbia Gas Safety Regulation.","Except as provided in this Part, the storage and handling of liquefied petroleum gases shall conform to the British Columbia Gas Safety Regulation.",0.0
"Electrical installations shall conform to the appropriate provincial or territorial regulations or municipal bylaws, or in the absence of such regulations, to CSA C22.1-12 Canadian Electrical Code, Part I except that alternatives to these requirements are permitted as described in Clause 1.2.1.1.(1)(b) in areas other than those described in Article 5.1.2.1.","Electrical installations shall conform to the appropriate provincial or territorial regulations or municipal bylaws, or in the absence of such regulations, to CSA C22.1-12 Canadian Electrical Code, Part I except that alternatives to these requirements are permitted as described in Sentence 1.2.1.1.(1) in areas other than those described in Article 5.1.2.1.",,,0.0
,,Electrical installations shall conform to the British Columbia Electrical Safety Regulation,Electrical installations shall conform to the British Columbia Electrical Safety Regulation,0.0
"Except as provided inSentence 8.4.2.2.(5), the energy model calculations shall account for the annual energy consumption of space-heating equipment, space-cooling equipment, fans, interior and exterior lighting devices, service water heating equipment, pumps, auxiliary HVAC equipment (see Note A-8.4.2.2.(1)(g)), receptacle loads and miscellaneous equipment as per Article 8.4.2.7., appliances, and elevators and escalators.",,"For the purpose of this Subsection, the term ""total energy use intensity"" shall mean a metric of the energy used over a year by the building, estimated by using an energy model in accordance with Article 10.2.3.4., normalized per square metre of floor area of conditioned space and expressed in kWh/(m2•year), for all of the following combined: space-heating equipment, space-cooling equipment, fans, interior and exterior lighting devices, service water heating equipment, pumps, auxiliary HVAC equipment (see A-9.36.6.2.(1)(f) in Appendix A), receptacle loads and miscellaneous equipment, appliances, and elevators and escalators.","For the purpose of this Subsection, the term ""total energy use intensity"" shall mean a metric of the energy used over a year by the building, estimated by using an energy model in accordance with Article 10.2.3.4., normalized per square metre of floor area of conditioned space and expressed in kWh/(m2year), for all of the following combined: space-heating equipment, space-cooling equipment, fans, interior and exterior lighting devices, service water heating equipment, pumps, auxiliary HVAC equipment (see A-9.36.6.2.(1)(f) in Appendix A), receptacle loads and miscellaneous equipment, appliances, and elevators and escalators.",0.6700234213650179
"For the purpose of compliance with this Code as required in Clause 1.2.1.1.(1)(b), the objectives and functional statements attributed to the acceptable solutions in this Part shall be the objectives and functional statements listed in Table 9.37.1.1. (See Note A-1.1.2.1.(1).) (See Note D-2.6., Background Information.)",,"For the purpose of compliance with this Code as required in Clause 1.2.1.1.(1)(b) of Division A, the objectives and functional statements attributed to the acceptable solutions in this Part shall be the objectives andfunctionalstatements listed in Table 9.38.1.1. (See Note A-1.1.2.1.(1).)","For the purpose of compliance with this Code as required in Clause 1.2.1.1.(1)(b) of Division A, the objectives and functional statements attributed to the acceptable solutions in this Part shall be the objectives andfunctionalstatements listed in Table 9.38.1.1. (See Note A-1.1.2.1.(1).)",0.8089502783294613
"A building conforming to Article 3.2.2.50. shall not contain except as provided in Sentence 3.1.3.2.(5), a Group A, Division 1 or 3, Group B, or Group F, Division 2 or 3 major occupancy, or a Group A, Division 2 or Group E major occupancy above the second storey. (See Note A-3.1.3.2.(3) to (5).)","A building conforming to Article 3.2.2.50. shall not contain except as provided in Sentence 3.1.3.2.(5), a Group A, Division 1 or 3, Group B, or Group F, Division 2 or 3 major occupancy, or a Group A, Division 2 or Group E major occupancy above the second storey.","Group A, Division 2 major occupancies, Group E major occupancies, Group F, Division 2 and 3 major occupancies and storage garages located in a building or part of a building within the scope of this Article are permitted to be constructed in accordance with this Article provided the Group A, Division 2 major occupancy, and Group E major occupancy, and Group F, Division 2 and 3 major occupancy is located below the third storey, and the storage garage is located below the fourth storey (See also Sentence 4.4.2.1.(1)). (See Note A-3.2.2.50.(5) and 3.2.2.58.(4).)","Group A, Division 2 major occupancies, Group E major occupancies, Group F, Division 2 and 3 major occupancies and storage garages located in a building or part of a building within the scope of this Article are permitted to be constructed in accordance with this Article provided the Group A, Division 2 major occupancy, and Group E major occupancy, and Group F, Division 2 and 3 major occupancy is located below the third storey, and the storage garage is located below the fourth storey (See also Sentence 4.4.2.1.(1)). (See Note A-3.2.2.50.(5) and 3.2.2.58.(4).)",0.7227046873825147
"Where a fuel-burning appliance is installed in a suite of residential occupancy, a CO alarm shall be installed inside each bedroom, or outside each bedroom, within 5 m of each bedroom door, measured following corridors and doorways.","Where a fuel-burning appliance is installed in a suite of residential occupancy, a CO alarm shall be installed inside each bedroom, or outside each bedroom, within 5 m of each bedroom door, measured following corridors and doorways.","Where a fuel-burning appliance is installed in a suite of residential occupancy, a CO alarm shall be installed inside each bedroom, or outside each bedroom, within 5 m of each bedroom door, measured following corridors and doorways.","Where a fuel-burning appliance is installed in a suite of residential occupancy, a CO alarm shall be installed inside each bedroom, or outside each bedroom, within 5 m of each bedroom door, measured following corridors and doorways.",1.0000000000000002
"Where a habitable room or space is not provided with natural ventilation as described in Article 9.32.2.2. and is not mechanically cooled, the non-heating-season mechanical ventilation system shall have the capacity to exhaust indoor air from the room or space or to introduce outdoor air to that room or space at a rate of one air change per hour.","Where a habitable room or space is not provided with natural ventilation as described in Article 9.32.2.2. and is not mechanically cooled, the non-heating-season mechanical ventilation system shall have the capacity to exhaust indoor air from the room or space or to introduce outdoor air to that room or space at a rate of one air change per hour.","Where a habitable room or space is not provided with natural ventilation as described in Clause (1)(a), mechanical ventilation shall be provided to exhaust inside air from, or to introduce outside air to, that room or space at the rate of one-half air change per hour if the room or space is mechanically cooled during the non-heating season, or one air change per hour if the room or space is not mechanically cooled during the non-heating season.","Where a habitable room or space is not provided with natural ventilation as described in Clause (1)(a), mechanical ventilation shall be provided to exhaust inside air from, or to introduce outside air to, that room or space at the rate of one-half air change per hour if the room or space is mechanically cooled during the non-heating season, or one air change per hour if the room or space is not mechanically cooled during the non-heating season.",0.8678112546621213
