National Sentence Text,Matched National Sentence (Variation),P/T Sentence Text,Matched P/T Sentence (Variation),Similarity
"Except as permitted in Sentence 3.2.4.20.(13), a manually operated silencing device shall be incorporated within the circuitry of a smoke alarm installed in a dwelling unit so that it will silence the signal emitted by the smoke alarm for a period of not more than 10 min, after which the smoke alarm will reset and again sound the alarm if the level of smoke in the vicinity is sufficient to reactuate the smoke alarm.","Except as permitted in Sentence 3.2.4.20.(13), a manually operated silencing device shall be incorporated within the circuitry of a smoke alarm installed in a dwelling unit so that it will silence the signal emitted by the smoke alarm for a period of not more than 10 min, after which the smoke alarm will reset and again sound the alarm if the level of smoke in the vicinity is sufficient to reactuate the smoke alarm.","Except as permitted in Sentence (13), a manually operated silencing device shall be incorporated within the circuitry of a smoke alarm installed in a dwelling unit so that it will silence the signal emitted by the smoke alarm for a period of not more than 10 min, after which the smoke alarm will reset and again sound the alarm if the level of smoke in the vicinity is sufficient to reactuate the smoke alarm.","Except as permitted in Sentence (13), a manually operated silencing device shall be incorporated within the circuitry of a smoke alarm installed in a dwelling unit so that it will silence the signal emitted by the smoke alarm for a period of not more than 10 min, after which the smoke alarm will reset and again sound the alarm if the level of smoke in the vicinity is sufficient to reactuate the smoke alarm.",0.9957175775187124
"Suites of residential occupancy equipped with smoke detectors installed to ULC CAN/ULC-S524-14 Installation of Fire Alarm Systems as part of the fire alarm system in lieu of smoke alarms as permitted by Sentence 3.2.4.20.(8), need not incorporate the manually operated device required in Sentence 3.2.4.20.(12). (See Note A-3.2.4.20.(8).)","Suites of residential occupancy equipped with smoke detectors installed to ULC CAN/ULC-S524-14 Installation of Fire Alarm Systems as part of the fire alarm system in lieu of smoke alarms as permitted by Sentence 3.2.4.20.(8), need not incorporate the manually operated device required in Sentence 3.2.4.20.(12). (See Note A-3.2.4.20.(8).)","Suites of residential occupancy equipped with smoke detectors installed to CAN/ULC-S524, ""Installation of Fire Alarm Systems,"" as part of the fire alarm system in lieu of smoke alarms as permitted by Sentence (8), need not incorporate the manually operated device required in Sentence (12). (See Note A-3.2.4.20.(8).)","Suites of residential occupancy equipped with smoke detectors installed to CAN/ULC-S524, ""Installation of Fire Alarm Systems,"" as part of the fire alarm system in lieu of smoke alarms as permitted by Sentence (8), need not incorporate the manually operated device required in Sentence (12). (See Note A-3.2.4.20.(8).)",0.9470467494110882
"Except for Group B, Division 1 and Group F, Division 1 major occupancies, where a fire alarm system is required under Subsection 3.2.4., a one-way voice communication system shall be installed in buildings where a 2-stage fire alarm system is installed and whose occupant load exceeds 1 000.","Except for Group B, Division 1 and Group F, Division 1 major occupancies, where a fire alarm system is required under part 3., a one-way voice communication system shall be installed in buildings where a 2-stage fire alarm system is installed and whose occupant load exceeds 1 000.","Except for Group B, Division 1 and Group F, Division 1 major occupancies, where a fire alarm system is required under Subsection 3.2.4., a voice communication system shall be installed in buildings where a 2-stage fire alarm system is installed and whose occupant load exceeds 1 000.","Except for Group B, Division 1 and Group F, Division 1 major occupancies, where a fire alarm system is required under Subsection 3.2.4., a voice communication system shall be installed in buildings where a 2-stage fire alarm system is installed and whose occupant load exceeds 1 000.",0.970361167987565
"Where the facility is not equipped with staff trained to provide instructions over the loudspeakers, a pre-recorded message shall be provided.","Where the facility is not equipped with staff trained to provide instructions over the loudspeakers, a pre-recorded message shall be provided.",,,0.0
"Except as permitted by Sentence 3.4.6.8.(10), the top of the nosing of stair treads shall have a rounded or beveled edge extending not less than 6 mm and not more than 13 mm measured horizontally from the front of the nosing.","Except as permitted by Sentence 3.4.6.8.(10), the top of the nosing of stair treads shall have a rounded or beveled edge extending not less than 6 mm and not more than 13 mm measured horizontally from the front of the nosing.",,,0.0
,,"The top of the nosing of stair treads shall except as permitted in Sentence (10), have either a radius or a bevel between 6 mm and 10 mm in horizontal dimension, have no abrupt angles on the underside, and not project more than 38 mm.","The top of the nosing of stair treads shall except as permitted in Sentence (10), have either a radius or a bevel between 6 mm and 10 mm in horizontal dimension, have no abrupt angles on the underside, and not project more than 38 mm.",0.0
"Except as permitted by Sentence 3.8.2.3.(2), a barrier-free path of travel from the entrances required by Sentences 3.8.2.2.(1)and 3.8.2.2.(2) to be barrier-free shall be provided throughout the entrance storey and within all other normally occupied floor areas served by a passenger elevator, escalator, inclined moving walk, or other platform-equipped passenger-elevating device. (See Article 3.3.1.7. for additional requirements regarding floor areas above or below the first storey to which a barrier-free path of travel is required.) (See Article 3.3.1.7. for additional requirements regarding floor areas above or below the first storey to which a barrier-free path of travel is required.)","Except as permitted by Sentence 3.8.2.3.(2), a barrier-free path of travel from the entrances required by Sentences 3.8.2.2.(1) and 3.8.2.2.(2) to be barrier-free shall be provided throughout the entrance storey and within all other normally occupied floor areas served by a passenger elevator, escalator, inclined moving walk, or other platform-equipped passenger-elevating device. (See Article 3.3.1.7. for additional requirements regarding floor areas above or below the first storey to which a barrier-free path of travel is required.)",,,0.0
,,"Except as permitted by Sentence (2), access from the accessible entrances required by Sentences 3.8.2.2.(1) and (2) shall be provided throughout the entrance storey or storeys and within all other normally occupied floor areas as required by Sentence 3.8.2.1.(1).","Except as permitted by Sentence (2), access from the accessible entrances required by Sentences 3.8.2.2.(1) and (2) shall be provided throughout the entrance storey or storeys and within all other normally occupied floor areas as required by Sentence 3.8.2.1.(1).",0.0
Only the active leaf in a multiple leaf door in a barrier-free path of travel need conform to the requirements of this Article.,Only the active leaf in a multiple leaf door in a barrier-free path of travel need conform to the requirements of this Article.,Only the active leaf in a multiple-leaf door in an accessible path of travel need conform to the requirements of this Article.,Only the active leaf in a multiple-leaf door in an accessible path of travel need conform to the requirements of this Article.,0.9232859797277115
Only the active leaf in a multiple-leaf door in a barrier-free path of travel need conform to the requirements of this Article.,Only the active leaf in a multiple-leaf door in a barrier-free path of travel need conform to the requirements of this Article.,Only the active leaf in a multiple leaf door in an accessible path of travel need conform to the requirements of this Article.,Only the active leaf in a multiple leaf door in an accessible path of travel need conform to the requirements of this Article.,0.9232859797277115
"Tests referred to in Sentence 5.9.3.5.(2) shall be carried out at the driving rain wind pressure as calculated in accordance with CSA A440S1-17 Canadian Supplement to AAMA/WDMA/CSA 101/I.S.2/A440-11, NAFS – North American Fenestration Standard/Specification for Windows, Doors, and Skylights (See Note A-5.9.3.5.(3).)","Tests referred to in Sentence 5.9.3.5.(2) shall be carried out at the driving rain wind pressure as calculated in accordance with CSA A440S1-17 Canadian Supplement to AAMA/WDMA/CSA 101/I.S.2/A440-11, NAFS North American Fenestration Standard/Specification for Windows, Doors, and Skylights (See Note A-5.9.3.5.(3).)","For buildings described in Sentence 1.3.3.3.(1) of Division A, where design pressure, performance grade and water resistance values are calculated in accordance with the standard referenced in Clause 9.7.4.2.(1)(b), the driving rain wind pressure (DRWP) values in Table A.1 of CSA A440S1, ""Canadian Supplement to AAMA/WDMA/CSA 101/I.S.2/A440, NAFS – North American Fenestration Standard/Specification for Windows, Doors, and Skylights,"" shall be used. (See Note A-9.7.4.3.(2).)","For buildings described in Sentence 1.3.3.3.(1) of Division A, where design pressure, performance grade and water resistance values are calculated in accordance with the standard referenced in Clause 9.7.4.2.(1)(b), the driving rain wind pressure (DRWP) values in Table A.1 of CSA A440S1, ""Canadian Supplement to AAMA/WDMA/CSA 101/I.S.2/A440, NAFS North American Fenestration Standard/Specification for Windows, Doors, and Skylights,"" shall be used. (See Note A-9.7.4.3.(2).)",0.775892356048778
Words that appear in italics are defined in Article 1.4.1.2..,Words that appear in italics are defined in Article 1.4.1.2..,Words that appear in italics are defined in Article 1.4.1.2. of Division A.,,0.9571681124513166
"Every plumbing system shall be designed and installed in conformance with appropriate provincial or territorial regulations or municipal bylaws, in the absence of such regulations or bylaws, in conformance with the NPC.","Every plumbing system shall be designed and installed in conformance with appropriate provincial or territorial regulations or municipal bylaws, in the absence of such regulations or bylaws, in conformance with the NPC.",,,0.0
,,Every plumbing system shall be designed and installed in conformance with Book II (Plumbing of this Code.,Every plumbing system shall be designed and installed in conformance with Book II (Plumbing of this Code.,0.0
Fire safety at construction and demolition sites shall conform to Section 5.6. of Division B of the NFC.,Fire safety at construction and demolition sites shall conform to Section 5.6. of Division B of the NFC.,"Fire safety at construction and demolition sites shall conform to CAN/CSA S350-M, ""Code of Practice for Safety in Demolition of Structures,"" and Section 5.6. of Division B of the British Columbia Fire Code.","Fire safety at construction and demolition sites shall conform to CAN/CSA S350-M, ""Code of Practice for Safety in Demolition of Structures,"" and Section 5.6. of Division B of the British Columbia Fire Code.",0.6355510263339694
Words that appear in italics are defined in Article 1.4.1.2..,Words that appear in italics are defined in Article 1.4.1.2..,Words that appear in italics are defined in Article 1.4.1.2. of Division A.,,0.9571681124513166
"Where the exposing building face of any section of an exterior wall enclosing a single room or space, or combination room and space, has a limiting distance of 2 m or less, that section of the exposing building face serving the room or space shall not be divided into portions for the purpose of calculating area of exposing building face. (See Sentence 9.10.15.4.(5) and Note A-9.10.15.4.(2).)","Where the exposing building face of any section of an exterior wall enclosing a single room or space, or combination room and space, has a limiting distance of 2 m or less, that section of the exposing building face serving the room or space shall not be divided into portions for the purpose of calculating area of exposing building face. (See Sentence 9.10.15.4.(5) and Note A-9.10.15.4.(2).)","Where the exposing building face of any section of an exterior wall enclosing a single room or space, or combination room and space, has a limiting distance of 2 m or less, that section of the exposing building face serving the room or space shall not be divided into portions for the purpose of calculating area of exposing building face. (See Sentence 9.10.15.4.(5) and Note A-9.10.15.4.(2).)","Where the exposing building face of any section of an exterior wall enclosing a single room or space, or combination room and space, has a limiting distance of 2 m or less, that section of the exposing building face serving the room or space shall not be divided into portions for the purpose of calculating area of exposing building face. (See Sentence 9.10.15.4.(5) and Note A-9.10.15.4.(2).)",1.0000000000000004
"If a building is divided by fire separations into fire compartments, the area of exposing building face is permitted to be calculated for each fire compartment provided the fire separations have a fire-resistance rating not less than 45 min.",,"If a building is divided by fire separations into fire compartments, the area of exposing building face is permitted to be calculated for each fire compartment provided the fire separations have a fire-resistance ratings not less than 45 min.","If a building is divided by fire separations into fire compartments, the area of exposing building face is permitted to be calculated for each fire compartment provided the fire separations have a fire-resistance ratings not less than 45 min.",0.9648890711623789
"Except as permitted in Article 9.10.2.4., in any building containing more than one major occupancy in which one major occupancy is located entirely above another, the requirements of Article 9.10.8.1. for each portion of the building containing a major occupancy shall be applied to that portion as if the entire building was of that major occupancy.","Except as permitted in Article 9.10.2.4., in any building containing more than one major occupancy in which one major occupancy is located entirely above another, the requirements of Article 9.10.8.1. for each portion of the building containing a major occupancy shall be applied to that portion as if the entire building was of that major occupancy.","Except as permitted in Article 9.10.2.4., in any building containing more than one major occupancy in which one major occupancy is located entirely above another, the requirements of Article 9.10.8.1. for each portion of the building containing a major occupancy shall be applied to that portion as if the entire building was of that major occupancy.","Except as permitted in Article 9.10.2.4., in any building containing more than one major occupancy in which one major occupancy is located entirely above another, the requirements of Article 9.10.8.1. for each portion of the building containing a major occupancy shall be applied to that portion as if the entire building was of that major occupancy.",1.0000000000000004
"In a building containing more than one major occupancy, where the aggregate area of all major occupancies in a particular group or division does not exceed 10% of the floor area on the storey on which they are located, they need not be considered as major occupancies for the purposes of Articles 9.10.8.1.and 9.10.2.3. provided they are not classified as Group F, Division 2 occupancies.","In a building containing more than one major occupancy, where the aggregate area of all major occupancies in a particular group or division does not exceed 10% of the floor area on the storey on which they are located, they need not be considered as major occupancies for the purposes of Articles 9.10.8.1. and 9.10.2.3. provided they are not classified as Group F, Division 2 occupancies .","In a building containing more than one major occupancy, where the aggregate area of all major occupancies in a particular group or division does not exceed 10% of the floor area on the storey on which they are located, they need not be considered as major occupancies for the purposes of Articles 9.10.8.1. and 9.10.2.3. provided they are not classified as Group F, Division 2 occupancies.",,1.0000000000000002
"Each construction camp building shall be provided with portable fire extinguishers in conformance with the appropriate provincial or territorial regulations or municipal bylaws or, in the absence of such regulations or bylaws, in conformance with the NFC.","Each construction camp building shall be provided with portable fire extinguishers in conformance with the appropriate provincial or territorial regulations or municipal bylaws or, in the absence of such regulations or bylaws, in conformance with the NFC.",,,0.0
,,Each construction camp building shall be provided with portable fire extinguishers in conformance with the British Columbia Fire Code.,Each construction camp building shall be provided with portable fire extinguishers in conformance with the British Columbia Fire Code.,0.0
"Where an exhaust duct passes through an unheated space or is not separated from an unheated space by an insulated building assembly, the duct shall be insulated to not less than RSI 0.5.","Where an exhaust duct passes through an unheated space or is not separated from an unheated space by an insulated building assembly, the duct shall be insulated to not less than RSI 0.5.","Where an exhaust duct passes through or is located adjacent to a space that is not conditioned space, the duct shall conform to Article 9.36.3.2., except that in no case shall such a duct be insulated to less than RSI 0.75.","Where an exhaust duct passes through or is located adjacent to a space that is not conditioned space, the duct shall conform to Article 9.36.3.2., except that in no case shall such a duct be insulated to less than RSI 0.75.",0.6218922096008804
"The principal ventilation fan shall be controlled by a manual switch located within the living area of the dwelling unit and clearly marked ""VENTILATION FAN."" (See Note A-9.32.3.3.(5).)","The principal ventilation fan shall be controlled by a manual switch located within the living area of the dwelling unit and clearly marked ""VENTILATION FAN."" (See Note A-9.32.3.3.(5).)","The principal ventilation system exhaust fan shall be designed to run continuously, and controlled by a dedicated switch that has 2 settings, on and off, is located where it will be accessible for the purposes of servicing the exhaust fan but not likely to be turned off inadvertently, and is clearly marked ""PRINCIPAL VENTILATION EXHAUST FAN.""","The principal ventilation system exhaust fan shall be designed to run continuously, and controlled by a dedicated switch that has 2 settings, on and off, is located where it will be accessible for the purposes of servicing the exhaust fan but not likely to be turned off inadvertently, and is clearly marked ""PRINCIPAL VENTILATION EXHAUST FAN.""",0.5114212173792753
"Except as provided in Sentence 9.32.3.6.(3), where an exhaust-only system is installed, the principal ventilation fan control required by Sentence 9.32.3.3.(5) shall be wired in such a way that, where applicable, activation of the principal ventilation fan automatically activates the circulation fan of the forced air distribution system required by Clause 9.32.3.6.(1)(b) at its rated capacity.","Except as provided in Sentence 9.32.3.6.(3), where an exhaust-only system is installed, the principal ventilation fan control required by Sentence 9.32.3.3.(5) shall be wired in such a way that, where applicable, activation of the principal ventilation fan automatically activates the circulation fan of the forced air distribution system required by Sentence 9.32.3.6.(1) at its rated capacity.","A mechanical ventilation system shall include: a principal ventilation fan system that provides supply air in accordance with Article 9.32.3.4., and includes an exhaust fan that conforms with Article 9.32.3.5., the kitchen and bathroom exhaust fans that are required by Article 9.32.3.6., and if the building includes a heated crawl space, the components that are required by Article 9.32.3.7.","A mechanical ventilation system shall include: a principal ventilation fan system that provides supply air in accordance with Article 9.32.3.4., and includes an exhaust fan that conforms with Article 9.32.3.5., the kitchen and bathroom exhaust fans that are required by Article 9.32.3.6., and if the building includes a heated crawl space, the components that are required by Article 9.32.3.7.",0.5262222677296359
"Except as provided in Sentence 9.32.3.10.(4), capacity ratings for required fans shall be determined in accordance with CSA CAN/CSA-C260-M90 Rating the Performance of Residential Mechanical Ventilating Equipment or HVI HVI Publication 916-2013 Airflow Test Procedure","Except as provided in Sentence 9.32.3.10.(4), capacity ratings for required fans shall be determined in accordance with CSA CAN/CSA-C260-M90 Rating the Performance of Residential Mechanical Ventilating Equipment or HVI HVI Publication 916-2013 Airflow Test Procedure","For the purposes of Sentence (1), the capacity rating of the exhaust fan shall be determined, based on air-flow performance at 50 pa of external static pressure, in accordance with HVI Publication 916, ""Airflow Test Procedure,"" or CAN/CSA-C260-M, ""Rating the Performance of Residential Mechanical Ventilating Equipment.""","For the purposes of Sentence (1), the capacity rating of the exhaust fan shall be determined, based on air-flow performance at 50 pa of external static pressure, in accordance with HVI Publication 916, ""Airflow Test Procedure,"" or CAN/CSA-C260-M, ""Rating the Performance of Residential Mechanical Ventilating Equipment.""",0.6840945188262776
"Except as provided in Sentences 9.32.3.7.(2)and 9.32.3.7.(3), a supplemental exhaust fan with a rated capacity not less than 50 L/s shall be installed in each kitchen.","Except as provided in Sentences 9.32.3.7.(2) and 9.32.3.7.(3), a supplemental exhaust fan with a rated capacity not less than 50 L/s shall be installed in each kitchen.",,,0.0
,,"Where a crawl space is heated by a ducted forced-air heating system that does not draw air from the crawl space to the furnace through the return air plenum, the crawl space shall be connected to the floor space above the crawl space by at least one air-transfer grille.","Where a crawl space is heated by a ducted forced-air heating system that does not draw air from the crawl space to the furnace through the return air plenum, the crawl space shall be connected to the floor space above the crawl space by at least one air-transfer grille.",0.0
,,"Where a crawl space is heated other than by a ducted forced-air heating system, the crawl space shall be connected to the floor space above the crawl space by at least one air-transfer grille, and the principal ventilation system by a supply air outlet or an exhaust air inlet, be connected to the floor space above the crawl space by at least 2 air-transfer grilles for every 30 m2 of crawl space area, or be connected to the floor space above the crawl space by at least one air-transfer grille, and the outdoors by a dedicated exhaust fan that complies with Sentence (4).","Where a crawl space is heated other than by a ducted forced-air heating system, the crawl space shall be connected to the floor space above the crawl space by at least one air-transfer grille, and the principal ventilation system by a supply air outlet or an exhaust air inlet, be connected to the floor space above the crawl space by at least 2 air-transfer grilles for every 30 m2 of crawl space area, or be connected to the floor space above the crawl space by at least one air-transfer grille, and the outdoors by a dedicated exhaust fan that complies with Sentence (4).",0.0
A supplemental exhaust fan is not required in a kitchen where the only exhaust air intake for the principal ventilation fan is located in that kitchen.,A supplemental exhaust fan is not required in a kitchen where the only exhaust air intake for the principal ventilation fan is located in that kitchen.,,,0.0
"Except as provided in Sentences 9.32.3.8.(6)to 9.32.3.8.(8), any mechanical air exhausting device, other than the principal ventilation fan operating at a rate not greater than the maximum permitted by Table 9.32.3.3., shall be provided with outdoor makeup air supplied by a fan rated to deliver outdoor air to the dwelling unit at a rate not less than the exhaust capacity of the device, and not greater than that exhaust capacity plus 10%.","Except as provided in Sentences 9.32.3.8.(6) to 9.32.3.8.(8), any mechanical air exhausting device, other than the principal ventilation fan operating at a rate not greater than the maximum permitted by Table 9.32.3.3., shall be provided with outdoor makeup air supplied by a fan rated to deliver outdoor air to the dwelling unit at a rate not less than the exhaust capacity of the device, and not greater than that exhaust capacity plus 10%.",,,0.0
Exhaust ducts or vents connected to laundry-drying equipment shall discharge directly to the outdoors.,,Exhaust ducts shall discharge to the outdoors.,Exhaust ducts shall discharge to the outdoors.,0.609046687246511
