"Electrical installations, including the service capacity of the installation and the number and distribution of circuits and receptacles, shall meet the requirements of the appropriate provincial, territorial or municipal legislation or, in the absence of such legislation, shall conform to CSA C22.1-12 Canadian Electrical Code, Part I","Electrical installations, including the service capacity of the installation and the number and distribution of circuits and receptacles, shall meet the requirements of the appropriate provincial, territorial or municipal legislation or, in the absence of such legislation, shall conform to CSA C22.1-12 Canadian Electrical Code, Part I",,,0.0
,,"Electrical installations, including the service capacity of the installation and the number and distribution of circuits and receptacles, shall conform to the Electrical Safety Regulation.","Electrical installations, including the service capacity of the installation and the number and distribution of circuits and receptacles, shall conform to the Electrical Safety Regulation.",0.0
Areas in rooms or spaces over which ceiling height and clear height are not less than the minimum specified in Table 9.5.3.1. or Sentence 9.5.3.1.(2)or 9.5.3.1.(3) shall be contiguous with the entry or entries to those rooms or spaces.,Areas in rooms or spaces over which ceiling height and clear height are not less than the minimum specified in Table 9.5.3.1. or Sentence 9.5.3.1.(2) or 9.5.3.1.(3) shall be contiguous with the entry or entries to those rooms or spaces.,Areas in rooms or spaces over which ceiling height and clear height are not less than the minimum specified in Table 9.5.3.1. shall be contiguous with the entry or entries to those rooms or spaces.,Areas in rooms or spaces over which ceiling height and clear height are not less than the minimum specified in Table 9.5.3.1. shall be contiguous with the entry or entries to those rooms or spaces.,0.9440581798553468
"Skylights and their components shall be designed, constructed and installed so that they resist snow loads.","Skylights and their components shall be designed, constructed and installed so that they resist snow loads.","Skylights and their components shall be designed, constructed and installed so that they resist snow loads.","Skylights and their components shall be designed, constructed and installed so that they resist snow loads.",1.000000238418579
"Except as provided in Sentences 9.7.3.1.(2)to 9.7.3.1.(4), windows, doors and skylights and their components separating conditioned space from unconditioned space or the exterior shall be designed, constructed and installed so that, when in the closed position, they resist the ingress of precipitation into interior space (see Note A-9.7.4.2.(1)), resist wind loads, control air leakage, resist the ingress of insects and vermin, where required, resist forced entry, and are easily operable when not intended to be fixed.","Except as provided in Sentences 9.7.3.1.(2) to 9.7.3.1.(4), windows, doors and skylights and their components separating conditioned space from unconditioned space or the exterior shall be designed, constructed and installed so that, when in the closed position, they resist the ingress of precipitation into interior space (see Note A-9.7.4.2.(1)), resist wind loads, control air leakage, resist the ingress of insects and vermin, where required, resist forced entry, and are easily operable when not intended to be fixed.",,,0.0
"Skylights and their components shall be designed, constructed and installed so that they resist snow loads.","Skylights and their components shall be designed, constructed and installed so that they resist snow loads.","Skylights and their components shall be designed, constructed and installed so that they resist snow loads.","Skylights and their components shall be designed, constructed and installed so that they resist snow loads.",1.000000238418579
"Metal frames and sash of windows, doors and skylights shall incorporate a thermal break.","Metal frames and sash of windows, doors and skylights shall incorporate a thermal break.","Except as permitted in Sentence (2), metal frames and sash of windows, doors and skylights shall incorporate a thermal break.","Except as permitted in Sentence (2), metal frames and sash of windows, doors and skylights shall incorporate a thermal break.",0.7570385336875916
"The installation of manufactured and pre-assembled windows, doors and skylights and the field assembly of manufactured window and door combination units shall conform to the manufacturer’s instructions.","The installation of manufactured and pre-assembled windows, doors and skylights and the field assembly of manufactured window and door combination units shall conform to the manufacturer s instructions.","Except as provided by Sentence (2), the installation of manufactured and pre-assembled windows, doors and skylights and the field assembly of manufactured window and door combination units shall conform to the instructions, if any, provided by the manufacturer.","Except as provided by Sentence (2), the installation of manufactured and pre-assembled windows, doors and skylights and the field assembly of manufactured window and door combination units shall conform to the instructions, if any, provided by the manufacturer.",0.8024986982345581
"The installation of windows, doors and skylights shall conform to CSA CAN/CSA-A440.4-07 Window, Door, and Skylight Installation except that shims used to support windows, doors and skylights are permitted to be made of treated plywood, and protection from precipitation for walls incorporating windows or doors and for roofs incorporating skylights, and the interfaces of these walls with windows or doors and of roofs with skylights, shall conform to Section 9.27.","The installation of windows, doors and skylights shall conform to CSA CAN/CSA-A440.4-07 Window, Door, and Skylight Installation except that shims used to support windows, doors and skylights are permitted to be made of treated plywood, and protection from precipitation for walls incorporating windows or doors and for roofs incorporating skylights, and the interfaces of these walls with windows or doors and of roofs with skylights, shall conform to part 9.",,,0.0
,,All guards within dwelling units shall be not less than 900 mm high.,All guards within dwelling units shall be not less than 900 mm high.,0.0
All guards within dwelling units or within houses with a secondary suite including their common spaces shall be not less than 900 mm high.,All guards within dwelling units or within houses with a secondary suite including their common spaces shall be not less than 900 mm high.,Landings for exterior stairs serving both suites in a building containing a secondary suite need not exceed 900 mm in length.,Landings for exterior stairs serving both suites in a building containing a secondary suite need not exceed 900 mm in length.,0.8126369714736938
"For the purpose of compliance with this Code as required in Clause 1.2.1.1.(1)(b), the objectives and functional statements attributed to the acceptable solutions in this Part shall be the objectives and functional statements listed in Table 9.37.1.1. (See Note A-1.1.2.1.(1).) (See Note D-2.6., Background Information.)",,"For the purpose of compliance with this Code as required in Clause 1.2.1.1.(1)(b) of Division A, the objectives and functional statements attributed to the acceptable solutions in this Part shall be the objectives andfunctionalstatements listed in Table 9.38.1.1. (See Note A-1.1.2.1.(1).)","For the purpose of compliance with this Code as required in Clause 1.2.1.1.(1)(b) of Division A, the objectives and functional statements attributed to the acceptable solutions in this Part shall be the objectives andfunctionalstatements listed in Table 9.38.1.1. (See Note A-1.1.2.1.(1).)",0.9392282366752625
"Except as permitted by Sentence 3.8.2.3.(2), a barrier-free path of travel from the entrances required by Sentences 3.8.2.2.(1)and 3.8.2.2.(2) to be barrier-free shall be provided throughout the entrance storey and within all other normally occupied floor areas served by a passenger elevator, escalator, inclined moving walk, or other platform-equipped passenger-elevating device. (See Article 3.3.1.7. for additional requirements regarding floor areas above or below the first storey to which a barrier-free path of travel is required.) (See Article 3.3.1.7. for additional requirements regarding floor areas above or below the first storey to which a barrier-free path of travel is required.)","Except as permitted by Sentence 3.8.2.3.(2), a barrier-free path of travel from the entrances required by Sentences 3.8.2.2.(1) and 3.8.2.2.(2) to be barrier-free shall be provided throughout the entrance storey and within all other normally occupied floor areas served by a passenger elevator, escalator, inclined moving walk, or other platform-equipped passenger-elevating device. (See Article 3.3.1.7. for additional requirements regarding floor areas above or below the first storey to which a barrier-free path of travel is required.)","Buildings containing adaptable dwelling units shall be provided with an accessible path of travel conforming to Subsection 3.8.3. to an entrance described in Article 3.8.2.2. and to each adaptable dwelling unit from a sidewalk, roadway or street, where provided, a parking area, where provided, passenger-loading zones, and where an elevator is provided, to an elevator conforming to Article 3.5.2.1., conform to Sentence 3.8.2.2.(6), and provide access to all common facilities.","Buildings containing adaptable dwelling units shall be provided with an accessible path of travel conforming to Subsection 3.8.3. to an entrance described in Article 3.8.2.2. and to each adaptable dwelling unit from a sidewalk, roadway or street, where provided, a parking area, where provided, passenger-loading zones, and where an elevator is provided, to an elevator conforming to Article 3.5.2.1., conform to Sentence 3.8.2.2.(6), and provide access to all common facilities.",0.7914584875106812
"A building conforming to Article 3.2.2.58. shall not contain a Group A, Division 1 or 3, Group B, or Group F, Division 1 major occupancy, or except as provided in Sentence 3.1.3.2.(5), a Group A, Division 2, Group E, or Group F, Division 2 or 3 major occupancy above the second storey. (See Note A-3.1.3.2.(3) to (5).)","A building conforming to Article 3.2.2.58. shall not contain a Group A, Division 1 or 3, Group B, or Group F, Division 1 major occupancy, or except as provided in Sentence 3.1.3.2.(5), a Group A, Division 2, Group E, or Group F, Division 2 or 3 major occupancy above the second storey.","Group A, Division 2 major occupancies, Group E major occupancies, Group F, Division 2 and 3 major occupancies and storage garages located in a building or part of a building within the scope of this Article are permitted to be constructed in accordance with this Article provided the Group A, Division 2 major occupancy, and Group E major occupancy, and Group F, Division 2 and 3 major occupancy is located below the third storey, and the storage garage is located below the fourth storey (See also Sentence 4.4.2.1.(1)). (See Note A-3.2.2.50.(5) and 3.2.2.58.(4).)","Group A, Division 2 major occupancies, Group E major occupancies, Group F, Division 2 and 3 major occupancies and storage garages located in a building or part of a building within the scope of this Article are permitted to be constructed in accordance with this Article provided the Group A, Division 2 major occupancy, and Group E major occupancy, and Group F, Division 2 and 3 major occupancy is located below the third storey, and the storage garage is located below the fourth storey (See also Sentence 4.4.2.1.(1)). (See Note A-3.2.2.50.(5) and 3.2.2.58.(4).)",0.8205508589744568
"Where a fuel-burning appliance is installed in a suite of residential occupancy, a CO alarm shall be installed inside each bedroom, or outside each bedroom, within 5 m of each bedroom door, measured following corridors and doorways.","Where a fuel-burning appliance is installed in a suite of residential occupancy, a CO alarm shall be installed inside each bedroom, or outside each bedroom, within 5 m of each bedroom door, measured following corridors and doorways.","Where a fuel-burning appliance is installed in a suite of residential occupancy, a CO alarm shall be installed inside each bedroom, or outside each bedroom, within 5 m of each bedroom door, measured following corridors and doorways.","Where a fuel-burning appliance is installed in a suite of residential occupancy, a CO alarm shall be installed inside each bedroom, or outside each bedroom, within 5 m of each bedroom door, measured following corridors and doorways.",1.0
"Where a habitable room or space is not provided with natural ventilation as described in Article 9.32.2.2. and is not mechanically cooled, the non-heating-season mechanical ventilation system shall have the capacity to exhaust indoor air from the room or space or to introduce outdoor air to that room or space at a rate of one air change per hour.","Where a habitable room or space is not provided with natural ventilation as described in Article 9.32.2.2. and is not mechanically cooled, the non-heating-season mechanical ventilation system shall have the capacity to exhaust indoor air from the room or space or to introduce outdoor air to that room or space at a rate of one air change per hour.","Where a habitable room or space is not provided with natural ventilation as described in Clause (1)(a), mechanical ventilation shall be provided to exhaust inside air from, or to introduce outside air to, that room or space at the rate of one-half air change per hour if the room or space is mechanically cooled during the non-heating season, or one air change per hour if the room or space is not mechanically cooled during the non-heating season.","Where a habitable room or space is not provided with natural ventilation as described in Clause (1)(a), mechanical ventilation shall be provided to exhaust inside air from, or to introduce outside air to, that room or space at the rate of one-half air change per hour if the room or space is mechanically cooled during the non-heating season, or one air change per hour if the room or space is not mechanically cooled during the non-heating season.",0.812221348285675
