,,"Despite Sentence (1), merchandising or public activities or both may be carried on within the 9 m width where they are approved and they do not endanger life safety or alternative measures are taken to provide life safety.","Despite Sentence (1), merchandising or public activities or both may be carried on within the 9 m width where they are approved and they do not endanger life safety or alternative measures are taken to provide life safety.",0.0
"Except as permitted in Sentences 3.3.3.2.(3)and 3.3.3.2.(4), a clear space of not less than 15 m shall be maintained between stored products and a building on the same property to reduce the risk of fire spreading from the outdoor storage area to the building.","Except as permitted in Sentences 3.3.3.2.(3) and 3.3.3.2.(4), a clear space of not less than 15 m shall be maintained between stored products and a building on the same property to reduce the risk of fire spreading from the outdoor storage area to the building.",,,0.0
,,"Despite Article 3.5.2.1., storage piles of tires or shredded tires in a storage yard shall be located at least 15 m from property lines, at least 15 m from buildings, at least 4.5 m from combustible ground vegetation comprised of grass and weeds, and at least 30 m away from combustible ground vegetation comprised of brush and forested areas.","Despite Article 3.5.2.1., storage piles of tires or shredded tires in a storage yard shall be located (a) at least 15 m from property lines, (b) at least 15 m from buildings, (c) at least 4.5 m from combustible ground vegetation comprised of grass and weeds, (d) and at least 30 m away from combustible ground vegetation comprised of brush and forested areas.",0.0
"Except as permitted in Sentences 3.3.3.2.(3)and 3.3.3.2.(4), a clear space of not less than 15 m shall be maintained between stored products and a building on the same property to reduce the risk of fire spreading from the outdoor storage area to the building.","Except as permitted in Sentences 3.3.3.2.(3) and 3.3.3.2.(4), a clear space of not less than 15 m shall be maintained between stored products and a building on the same property to reduce the risk of fire spreading from the outdoor storage area to the building.",,,0.0
,,Stickered lumber piles in storage yards shall be located at least 15 m from property lines and buildings.,Stickered lumber piles in storage yards shall be located at least 15 m from property lines and buildings.,0.0
,,"Shavings, sawdust and refuse materials shall be burned only in boilers or furnaces, or in incinerators or refuse burners conforming to Subsection 2.6.3.","Shavings, sawdust and refuse materials shall be burned only in boilers or furnaces, or in incinerators or refuse burners conforming to Subsection 2.6.3.",0.0
"Except as provided in Subsection 2.6.2., the burning of materials in an outdoor storage area shall be performed only in a burner that is designed, constructed and maintained in conformance with good engineering practice, and located not less than 15 m from a building or stored products.","Except as provided in part 2., the burning of materials in an outdoor storage area shall be performed only in a burner that is designed, constructed and maintained in conformance with good engineering practice, and located not less than 15 m from a building or stored products.",,,0.0
"Except as provided in Subsection 2.6.2., the burning of materials in an outdoor storage area shall be performed only in a burner that is designed, constructed and maintained in conformance with good engineering practice, and located not less than 15 m from a building or stored products.","Except as provided in part 2., the burning of materials in an outdoor storage area shall be performed only in a burner that is designed, constructed and maintained in conformance with good engineering practice, and located not less than 15 m from a building or stored products.",,,0.0
,,"Refuse burners or incinerators referred to in Article 3.2.2.17. shall be located at least 15 m from buildings, property lines or piles of logs or lumber.","Refuse burners or incinerators referred to in Article 3.2.2.17. shall be located at least 15 m from buildings, property lines or piles of logs or lumber.",0.0
Flammable liquids and combustible liquids shall be stored in conformance with Part 4..,Flammable liquids and combustible liquids shall be stored in conformance with part 4..,The storage and handling of flammable liquids and combustible liquids shall be in conformance with Part 4.,The storage and handling of flammable liquids and combustible liquids shall be in conformance with Part 4.,tensor(0.9658)
Measures to control spilled liquid or solid dangerous goods shall be provided in conformance with Subsection 4.1.6.,Measures to control spilled liquid or solid dangerous goods shall be provided in conformance with part 4.,Measures to control spilled flammable liquids or combustible liquids shall be provided in conformance with Subsection 4.1.6.,Measures to control spilled flammable liquids or combustible liquids shall be provided in conformance with Subsection 4.1.6.,tensor(0.9062)
"Except as provided in Subsection 3.1.1., this Subsection applies to the indoor storage of dangerous goods classified as compressed gases.","Except as provided in part 3., this Subsection applies to the indoor storage of dangerous goods classified as compressed gases.","Subject to Sentences (2) and (3), this Subsection applies to the indoor general storage of combustible solids, noncombustible solids with combustible packaging or storage aids, including storage in bin boxes, shelves or racks.","Subject to Sentences (2) and (3), this Subsection applies to the indoor general storage of combustible solids, noncombustible solids with combustible packaging or storage aids, including storage in bin boxes, shelves or racks.",tensor(0.7796)
,,At least one main aisle having a width equal to at least half the height of the highest adjacent pile and extending the length of the structure shall be provided but in no case shall the width of the aisle be less than 2.4 m.,At least one main aisle having a width equal to at least half the height of the highest adjacent pile and extending the length of the structure shall be provided but in no case shall the width of the aisle be less than 2.4 m.,0.0
"Main access aisles shall extend the length of the storage area where only one main access aisle is provided, or the length or width of the storage area where 2 or more main access aisles are provided.","Main access aisles shall extend the length of the storage area where only one main access aisle is provided, or the length or width of the storage area where 2 or more main access aisles are provided.",,,0.0
,,"A building used for the storage of ammonium nitrate shall not have basements or crawl spaces, or contain open floor drains, tunnels, elevator pits or other pockets which might trap molten ammonium nitrate.","A building used for the storage of ammonium nitrate shall not (a) have basements or crawl spaces, or (b) contain open floor drains, tunnels, elevator pits or other pockets which might trap molten ammonium nitrate.",0.0
"Buildings intended for the storage of ammonium nitrate shall conform to Sentence 3.3.6.6.(3) of Division B of the NBC, have ventilation in conformance with Sentence 3.3.6.6.(4) of Division B of the NBC, and be designed to prevent the ammonium nitrate from coming into contact with building materials that may react with it as described in Sentence 3.3.6.6.(6) of Division B of the NBC.","Buildings intended for the storage of ammonium nitrate shall conform to Sentence 3.3.6.6.(3) of Division B of the NBC, have ventilation in conformance with Sentence 3.3.6.6.(4) of Division B of the NBC, and be designed to prevent the ammonium nitrate from coming into contact with building materials that may react with it as described in Sentence 3.3.6.6.(6) of Division B of the NBC.","A building used for the bulk storage of ammonium nitrate shall be designed to prevent contact with building material that will cause the ammonium nitrate to become unstable, may corrode or deteriorate by reason of contact with the ammonium nitrate, or will become impregnated by ammonium nitrate.","A building used for the bulk storage of ammonium nitrate shall be designed to prevent contact with building material that (a) will cause the ammonium nitrate to become unstable, (b) may corrode or deteriorate by reason of contact with the ammonium nitrate, or (c) will become impregnated by ammonium nitrate.",tensor(0.7966)
"Buildings intended for the storage of ammonium nitrate shall conform to Sentence 3.3.6.6.(3) of Division B of the NBC, have ventilation in conformance with Sentence 3.3.6.6.(4) of Division B of the NBC, and be designed to prevent the ammonium nitrate from coming into contact with building materials that may react with it as described in Sentence 3.3.6.6.(6) of Division B of the NBC.","Buildings intended for the storage of ammonium nitrate shall conform to Sentence 3.3.6.6.(3) of Division B of the NBC, have ventilation in conformance with Sentence 3.3.6.6.(4) of Division B of the NBC, and be designed to prevent the ammonium nitrate from coming into contact with building materials that may react with it as described in Sentence 3.3.6.6.(6) of Division B of the NBC.","A building used for the bulk storage of ammonium nitrate shall be designed to prevent contact with building material that will cause the ammonium nitrate to become unstable, may corrode or deteriorate by reason of contact with the ammonium nitrate, or will become impregnated by ammonium nitrate.","A building used for the bulk storage of ammonium nitrate shall be designed to prevent contact with building material that (a) will cause the ammonium nitrate to become unstable, (b) may corrode or deteriorate by reason of contact with the ammonium nitrate, or (c) will become impregnated by ammonium nitrate.",tensor(0.7966)
,,A building used for the storage of ammonium nitrate shall have not less than 70 cm2 in vent area for each square metre of storage area unless mechanical ventilation is provided.,A building used for the storage of ammonium nitrate shall have not less than 70 cm2 in vent area for each square metre of storage area unless mechanical ventilation is provided.,0.0
"Except as provided in Subsection 2.4.2., smoking shall not be permitted in an outdoor storage area.","Except as provided in Subsection 2.4.2., smoking shall not be permitted in an outdoor storage area.","Smoking shall not take place in storage yards, except as provided in Subsection 2.4.3.","Smoking shall not take place in storage yards, except as provided in Subsection 2.4.3.",tensor(0.8965)
Smoking shall be permitted only under the conditions stated in Subsection 2.4.2.,Smoking shall be permitted only under the conditions stated in part 2.,"Smoking shall not take place in salvage yards, except as provided in Subsection 2.4.3.","Smoking shall not take place in salvage yards, except as provided in Subsection 2.4.3.",tensor(0.7747)
The clearance between the top of storage and the lowest structural members shall not be less than 450 mm.,,"The clearance between the top of storage and the lowest structural members, sprinkler head deflectors or other overhead fire protection system components shall be not less than 450 mm.","The clearance between the top of storage and the lowest structural members, sprinkler head deflectors or other overhead fire protection system components shall be not less than 450 mm.",tensor(0.8721)
The clearance between the top of storage and the ceiling sprinkler deflectors or other overhead fire protection systems shall be in accordance with the standard used for the design of the respective system.,The clearance between the top of storage and the lowest structural members shall not be less than 450 mm. The clearance between the top of storage and the ceiling sprinkler deflectors or other overhead fire protection systems shall be in accordance with the standard used for the design of the respective system.,,,0.0
"In the case of underground storage tanks or piping, the test referred to in Sentence 4.4.3.2.(2) shall be conducted prior to covering the tank or piping system.","In the case of underground storage tanks or piping, the test referred to in Sentence 4.4.3.2.(2) shall be conducted prior to covering the tank or piping system.","At the time of installation, underground storage tanks and associated piping shall be tested for leakage in conformance with Subsections 4.3.15. and 4.4.6.","At the time of installation, underground storage tanks and associated piping shall be tested for leakage in conformance with Subsections 4.3.15. and 4.4.6.",tensor(0.8271)
Vent piping shall be tested for leaks at the commissioning stage in conformance with Clause 4.4.1.2.(1)(a).,Vent piping shall be tested for leaks at the commissioning stage in conformance with Clause 4.4.1.2.(1)(a).,,,0.0
"Except at distilleries covered in Section 4.10., vent piping materials and construction shall conform to Subsections 4.5.2., 4.5.3. and 4.5.5.","Except at distilleries covered in Section 4.10., vent piping materials and construction shall conform to Subsections 4.5.2., 4.5.3. and 4.5.5.","Except at distilleries covered in Section 4.9., vent piping materials and construction shall conform to Subsections 4.4.2., 4.4.3. and 4.4.5.",,tensor(0.9511)
"Except at distilleries covered in Section 4.10., vent piping materials and construction shall conform to Subsections 4.5.2., Subsection 4.5.3.and 4.5.5.",,"Except at distilleries as provided in Section 4.9., vent piping materials and construction shall conform to Subsections 4.4.2., 4.4.3. and 4.4.5.","Except at distilleries as provided in Section 4.9., vent piping materials and construction shall conform to Subsections 4.4.2., 4.4.3. and 4.4.5.",tensor(0.9563)
,,A comparison of the measurements described in Sentences (1) and (2) with meter readings and a computation of any gain or loss of liquid shall be done each time a required measurement is taken.,A comparison of the measurements described in Sentences (1) and (2) with meter readings and a computation of any gain or loss of liquid shall be done each time a required measurement is taken.,0.0
"Investigative action shall be undertaken if the inventory reconciliation described in Sentence 4.4.2.1.(2) indicates the following inexplicable conditions: a monthly loss of 0.5 percent or more of the throughput from an underground storage tank, or 1.0 percent or more of the throughput from an aboveground storage tank, three consecutive losses greater than 200 L/day, and a water level greater than 50 mm.","Investigative action shall be undertaken if the inventory reconciliation described in Sentence 4.4.2.1.(2) indicates the following inexplicable conditions: a monthly loss of 0.5 percent or more of the throughput from an underground storage tank, or 1.0 percent or more of the throughput from an aboveground storage tank, three consecutive losses greater than 200 L/day, and a water level greater than 50 mm.",,,0.0
"If a precision leak detection test referred to in Sentence 4.4.2.1.(10) detects a leak rate exceeding 0.38 L/h on an underground storage tank, the tank shall be considered to be leaking.","If a precision leak detection test referred to in Sentence 4.4.2.1.(10) detects a leak rate exceeding 0.38 L/h on an underground storage tank, the tank shall be considered to be leaking.","Where a leakage test incorporating a liquid test medium, including a flammable liquid or combustible liquid, is performed on an underground storage tank, the tank shall be considered to be leaking when, with compensation for volume differentials caused by effects of temperature and tank shell distortion, the test indicates a liquid loss.","Where a leakage test incorporating a liquid test medium, including a flammable liquid or combustible liquid, is performed on an underground storage tank, the tank shall be considered to be leaking when, with compensation for volume differentials caused by effects of temperature and tank shell distortion, the test indicates a liquid loss.",tensor(0.7784)
"In the case of underground storage tanks or piping, the test referred to in Sentence 4.4.3.2.(2) shall be conducted prior to covering the tank or piping system.","In the case of underground storage tanks or piping, the test referred to in Sentence 4.4.3.2.(2) shall be conducted prior to covering the tank or piping system.","At the time of installation, underground storage tanks and associated piping shall be tested for leakage in conformance with Subsections 4.3.15. and 4.4.6.","At the time of installation, underground storage tanks and associated piping shall be tested for leakage in conformance with Subsections 4.3.15. and 4.4.6.",tensor(0.8271)
"The removal, abandonment in place, disposal or temporary taking out of service of an underground piping system shall be in conformance with good engineering practice. (See Note A-4.3.16.1.(1).)",,"The removal, abandonment in place, disposal or temporary taking out of service of an underground piping system shall be performed in accordance with good engineering practice.","The removal, abandonment in place, disposal or temporary taking out of service of an underground piping system shall be performed in accordance with good engineering practice.",tensor(0.8934)
The maintenance of pressurized piping systems shall be carried out in conformance with good engineering practice. (See Note A-4.5.10.7.(6).) (See Note A-4.6.1.1.),The maintenance of pressurized piping systems shall be carried out in conformance with good engineering practice. (See Note A-4.5.10.7.(6).),,,0.0
"Where a dispenser referred to in Sentence 4.7.3.2.(1) is supplied from an aboveground storage tank an automatically operated valve that is designed to open only when the dispenser is being operated shall be provided at the tank outlet, and an emergency valve shall be provided for the dispenser in conformance with Sentence 4.6.6.3.(1).","Where a dispenser referred to in Sentence 4.7.3.2.(1) is supplied from an aboveground storage tank an automatically operated valve that is designed to open only when the dispenser is being operated shall be provided at the tank outlet, and an emergency valve shall be provided for the dispenser in conformance with Sentence 4.6.6.3.(1).",,,0.0
An emergency valve conforming to ULC CAN/ULC-S651-16 Emergency Valves for Flammable and Combustible Liquids shall be installed in the supply line so that the shear point of the valve is at a level not higher than the base of the dispenser nor more than 25 mm below it.,An emergency valve conforming to ULC CAN/ULC-S651-16 Emergency Valves for Flammable and Combustible Liquids shall be installed in the supply line so that the shear point of the valve is at a level not higher than the base of the dispenser nor more than 25 mm below it.,"Where a dispenser referred to in Sentence (1) is supplied from an aboveground storage tank, an automatically operated valve, that is designed to open only when the dispenser is being operated, shall be provided at the tank outlet, and an emergency valve that complies with CAN/ULC-S651, Standard for Emergency Valves for Flammable and Combustible Liquids shall be installed in the supply line so that the shear point of the valve is not higher than the base of the dispenser and not lower than 25 mm below the base of the dispenser.","Where a dispenser referred to in Sentence (1) is supplied from an aboveground storage tank, an automatically operated valve, that is designed to open only when the dispenser is being operated, shall be provided at the tank outlet, and an emergency valve that complies with CAN/ULC-S651, ""Standard for Emergency Valves for Flammable and Combustible Liquids"" shall be installed in the supply line so that the shear point of the valve is not higher than the base of the dispenser and not lower than 25 mm below the base of the dispenser.",tensor(0.8617)
A telephone or other clearly identified means to notify the fire department shall be provided in a location readily accessible to the user.,A telephone or other clearly identified means to notify the fire department shall be provided in a location readily accessible to the user.,The telephone number of the fire department and location of the nearest telephone shall be posted conspicuously in attended locations.,The telephone number of the fire department and location of the nearest telephone shall be posted conspicuously in attended locations.,tensor(0.8544)
Process plants where Class I and II liquids are handled shall not have basements or covered pits.,Process plants where Class I and II liquids are handled shall not have basements or covered pits.,,,0.0
,,"Except as permitted in Article 4.1.5.9., Class I liquids shall not be handled or used in basements.","Except as permitted in Article 4.1.5.9., Class I liquids shall not be handled or used in basements.",0.0
"Quantities of flammable liquids and combustible liquids in excess of those permitted in Sentence 5.5.5.1.(1) shall be stored in cabinets conforming to Subsection 4.2.10. except that, in laboratories described in Clause 5.5.5.1.(1)(b), the total quantity of flammable liquids and combustible liquids stored in such cabinets shall not exceed the quantity permitted for one cabinet, or a room conforming to Subsection 4.2.9.","Quantities of flammable liquids and combustible liquids in excess of those permitted in Sentence 5.5.5.1.(1) shall be stored in cabinets conforming to part 4. except that, in laboratories described in Sentence 5.5.5.1.(1), the total quantity of flammable liquids and combustible liquids stored in such cabinets shall not exceed the quantity permitted for one cabinet, or a room conforming to part 4.",,,0.0
,,Quantities in excess of those permitted in Sentence (2) shall be stored in cabinets conforming to Subsection 4.2.10. or in a room conforming to Subsection 4.2.9.,Quantities in excess of those permitted in Sentence (2) shall be stored in cabinets conforming to Subsection 4.2.10. or in a room conforming to Subsection 4.2.9.,0.0
"Except as provided in Sentence 5.5.4.3.(2), the ventilation system for a power-ventilated enclosure required in Article 5.5.4.2. shall conform to Article 6.3.4.3. of Division B of the NBC.","Except as provided in Sentence 5.5.4.3.(2), the ventilation system for a power-ventilated enclosure required in Article 5.5.4.2. shall conform to Article 6.3.4.3. of Division B of the NBC.",,,0.0
,,"The ventilation system for a power-ventilated enclosure required in Article 4.12.8.3. shall conform to NFPA 91, Standard for Exhaust Systems for Air Conveying of Vapors, Gases, Mists, and Noncombustible Particulate Solids, provide continuous exhaust ventilation at an air velocity sufficient to prevent the accumulation of explosive vapours or of combustible or reactive deposits in the power-ventilated enclosure and its exhaust duct system, confine flammable vapours to the area where they are generated and exhaust them to the outdoors, not return the exhausted air to the building, and be provided with well identified control switches that are located outside of the power-ventilated enclosure, and readily accessible in case of an emergency.","The ventilation system for a power-ventilated enclosure required in Article 4.12.8.3. shall (a) conform to NFPA 91, Standard for Exhaust Systems for Air Conveying of Vapors, Gases, Mists, and Noncombustible Particulate Solids , (b) provide continuous exhaust ventilation at an air velocity sufficient to prevent the accumulation of explosive vapours or of combustible or reactive deposits in the power-ventilated enclosure and its exhaust duct system, (c) confine flammable vapours to the area where they are generated and exhaust them to the outdoors, (d) not return the exhausted air to the building, and (e) be provided with well identified control switches that are (i) located outside of the power-ventilated enclosure, and (ii) readily accessible in case of an emergency.",0.0
,,"Electrical installations shall conform to the Electrical Safety Code made under the Electricity Act, 1998.","Electrical installations shall conform to the Electrical Safety Code made under the Electricity Act, 1998.",0.0
"Electrical installations shall conform to the appropriate provincial or territorial regulations or municipal bylaws, or in the absence of such regulations, to CSA C22.1-12 Canadian Electrical Code, Part I except that alternatives to these requirements are permitted as described in Clause 1.2.1.1.(1)(b) in areas other than those described in Article 5.1.2.1.","Electrical installations shall conform to the appropriate provincial or territorial regulations or municipal bylaws, or in the absence of such regulations, to CSA C22.1-12 Canadian Electrical Code, Part I except that alternatives to these requirements are permitted as described in Sentence 1.2.1.1.(1) in areas other than those described in Article 5.1.2.1.",,,0.0
Valves on cylinders for dangerous goods classified as compressed gases shall be closed when not in use.,Valves on cylinders for dangerous goods classified as compressed gases shall be closed when not in use.,"Gas fuel cylinders, whether full or empty, whose valves are not in a recessed or protected location shall have their caps in place and their valves tightly closed when not in actual use.","Gas fuel cylinders, whether full or empty, whose valves are not in a recessed or protected location shall have their caps in place and their valves tightly closed when not in actual use.",tensor(0.7968)
