National Sentence Text,Matched National Sentence (Variation),P/T Sentence Text,Matched P/T Sentence (Variation),Similarity
"Where a sign, notice, placard or information is required to be posted, it shall be clearly legible, and except as provided in Sentence 2.1.4.1.(2), permanently mounted in a conspicuous or prominent location in proximity to the situation to which it refers.","Where a sign, notice, placard or information is required to be posted, it shall be clearly legible, and except as provided in Sentence 2.1.4.1.(2), permanently mounted in a conspicuous or prominent location in proximity to the situation to which it refers.","When the occupant load has been determined using Subclause 2.7.1.4.(3)(b)(i), a permanent sign indicating the occupant load shall be posted in a conspicuous location.","When the occupant load has been determined using Subclause 2.7.1.4.(3)(b)(i), a permanent sign indicating the occupant load shall be posted in a conspicuous location.",tensor(0.7709)
"Except as otherwise required by this Code, portable extinguishers shall be selected and installed in accordance with NFPA 10-2013 Portable Fire Extinguishers","Except as otherwise required by this Code, portable extinguishers shall be selected and installed in accordance with NFPA 10-2013 Portable Fire Extinguishers",Listed portable extinguishers shall be installed when replacing or adding new extinguishers.,Listed portable extinguishers shall be installed when replacing or adding new extinguishers.,tensor(0.7711)
"Except where they are equipped with hold-open devices conforming to the NBC, doors in fire separations that are required to be equipped with self-closing devices shall be inspected at intervals not greater than 24 h to ensure that they remain in the closed position when not in use.","Except where they are equipped with hold-open devices conforming to the NBC, doors in fire separations that are required to be equipped with self-closing devices shall be inspected at intervals not greater than 24 h to ensure that they remain in the closed position when not in use.",,,0.0
,,A door in a fire separation shall be checked as frequently as necessary to ensure that the door remains closed.,A door in a fire separation shall be checked as frequently as necessary to ensure that the door remains closed.,0.0
"Except where they are equipped with hold-open devices conforming to the NBC, doors in fire separations that are required to be equipped with self-closing devices shall be inspected at intervals not greater than 24 h to ensure that they remain in the closed position when not in use.","Except where they are equipped with hold-open devices conforming to the NBC, doors in fire separations that are required to be equipped with self-closing devices shall be inspected at intervals not greater than 24 h to ensure that they remain in the closed position when not in use.",,,0.0
,,"Sentences (1) and (2) do not apply to a door designed to close automatically in the event of a fire emergency, or a door for which an approved fire safety plan contains provisions for closing in the event of a fire emergency.","Sentences (1) and (2) do not apply to (a) a door designed to close automatically in the event of a fire emergency, or (b) a door for which an approved fire safety plan contains provisions for closing in the event of a fire emergency.",0.0
"Except for fires used for cooking in fireplaces, grills or barbecues, open air fires shall not be set unless appropriate measures are taken to limit their spread. (See Note A-2.4.5.1.(1).)","Except for fires used for cooking in fireplaces, grills or barbecues, open air fires shall not be set unless appropriate measures are taken to limit their spread. (See Note A-2.4.5.1.(1).)",,,0.0
,,"Open-air burning shall not take place unless it has been approved, or the open-air burning consists of a small, confined fire that is used to cook food on a grill, barbecue or spit, commensurate with the type and quantity of food being cooked, and supervised at all times.","Open-air burning shall not take place unless (a) it has been approved, or (b) the open-air burning consists of a small, confined fire that is (i) used to cook food on a grill, barbecue or spit, (ii) commensurate with the type and quantity of food being cooked, and (iii) supervised at all times.",0.0
"When nonfixed seats are provided in assembly occupancies, except as provided in Sentence 2.7.1.5.(3), the seats shall be arranged in rows having an unobstructed passage of not less than 400 mm between rows measured horizontally between plumb lines from the backs of the seats in one row and the edges of the furthest forward projection of the seats in the next row behind in the unoccupied position, except as provided in Sentence 2.7.1.5.(2), aisles shall be located so that there are not more than 7 seats between every seat and the nearest aisle, except as provided in Sentence 2.7.1.5.(2), the clear width of an aisle in millimetres shall be not less than the greater of 1 100 or the product of the number of seats served by that aisle and 6.1, the width of an aisle is permitted to be reduced to not less than 750 mm when serving 60 seats or fewer, dead-end aisles shall not be longer than 6 m, and except as provided in Sentence 2.7.1.5.(3), when the occupant load exceeds 200 persons, the seats in a row shall be fastened together in units of no fewer than 8 seats, or where there are 7 seats or fewer in a row, all the seats in the row shall be fastened together.","When nonfixed seats are provided in assembly occupancies, except as provided in Sentence 2.7.1.5.(3), the seats shall be arranged in rows having an unobstructed passage of not less than 400 mm between rows measured horizontally between plumb lines from the backs of the seats in one row and the edges of the furthest forward projection of the seats in the next row behind in the unoccupied position, except as provided in Sentence 2.7.1.5.(2), aisles shall be located so that there are not more than 7 seats between every seat and the nearest aisle, except as provided in Sentence 2.7.1.5.(2), the clear width of an aisle in millimetres shall be not less than the greater of 1 100 or the product of the number of seats served by that aisle and 6.1, the width of an aisle is permitted to be reduced to not less than 750 mm when serving 60 seats or fewer, dead-end aisles shall not be longer than 6 m, and except as provided in Sentence 2.7.1.5.(3), when the occupant load exceeds 200 persons, the seats in a row shall be fastened together in units of no fewer than 8 seats, or where there are 7 seats or fewer in a row, all the seats in the row shall be fastened together.","If non-fixed row seating is provided for more than 200 persons in an assembly occupancy, the seats shall be fastened in units of not less than 4 and not more than 12 seats, or each end seat abutting an aisle shall be securely fastened to the floor.","If non-fixed row seating is provided for more than 200 persons in an assembly occupancy, the seats shall be fastened in units of not less than 4 and not more than 12 seats, or each end seat abutting an aisle shall be securely fastened to the floor.",tensor(0.8083)
,,Nonfixed row seating in an assembly occupancy shall be arranged as described in Sentences (2) to (8).,Nonfixed row seating in an assembly occupancy shall be arranged as described in Sentences (2) to (8).,0.0
,,Aisles leading to exits shall be provided so that there are not more than seven seats between any seat and the nearest aisle.,Aisles leading to exits shall be provided so that there are not more than seven seats between any seat and the nearest aisle.,0.0
"When nonfixed seats are provided in assembly occupancies, except as provided in Sentence 2.7.1.5.(3), the seats shall be arranged in rows having an unobstructed passage of not less than 400 mm between rows measured horizontally between plumb lines from the backs of the seats in one row and the edges of the furthest forward projection of the seats in the next row behind in the unoccupied position, except as provided in Sentence 2.7.1.5.(2), aisles shall be located so that there are not more than 7 seats between every seat and the nearest aisle, except as provided in Sentence 2.7.1.5.(2), the clear width of an aisle in millimetres shall be not less than the greater of 1 100 or the product of the number of seats served by that aisle and 6.1, the width of an aisle is permitted to be reduced to not less than 750 mm when serving 60 seats or fewer, dead-end aisles shall not be longer than 6 m, and except as provided in Sentence 2.7.1.5.(3), when the occupant load exceeds 200 persons, the seats in a row shall be fastened together in units of no fewer than 8 seats, or where there are 7 seats or fewer in a row, all the seats in the row shall be fastened together.","When nonfixed seats are provided in assembly occupancies, except as provided in Sentence 2.7.1.5.(3), the seats shall be arranged in rows having an unobstructed passage of not less than 400 mm between rows measured horizontally between plumb lines from the backs of the seats in one row and the edges of the furthest forward projection of the seats in the next row behind in the unoccupied position, except as provided in Sentence 2.7.1.5.(2), aisles shall be located so that there are not more than 7 seats between every seat and the nearest aisle, except as provided in Sentence 2.7.1.5.(2), the clear width of an aisle in millimetres shall be not less than the greater of 1 100 or the product of the number of seats served by that aisle and 6.1, the width of an aisle is permitted to be reduced to not less than 750 mm when serving 60 seats or fewer, dead-end aisles shall not be longer than 6 m, and except as provided in Sentence 2.7.1.5.(3), when the occupant load exceeds 200 persons, the seats in a row shall be fastened together in units of no fewer than 8 seats, or where there are 7 seats or fewer in a row, all the seats in the row shall be fastened together.","If non-fixed row seating is provided for more than 200 persons in an assembly occupancy, the seats shall be fastened in units of not less than 4 and not more than 12 seats, or each end seat abutting an aisle shall be securely fastened to the floor.","If non-fixed row seating is provided for more than 200 persons in an assembly occupancy, the seats shall be fastened in units of not less than 4 and not more than 12 seats, or each end seat abutting an aisle shall be securely fastened to the floor.",tensor(0.8083)
"When nonfixed seats are provided in assembly occupancies, except as provided in Sentence 2.7.1.5.(3), the seats shall be arranged in rows having an unobstructed passage of not less than 400 mm between rows measured horizontally between plumb lines from the backs of the seats in one row and the edges of the furthest forward projection of the seats in the next row behind in the unoccupied position, except as provided in Sentence 2.7.1.5.(2), aisles shall be located so that there are not more than 7 seats between every seat and the nearest aisle, except as provided in Sentence 2.7.1.5.(2), the clear width of an aisle in millimetres shall be not less than the greater of 1 100 or the product of the number of seats served by that aisle and 6.1, the width of an aisle is permitted to be reduced to not less than 750 mm when serving 60 seats or fewer, dead-end aisles shall not be longer than 6 m, and except as provided in Sentence 2.7.1.5.(3), when the occupant load exceeds 200 persons, the seats in a row shall be fastened together in units of no fewer than 8 seats, or where there are 7 seats or fewer in a row, all the seats in the row shall be fastened together.","When nonfixed seats are provided in assembly occupancies, except as provided in Sentence 2.7.1.5.(3), the seats shall be arranged in rows having an unobstructed passage of not less than 400 mm between rows measured horizontally between plumb lines from the backs of the seats in one row and the edges of the furthest forward projection of the seats in the next row behind in the unoccupied position, except as provided in Sentence 2.7.1.5.(2), aisles shall be located so that there are not more than 7 seats between every seat and the nearest aisle, except as provided in Sentence 2.7.1.5.(2), the clear width of an aisle in millimetres shall be not less than the greater of 1 100 or the product of the number of seats served by that aisle and 6.1, the width of an aisle is permitted to be reduced to not less than 750 mm when serving 60 seats or fewer, dead-end aisles shall not be longer than 6 m, and except as provided in Sentence 2.7.1.5.(3), when the occupant load exceeds 200 persons, the seats in a row shall be fastened together in units of no fewer than 8 seats, or where there are 7 seats or fewer in a row, all the seats in the row shall be fastened together.","If non-fixed row seating is provided for more than 200 persons in an assembly occupancy, the seats shall be fastened in units of not less than 4 and not more than 12 seats, or each end seat abutting an aisle shall be securely fastened to the floor.","If non-fixed row seating is provided for more than 200 persons in an assembly occupancy, the seats shall be fastened in units of not less than 4 and not more than 12 seats, or each end seat abutting an aisle shall be securely fastened to the floor.",tensor(0.8083)
,,"The minimum clear width of aisles shall be at least 1100 mm, except as permitted by Sentence (4).","The minimum clear width of aisles shall be at least 1100 mm, except as permitted by Sentence (4).",0.0
"When nonfixed seats are provided in assembly occupancies, except as provided in Sentence 2.7.1.5.(3), the seats shall be arranged in rows having an unobstructed passage of not less than 400 mm between rows measured horizontally between plumb lines from the backs of the seats in one row and the edges of the furthest forward projection of the seats in the next row behind in the unoccupied position, except as provided in Sentence 2.7.1.5.(2), aisles shall be located so that there are not more than 7 seats between every seat and the nearest aisle, except as provided in Sentence 2.7.1.5.(2), the clear width of an aisle in millimetres shall be not less than the greater of 1 100 or the product of the number of seats served by that aisle and 6.1, the width of an aisle is permitted to be reduced to not less than 750 mm when serving 60 seats or fewer, dead-end aisles shall not be longer than 6 m, and except as provided in Sentence 2.7.1.5.(3), when the occupant load exceeds 200 persons, the seats in a row shall be fastened together in units of no fewer than 8 seats, or where there are 7 seats or fewer in a row, all the seats in the row shall be fastened together.","When nonfixed seats are provided in assembly occupancies, except as provided in Sentence 2.7.1.5.(3), the seats shall be arranged in rows having an unobstructed passage of not less than 400 mm between rows measured horizontally between plumb lines from the backs of the seats in one row and the edges of the furthest forward projection of the seats in the next row behind in the unoccupied position, except as provided in Sentence 2.7.1.5.(2), aisles shall be located so that there are not more than 7 seats between every seat and the nearest aisle, except as provided in Sentence 2.7.1.5.(2), the clear width of an aisle in millimetres shall be not less than the greater of 1 100 or the product of the number of seats served by that aisle and 6.1, the width of an aisle is permitted to be reduced to not less than 750 mm when serving 60 seats or fewer, dead-end aisles shall not be longer than 6 m, and except as provided in Sentence 2.7.1.5.(3), when the occupant load exceeds 200 persons, the seats in a row shall be fastened together in units of no fewer than 8 seats, or where there are 7 seats or fewer in a row, all the seats in the row shall be fastened together.","If non-fixed row seating is provided for more than 200 persons in an assembly occupancy, the seats shall be fastened in units of not less than 4 and not more than 12 seats, or each end seat abutting an aisle shall be securely fastened to the floor.","If non-fixed row seating is provided for more than 200 persons in an assembly occupancy, the seats shall be fastened in units of not less than 4 and not more than 12 seats, or each end seat abutting an aisle shall be securely fastened to the floor.",tensor(0.8083)
,,"Aisles required in Sentence (3) may be reduced in width to 750 mm when serving 60 seats or less, or 900 mm when serving seats on one side only.","Aisles required in Sentence (3) may be reduced in width to 750 mm when serving 60 seats or less, or 900 mm when serving seats on one side only.",0.0
"Emergency lighting and exit signs shall be maintained in operating condition, in conformance with Section 6.5.","Emergency lighting and exit signs shall be maintained in operating condition, in conformance with Section 6.5.",,,0.0
,,"Lighting provided for illumination in exits and access to exits, including corridors used by the public, shall be maintained.","Lighting provided for illumination in exits and access to exits, including corridors used by the public, shall be maintained.",0.0
"In buildings or areas described in Article 2.8.1.1., a fire safety plan conforming to this Section shall be prepared in cooperation with the fire department and other applicable regulatory authorities and shall include the emergency procedures to be used in case of fire, including sounding the fire alarm (see Note A-2.8.2.1.(1)(a)(i)), notifying the fire department, instructing occupants on procedures to be followed when the fire alarm sounds, evacuating occupants, including special provisions for persons requiring assistance (see Note A-2.8.2.1.(1)(a)(iv)), confining, controlling and extinguishing the fire, the appointment and organization of designated supervisory staff to carry out fire safety duties, the training of supervisory staff and other occupants in their responsibilities for fire safety, documents, including diagrams, showing the type, location and operation of the building fire emergency systems, the holding of fire drills, the control of fire hazards in the building, and the inspection and maintenance of building facilities provided for the safety of occupants.","In buildings or areas described in Article 2.8.1.1., a fire safety plan conforming to this Section shall be prepared in cooperation with the fire department and other applicable regulatory authorities and shall include the emergency procedures to be used in case of fire, including sounding the fire alarm (see Note A-2.8.2.1.(1)(a)(i)), notifying the fire department, instructing occupants on procedures to be followed when the fire alarm sounds, evacuating occupants, including special provisions for persons requiring assistance (see Note A-2.8.2.1.(1)(a)(iv)), confining, controlling and extinguishing the fire, the appointment and organization of designated supervisory staff to carry out fire safety duties, the training of supervisory staff and other occupants in their responsibilities for fire safety, documents, including diagrams, showing the type, location and operation of the building fire emergency systems, the holding of fire drills, the control of fire hazards in the building, and the inspection and maintenance of building facilities provided for the safety of occupants.","A fire safety plan shall provide for the emergency procedures to be followed in case of fire, including sounding the fire alarm, notifying the fire department, instructing occupants on procedures to be followed when the fire alarm sounds, evacuating occupants, including special provisions for persons requiring assistance, procedures for use of elevators, and confining, controlling and extinguishing the fire, provide for the appointment and organization of supervisory staff to carry out fire safety duties, provide for the training of supervisory staff and the instruction of other occupants in their responsibilities for fire safety, include documents and diagrams showing the type, location and operation of the building fire emergency systems, provide for the holding of fire drills and set out fire drill procedures, provide for the control of fire hazards in the building, provide for the maintenance of building facilities provided for the safety of occupants, and provide for alternative measures to be provided for the safety of occupants during a shutdown of any or all fire protection equipment or systems.","A fire safety plan shall (a) provide for the emergency procedures to be followed in case of fire, including (i) sounding the fire alarm, (ii) notifying the fire department, (iii) instructing occupants on procedures to be followed when the fire alarm sounds, (iv) evacuating occupants, including special provisions for persons requiring assistance, (v) procedures for use of elevators, and (vi) confining, controlling and extinguishing the fire, (b) provide for the appointment and organization of supervisory staff to carry out fire safety duties, (c) provide for the training of supervisory staff and the instruction of other occupants in their responsibilities for fire safety, (d) include documents and diagrams showing the type, location and operation of the building fire emergency systems, (e) provide for the holding of fire drills and set out fire drill procedures, (f) provide for the control of fire hazards in the building, (g) provide for the maintenance of building facilities provided for the safety of occupants, and (h) provide for alternative measures to be provided for the safety of occupants during a shutdown of any or all fire protection equipment or systems.",tensor(0.8324)
A fire safety plan conforming to Section 2.8. and Sentences 3.3.2.9.(2)and 3.3.2.9.(3) shall be prepared.,A fire safety plan conforming to Section 2.8. and Sentences 3.3.2.9.(2) and 3.3.2.9.(3) shall be prepared.,"A fire safety plan shall be prepared, approved and implemented in buildings and premises to which this Section applies.","A fire safety plan shall be prepared, approved and implemented in buildings and premises to which this Section applies.",tensor(0.8049)
Flame-retardant treatments shall be renewed as often as is required to ensure that the material will pass the match flame test in NFPA 705-2013 Field Flame Test for Textiles and Films (See Note A-2.3.2.2.(1).),Flame-retardant treatments shall be renewed as often as is required to ensure that the material will pass the match flame test in NFPA 705-2013 Field Flame Test for Textiles and Films (See Note A-2.3.2.2.(1).),"Flame retardant treatments shall be renewed as often as required to ensure that the material will pass the match flame test in NFPA 705, Recommended Practice for a Field Flame Test for Textiles and Films.","Flame retardant treatments shall be renewed as often as required to ensure that the material will pass the match flame test in NFPA 705, ""Recommended Practice for a Field Flame Test for Textiles and Films"".",tensor(0.9431)
,,"Flameproofing treatments shall be renewed as often as necessary to ensure that the material will pass the match flame test in NFPA 705, Recommended Practice for a Field Flame Test for Textiles and Films.","Flameproofing treatments shall be renewed as often as necessary to ensure that the material will pass the match flame test in NFPA 705, ""Recommended Practice for a Field Flame Test for Textiles and Films"".",0.0
"Flammable liquids and combustible liquids shall be classified, stored and handled in conformance with Part 4..","Flammable liquids and combustible liquids shall be classified, stored and handled in conformance with part 4.","The storage, handling and use of flammable liquids and combustible liquids shall meet the requirements of Part 4.","The storage, handling and use of flammable liquids and combustible liquids shall meet the requirements of Part 4.",tensor(0.9331)
Flammable liquids and combustible liquids shall be stored in conformance with Part 4. and in areas inaccessible to children.,,Flammable liquids and combustible liquids shall be stored in conformance with Part 4 and in areas inaccessible to children.,Flammable liquids and combustible liquids shall be stored in conformance with Part 4 and in areas inaccessible to children.,tensor(0.9976)
"When a covered mall having a width of not less than 9 m has been provided for the purpose of considering each portion of the building separated by the mall as a separate building, merchandising or public activities are permitted within the required 9 m width provided alternative protection is installed in conformance with Article 1.2.1.1..","When a covered mall having a width of not less than 9 m has been provided for the purpose of considering each portion of the building separated by the mall as a separate building, merchandising or public activities are permitted within the required 9 m width provided alternative protection is installed in conformance with Article 1.2.1.1..","When a covered mall having a width of 9 m or more has been provided for the purpose of considering each portion of the building separated by the mall as a separate building, no merchandising or public activities shall be carried on within the 9 m width.","When a covered mall having a width of 9 m or more has been provided for the purpose of considering each portion of the building separated by the mall as a separate building, no merchandising or public activities shall be carried on within the 9 m width.",tensor(0.8718)
