2015,SK,NBC,Div B,,,,NBC SKS2015,Div B,3.8.2.12.(1),Residential Occupancies,"Notwithstanding Clause 3.8.2.8.(2)(a), in a building of residential occupancy, except where dwelling units are intended to be individually controlled by separate owners, at least the greater of a) one, or b) 5% of the suites required to be accessible by a barrier-free path of travel shall be barrier-free in conformance with Article 3.8.3.22. (See Article 9.5.2.3.).",,P/T Only,No,,,,3,3.8.2.12,3.8,3.8.2,3.8.2.12.(1),,,
2015,SK,NBC,Div B,,,,NBC SKS2015,Div B,3.8.3.22.(1),Residential Occupancies,"Except as provided in this Article, suites within a residential occupancy that are required to be barrier-free shall conform to the applicable requirements of this Article.",,P/T Only,No,,,,3,3.8.3.22,3.8,3.8.3,3.8.3.22.(1),,,
2015,SK,NBC,Div B,,,,NBC SKS2015,Div B,3.8.3.22.(2),Residential Occupancies,"In washrooms there shall be a floor space of at least 1 500 mm by 1 500 mm with no encroachment other than the water closet, a door that swings outward, unless sufficient room is provided within the washroom to permit the door to be closed without interfering with a wheelchair, slides, or is a solid folding door, a water closet that conforms to Clauses 3.8.3.11.(1)(d) and (e) and Sentence 3.8.3.13.(1), a lavatory that conforms to Article 3.8.3.15., where a bathtub is provided, a bathtub equipped with faucet handles of the lever type without spring loading, a pressure equalizing valve or an automatic thermostatic mixing valve controlled by a lever or other device operable with a closed fist from the seated position, a recessed soap holder that is within reach of a person in a seated position, an integral slip-resistant bottom, grab bars that have A) a horizontal section not less than 900 mm in length mounted on the back wall not less than 150 mm nor more than 300 mm above the rim of the bathtub, and B) a vertical section continued from the horizontal section to rise not less than 600 mm from the horizontal section and located not less than 275 mm nor more than 325 mm from the end of the bathtub at which the controls are located, and where a shower is provided, a shower equipped A) without shower doors, and B) with a hand-held shower head with not less than 1 500 mm of flexible hose, located adjacent to the faucets and controls so that it can be reached from the seated position and equipped with a support so that it can operate as a fixed shower head.",,P/T Only,No,,,,3,3.8.3.22,3.8,3.8.3,3.8.3.22.(2),,,
2015,SK,NBC,Div B,,,,NBC SKS2015,Div B,3.8.3.22.(3),Residential Occupancies,"In kitchens there shall be a clearance of not less than 1 500 mm between counters and all opposing base cabinets, countertops, appliances or walls, and a clear turning circle of not less than 1 500 mm in diameter below countertop height.",,P/T Only,No,,,,3,3.8.3.22,3.8,3.8.3,3.8.3.22.(3),,,
2015,SK,NBC,Div B,,,,NBC SKS2015,Div B,3.8.3.22.(4),Residential Occupancies,In sleeping rooms there shall be a clear turning circle of not less than 1 500 mm in diameter on one side of the bed.,,P/T Only,No,,,,3,3.8.3.22,3.8,3.8.3,3.8.3.22.(4),,,
2015,SK,NBC,Div B,,,,NBC SKS2015,Div B,3.8.3.22.(5),Residential Occupancies,Balconies shall be barrier-free and shall conform to the size requirements of Sentence 3.3.1.7.(4).,,P/T Only,No,,,,3,3.8.3.22,3.8,3.8.3,3.8.3.22.(5),,,
2015,SK,NBC,Div B,,,,NBC SKS2015,Div B,3.8.3.22.(6),Residential Occupancies,"Kitchen sinks, laundry sinks and other types of sinks shall have faucet handles of the lever type without spring loading, no sharp edges or rough corners, and all exposed pipes 1 200 mm or less above the floor insulated or otherwise protected where they may constitute a burn hazard.",,P/T Only,No,,,,3,3.8.3.22,3.8,3.8.3,3.8.3.22.(6),,,
2015,SK,NBC,Div B,,,,NBC SKS2015,Div B,8.1.1.4.(1),Occupational Health and Safety,"In the case of conflict between the provisions of this part and The Occupational Health and Safety Regulations, 1996, the provisions of The Occupational Health and Safety Regulations, 1996 govern.",,P/T Only,No,,,SK will maintain OHS Regs as having prcedence over the NBC and take as an exception.,8,8.1.1.4,8.1,8.1.1,8.1.1.4.(1),,,
